url	passage	tokenid	token	form	lexeme
https://lingualatina.github.io/texts/browsable/hyginus/102a/	102a.2	102a.2.0	ob	uninflected preposition	ls.n31564:ob
https://lingualatina.github.io/texts/browsable/hyginus/102a/	102a.2	102a.2.1	id	pronoun: neuter nominative singular	ls.n25029:is
https://lingualatina.github.io/texts/browsable/hyginus/102a/	102a.2	102a.2.1	id	pronoun: neuter accusative singular	ls.n25029:is
https://lingualatina.github.io/texts/browsable/hyginus/102a/	102a.2	102a.2.2	beneficium	noun: neuter nominative singular	ls.n5180:beneficium
https://lingualatina.github.io/texts/browsable/hyginus/102a/	102a.2	102a.2.2	beneficium	noun: neuter accusative singular	ls.n5180:beneficium
https://lingualatina.github.io/texts/browsable/hyginus/102a/	102a.2	102a.2.2	beneficium	noun: neuter vocative singular	ls.n5180:beneficium
https://lingualatina.github.io/texts/browsable/hyginus/102a/	102a.2	102a.2.3	Hercules	noun: masculine nominative singular	ls.n20511:Hercules
https://lingualatina.github.io/texts/browsable/hyginus/102a/	102a.2	102a.2.3	Hercules	noun: masculine nominative plural	ls.n20511:Hercules
https://lingualatina.github.io/texts/browsable/hyginus/102a/	102a.2	102a.2.4	suas	adjective: feminine accusative plural positive	ls.n47174:suus
https://lingualatina.github.io/texts/browsable/hyginus/102a/	102a.2	102a.2.5	sagittas	noun: feminine accusative plural	ls.n42264:sagitta
https://lingualatina.github.io/texts/browsable/hyginus/102a/	102a.2	102a.2.6	diuinas	adjective: feminine accusative plural positive	ls.n14573:divinus
https://lingualatina.github.io/texts/browsable/hyginus/102a/	102a.2	102a.2.7	ei	pronoun: masculine dative singular	ls.n25029:is
https://lingualatina.github.io/texts/browsable/hyginus/102a/	102a.2	102a.2.7	ei	pronoun: feminine dative singular	ls.n25029:is
https://lingualatina.github.io/texts/browsable/hyginus/102a/	102a.2	102a.2.7	ei	pronoun: neuter dative singular	ls.n25029:is
https://lingualatina.github.io/texts/browsable/hyginus/102a/	102a.2	102a.2.7	ei	pronoun: masculine nominative plural	ls.n25029:is
https://lingualatina.github.io/texts/browsable/hyginus/102a/	102a.2	102a.2.8	donauit	finite verb: third singular perfect indicative active	ls.n14735:dono
https://lingualatina.github.io/texts/browsable/hyginus/102a/	102a.2	102a.2.8_0	.		ls.null
https://lingualatina.github.io/texts/browsable/hyginus/102a/	102a.2	102a.2.9	sed	uninflected conjunction	ls.n43291:sed1
https://lingualatina.github.io/texts/browsable/hyginus/102a/	102a.2	102a.2.10	cum	uninflected preposition	ls.n11872:cum1
https://lingualatina.github.io/texts/browsable/hyginus/102a/	102a.2	102a.2.11	Achiui	adjective: masculine nominative plural positive	ls.n503:Achivus
https://lingualatina.github.io/texts/browsable/hyginus/102a/	102a.2	102a.2.11	Achiui	adjective: masculine genitive singular positive	ls.n503:Achivus
https://lingualatina.github.io/texts/browsable/hyginus/102a/	102a.2	102a.2.11	Achiui	adjective: masculine vocative plural positive	ls.n503:Achivus
https://lingualatina.github.io/texts/browsable/hyginus/102a/	102a.2	102a.2.11	Achiui	adjective: neuter genitive singular positive	ls.n503:Achivus
https://lingualatina.github.io/texts/browsable/hyginus/102a/	102a.2	102a.2.12	ex	uninflected conjunction	ls.n16519:ex
https://lingualatina.github.io/texts/browsable/hyginus/102a/	102a.2	102a.2.13	uulnere	noun: neuter ablative singular	ls.n51428:vulnus
https://lingualatina.github.io/texts/browsable/hyginus/102a/	102a.2	102a.2.14	taetrum		ls.null
https://lingualatina.github.io/texts/browsable/hyginus/102a/	102a.2	102a.2.15	odorem		ls.null
https://lingualatina.github.io/texts/browsable/hyginus/102a/	102a.2	102a.2.16	ferre	finite verb: second singular present imperative passive	ls.n17964:fero
https://lingualatina.github.io/texts/browsable/hyginus/102a/	102a.2	102a.2.16	ferre	finite verb: second singular present indicative passive	ls.n17964:fero
https://lingualatina.github.io/texts/browsable/hyginus/102a/	102a.2	102a.2.17	non	adverb: positive degree	ls.n31151:non
https://lingualatina.github.io/texts/browsable/hyginus/102a/	102a.2	102a.2.18	possent	finite verb: third plural imperfect subjunctive active	ls.n37193:possum
https://lingualatina.github.io/texts/browsable/hyginus/102a/	102a.2	102a.2.18_0	,		ls.null
https://lingualatina.github.io/texts/browsable/hyginus/102a/	102a.2	102a.2.19	iussu	noun: masculine dative singular	ls.n25409:jussus2
https://lingualatina.github.io/texts/browsable/hyginus/102a/	102a.2	102a.2.19	iussu	noun: masculine ablative singular	ls.n25409:jussus2
https://lingualatina.github.io/texts/browsable/hyginus/102a/	102a.2	102a.2.20	Agamemnonis		ls.null
https://lingualatina.github.io/texts/browsable/hyginus/102a/	102a.2	102a.2.21	regis	noun: masculine accusative plural	ls.n41625:rex1
https://lingualatina.github.io/texts/browsable/hyginus/102a/	102a.2	102a.2.21	regis	noun: masculine genitive singular	ls.n41625:rex1
https://lingualatina.github.io/texts/browsable/hyginus/102a/	102a.2	102a.2.22	in	uninflected preposition	ls.n22111:in1
https://lingualatina.github.io/texts/browsable/hyginus/102a/	102a.2	102a.2.23	Lemno		ls.null
https://lingualatina.github.io/texts/browsable/hyginus/102a/	102a.2	102a.2.24	expositus	participle: perfect passive masculine nominative singular	ls.n17092:expono
https://lingualatina.github.io/texts/browsable/hyginus/102a/	102a.2	102a.2.25	est	finite verb: third singular present indicative active	ls.n46529:sum1
https://lingualatina.github.io/texts/browsable/hyginus/102a/	102a.2	102a.2.26	cum	uninflected preposition	ls.n11872:cum1
https://lingualatina.github.io/texts/browsable/hyginus/102a/	102a.2	102a.2.27	sagittis	noun: feminine dative plural	ls.n42264:sagitta
https://lingualatina.github.io/texts/browsable/hyginus/102a/	102a.2	102a.2.27	sagittis	noun: feminine ablative plural	ls.n42264:sagitta
https://lingualatina.github.io/texts/browsable/hyginus/102a/	102a.2	102a.2.28	diuinis	adjective: masculine dative plural positive	ls.n14573:divinus
https://lingualatina.github.io/texts/browsable/hyginus/102a/	102a.2	102a.2.28	diuinis	adjective: masculine ablative plural positive	ls.n14573:divinus
https://lingualatina.github.io/texts/browsable/hyginus/102a/	102a.2	102a.2.28	diuinis	adjective: feminine dative plural positive	ls.n14573:divinus
https://lingualatina.github.io/texts/browsable/hyginus/102a/	102a.2	102a.2.28	diuinis	adjective: feminine ablative plural positive	ls.n14573:divinus
https://lingualatina.github.io/texts/browsable/hyginus/102a/	102a.2	102a.2.28	diuinis	adjective: neuter dative plural positive	ls.n14573:divinus
https://lingualatina.github.io/texts/browsable/hyginus/102a/	102a.2	102a.2.28	diuinis	adjective: neuter ablative plural positive	ls.n14573:divinus
https://lingualatina.github.io/texts/browsable/hyginus/102a/	102a.2	102a.2.28_0	;		ls.null
https://lingualatina.github.io/texts/browsable/hyginus/102a/	102a.2	102a.2.29	quem	pronoun: masculine accusative singular	ls.n40242:quis1
https://lingualatina.github.io/texts/browsable/hyginus/102a/	102a.2	102a.2.29	quem	pronoun: feminine accusative singular	ls.n40242:quis1
https://lingualatina.github.io/texts/browsable/hyginus/102a/	102a.2	102a.2.29	quem	pronoun: masculine accusative singular	ls.n40103:qui1
https://lingualatina.github.io/texts/browsable/hyginus/102a/	102a.2	102a.2.30	expositum	participle: perfect passive masculine accusative singular	ls.n17092:expono
https://lingualatina.github.io/texts/browsable/hyginus/102a/	102a.2	102a.2.30	expositum	participle: perfect passive neuter nominative singular	ls.n17092:expono
https://lingualatina.github.io/texts/browsable/hyginus/102a/	102a.2	102a.2.30	expositum	participle: perfect passive neuter vocative singular	ls.n17092:expono
https://lingualatina.github.io/texts/browsable/hyginus/102a/	102a.2	102a.2.31	pastor	noun: masculine nominative singular	ls.n34067:pastor
https://lingualatina.github.io/texts/browsable/hyginus/102a/	102a.2	102a.2.31	pastor	noun: masculine vocative singular	ls.n34067:pastor
https://lingualatina.github.io/texts/browsable/hyginus/102a/	102a.2	102a.2.32	regis	noun: masculine accusative plural	ls.n41625:rex1
https://lingualatina.github.io/texts/browsable/hyginus/102a/	102a.2	102a.2.32	regis	noun: masculine genitive singular	ls.n41625:rex1
https://lingualatina.github.io/texts/browsable/hyginus/102a/	102a.2	102a.2.33	Actoris		ls.null
https://lingualatina.github.io/texts/browsable/hyginus/102a/	102a.2	102a.2.34	nomine	noun: neuter ablative singular	ls.n31131:nomen
https://lingualatina.github.io/texts/browsable/hyginus/102a/	102a.2	102a.2.35	Iphimachus		ls.null
https://lingualatina.github.io/texts/browsable/hyginus/102a/	102a.2	102a.2.36	Dolopionis		ls.null
https://lingualatina.github.io/texts/browsable/hyginus/102a/	102a.2	102a.2.37	filius	noun: masculine nominative singular	ls.n18185:filius
https://lingualatina.github.io/texts/browsable/hyginus/102a/	102a.2	102a.2.38	nutriuit		ls.null
https://lingualatina.github.io/texts/browsable/hyginus/102a/	102a.2	102a.2.38_0	.		ls.null