url	passage	tokenid	token	form	lexeme
https://lingualatina.github.io/texts/browsable/hyginus/104a/	104a.3	104a.3.0	qui	pronoun: masculine nominative plural	urn:cite2:tabulae:ls.v1:n40242
https://lingualatina.github.io/texts/browsable/hyginus/104a/	104a.3	104a.3.0	qui	pronoun: masculine nominative plural	urn:cite2:tabulae:ls.v1:n40103
https://lingualatina.github.io/texts/browsable/hyginus/104a/	104a.3	104a.3.0	qui	pronoun: masculine nominative singular	urn:cite2:tabulae:ls.v1:n40103
https://lingualatina.github.io/texts/browsable/hyginus/104a/	104a.3	104a.3.1	cum	uninflected preposition	urn:cite2:tabulae:ls.v1:n11872
https://lingualatina.github.io/texts/browsable/hyginus/104a/	104a.3	104a.3.2	uenisset	finite verb: third singular pluperfect subjunctive active	urn:cite2:tabulae:ls.v1:n50442
https://lingualatina.github.io/texts/browsable/hyginus/104a/	104a.3	104a.3.3	et	uninflected conjunction	urn:cite2:tabulae:ls.v1:n16278
https://lingualatina.github.io/texts/browsable/hyginus/104a/	104a.3	104a.3.4	in	uninflected preposition	urn:cite2:tabulae:ls.v1:n22111
https://lingualatina.github.io/texts/browsable/hyginus/104a/	104a.3	104a.3.5	thalamos	noun: masculine accusative plural	urn:cite2:tabulae:ls.v1:n48071
https://lingualatina.github.io/texts/browsable/hyginus/104a/	104a.3	104a.3.6	irrupisset		urn:cite2:tabulae:ls.v1:null
https://lingualatina.github.io/texts/browsable/hyginus/104a/	104a.3	104a.3.6_0	,		urn:cite2:tabulae:ls.v1:null
https://lingualatina.github.io/texts/browsable/hyginus/104a/	104a.3	104a.3.7	uidit	finite verb: third singular perfect indicative active	urn:cite2:tabulae:ls.v1:n50883
https://lingualatina.github.io/texts/browsable/hyginus/104a/	104a.3	104a.3.7	uidit	finite verb: third singular perfect indicative active	urn:cite2:tabulae:ls.v1:n50883
https://lingualatina.github.io/texts/browsable/hyginus/104a/	104a.3	104a.3.8	effigiem	noun: feminine accusative singular	urn:cite2:tabulae:ls.v1:n11860
https://lingualatina.github.io/texts/browsable/hyginus/104a/	104a.3	104a.3.9	Protesilai		urn:cite2:tabulae:ls.v1:null
https://lingualatina.github.io/texts/browsable/hyginus/104a/	104a.3	104a.3.9_0	;		urn:cite2:tabulae:ls.v1:null
https://lingualatina.github.io/texts/browsable/hyginus/104a/	104a.3	104a.3.10	quae	pronoun: feminine nominative plural	urn:cite2:tabulae:ls.v1:n40242
https://lingualatina.github.io/texts/browsable/hyginus/104a/	104a.3	104a.3.10	quae	pronoun: neuter accusative plural	urn:cite2:tabulae:ls.v1:n40242
https://lingualatina.github.io/texts/browsable/hyginus/104a/	104a.3	104a.3.10	quae	pronoun: neuter nominative plural	urn:cite2:tabulae:ls.v1:n40242
https://lingualatina.github.io/texts/browsable/hyginus/104a/	104a.3	104a.3.10	quae	pronoun: neuter accusative plural	urn:cite2:tabulae:ls.v1:n40103
https://lingualatina.github.io/texts/browsable/hyginus/104a/	104a.3	104a.3.10	quae	pronoun: neuter nominative plural	urn:cite2:tabulae:ls.v1:n40103
https://lingualatina.github.io/texts/browsable/hyginus/104a/	104a.3	104a.3.10	quae	pronoun: feminine nominative plural	urn:cite2:tabulae:ls.v1:n40103
https://lingualatina.github.io/texts/browsable/hyginus/104a/	104a.3	104a.3.10	quae	pronoun: feminine nominative singular	urn:cite2:tabulae:ls.v1:n40103
https://lingualatina.github.io/texts/browsable/hyginus/104a/	104a.3	104a.3.11	ne	uninflected conjunction	urn:cite2:tabulae:ls.v1:n30583
https://lingualatina.github.io/texts/browsable/hyginus/104a/	104a.3	104a.3.12	diutius		urn:cite2:tabulae:ls.v1:null
https://lingualatina.github.io/texts/browsable/hyginus/104a/	104a.3	104a.3.13	torqueretur		urn:cite2:tabulae:ls.v1:null
https://lingualatina.github.io/texts/browsable/hyginus/104a/	104a.3	104a.3.13_0	,		urn:cite2:tabulae:ls.v1:null
https://lingualatina.github.io/texts/browsable/hyginus/104a/	104a.3	104a.3.14	iussit	finite verb: third singular perfect indicative active	urn:cite2:tabulae:ls.v1:n25264
https://lingualatina.github.io/texts/browsable/hyginus/104a/	104a.3	104a.3.15	signum	noun: neuter nominative singular	urn:cite2:tabulae:ls.v1:n44227
https://lingualatina.github.io/texts/browsable/hyginus/104a/	104a.3	104a.3.15	signum	noun: neuter accusative singular	urn:cite2:tabulae:ls.v1:n44227
https://lingualatina.github.io/texts/browsable/hyginus/104a/	104a.3	104a.3.15	signum	noun: neuter vocative singular	urn:cite2:tabulae:ls.v1:n44227
https://lingualatina.github.io/texts/browsable/hyginus/104a/	104a.3	104a.3.16	et	uninflected conjunction	urn:cite2:tabulae:ls.v1:n16278
https://lingualatina.github.io/texts/browsable/hyginus/104a/	104a.3	104a.3.17	sacra	adjective: feminine nominative singular positive	urn:cite2:tabulae:ls.v1:n42157
https://lingualatina.github.io/texts/browsable/hyginus/104a/	104a.3	104a.3.17	sacra	adjective: feminine ablative singular positive	urn:cite2:tabulae:ls.v1:n42157
https://lingualatina.github.io/texts/browsable/hyginus/104a/	104a.3	104a.3.17	sacra	adjective: feminine vocative singular positive	urn:cite2:tabulae:ls.v1:n42157
https://lingualatina.github.io/texts/browsable/hyginus/104a/	104a.3	104a.3.17	sacra	adjective: neuter nominative plural positive	urn:cite2:tabulae:ls.v1:n42157
https://lingualatina.github.io/texts/browsable/hyginus/104a/	104a.3	104a.3.17	sacra	adjective: neuter accusative plural positive	urn:cite2:tabulae:ls.v1:n42157
https://lingualatina.github.io/texts/browsable/hyginus/104a/	104a.3	104a.3.17	sacra	adjective: neuter vocative plural positive	urn:cite2:tabulae:ls.v1:n42157
https://lingualatina.github.io/texts/browsable/hyginus/104a/	104a.3	104a.3.17	sacra	finite verb: second singular present imperative active	urn:cite2:tabulae:ls.v1:n42201
https://lingualatina.github.io/texts/browsable/hyginus/104a/	104a.3	104a.3.18	pyra	noun: feminine nominative singular	urn:cite2:tabulae:ls.v1:n39745
https://lingualatina.github.io/texts/browsable/hyginus/104a/	104a.3	104a.3.18	pyra	noun: feminine ablative singular	urn:cite2:tabulae:ls.v1:n39745
https://lingualatina.github.io/texts/browsable/hyginus/104a/	104a.3	104a.3.18	pyra	noun: feminine vocative singular	urn:cite2:tabulae:ls.v1:n39745
https://lingualatina.github.io/texts/browsable/hyginus/104a/	104a.3	104a.3.19	facta	participle: perfect passive feminine nominative singular	urn:cite2:tabulae:ls.v1:n17516
https://lingualatina.github.io/texts/browsable/hyginus/104a/	104a.3	104a.3.19	facta	participle: perfect passive feminine ablative singular	urn:cite2:tabulae:ls.v1:n17516
https://lingualatina.github.io/texts/browsable/hyginus/104a/	104a.3	104a.3.19	facta	participle: perfect passive feminine vocative singular	urn:cite2:tabulae:ls.v1:n17516
https://lingualatina.github.io/texts/browsable/hyginus/104a/	104a.3	104a.3.19	facta	participle: perfect passive neuter nominative plural	urn:cite2:tabulae:ls.v1:n17516
https://lingualatina.github.io/texts/browsable/hyginus/104a/	104a.3	104a.3.19	facta	participle: perfect passive neuter accusative plural	urn:cite2:tabulae:ls.v1:n17516
https://lingualatina.github.io/texts/browsable/hyginus/104a/	104a.3	104a.3.19	facta	participle: perfect passive neuter vocative plural	urn:cite2:tabulae:ls.v1:n17516
https://lingualatina.github.io/texts/browsable/hyginus/104a/	104a.3	104a.3.20	comburi		urn:cite2:tabulae:ls.v1:null
https://lingualatina.github.io/texts/browsable/hyginus/104a/	104a.3	104a.3.20_0	,		urn:cite2:tabulae:ls.v1:null
https://lingualatina.github.io/texts/browsable/hyginus/104a/	104a.3	104a.3.21	quo	pronoun: masculine ablative singular	urn:cite2:tabulae:ls.v1:n40242
https://lingualatina.github.io/texts/browsable/hyginus/104a/	104a.3	104a.3.21	quo	pronoun: feminine ablative singular	urn:cite2:tabulae:ls.v1:n40242
https://lingualatina.github.io/texts/browsable/hyginus/104a/	104a.3	104a.3.21	quo	pronoun: neuter ablative singular	urn:cite2:tabulae:ls.v1:n40242
https://lingualatina.github.io/texts/browsable/hyginus/104a/	104a.3	104a.3.21	quo	pronoun: masculine ablative singular	urn:cite2:tabulae:ls.v1:n40103
https://lingualatina.github.io/texts/browsable/hyginus/104a/	104a.3	104a.3.21	quo	pronoun: neuter ablative singular	urn:cite2:tabulae:ls.v1:n40103
https://lingualatina.github.io/texts/browsable/hyginus/104a/	104a.3	104a.3.22	se	participle: perfect passive masculine vocative singular	urn:cite2:l3:composites.v1:do
https://lingualatina.github.io/texts/browsable/hyginus/104a/	104a.3	104a.3.22	se	pronoun: masculine accusative singular	urn:cite2:tabulae:ls.v1:n46498
https://lingualatina.github.io/texts/browsable/hyginus/104a/	104a.3	104a.3.22	se	pronoun: masculine ablative singular	urn:cite2:tabulae:ls.v1:n46498
https://lingualatina.github.io/texts/browsable/hyginus/104a/	104a.3	104a.3.22	se	pronoun: feminine ablative singular	urn:cite2:tabulae:ls.v1:n46498
https://lingualatina.github.io/texts/browsable/hyginus/104a/	104a.3	104a.3.22	se	pronoun: neuter ablative singular	urn:cite2:tabulae:ls.v1:n46498
https://lingualatina.github.io/texts/browsable/hyginus/104a/	104a.3	104a.3.22	se	pronoun: feminine ablative plural	urn:cite2:tabulae:ls.v1:n46498
https://lingualatina.github.io/texts/browsable/hyginus/104a/	104a.3	104a.3.22	se	pronoun: neuter accusative plural	urn:cite2:tabulae:ls.v1:n46498
https://lingualatina.github.io/texts/browsable/hyginus/104a/	104a.3	104a.3.22	se	pronoun: feminine accusative plural	urn:cite2:tabulae:ls.v1:n46498
https://lingualatina.github.io/texts/browsable/hyginus/104a/	104a.3	104a.3.22	se	pronoun: neuter ablative plural	urn:cite2:tabulae:ls.v1:n46498
https://lingualatina.github.io/texts/browsable/hyginus/104a/	104a.3	104a.3.22	se	pronoun: feminine accusative singular	urn:cite2:tabulae:ls.v1:n46498
https://lingualatina.github.io/texts/browsable/hyginus/104a/	104a.3	104a.3.22	se	pronoun: neuter accusative singular	urn:cite2:tabulae:ls.v1:n46498
https://lingualatina.github.io/texts/browsable/hyginus/104a/	104a.3	104a.3.22	se	pronoun: masculine accusative plural	urn:cite2:tabulae:ls.v1:n46498
https://lingualatina.github.io/texts/browsable/hyginus/104a/	104a.3	104a.3.22	se	pronoun: masculine ablative plural	urn:cite2:tabulae:ls.v1:n46498
https://lingualatina.github.io/texts/browsable/hyginus/104a/	104a.3	104a.3.23	Laodamia	noun: feminine nominative singular	urn:cite2:tabulae:ls.v1:n25821
https://lingualatina.github.io/texts/browsable/hyginus/104a/	104a.3	104a.3.23	Laodamia	noun: feminine ablative singular	urn:cite2:tabulae:ls.v1:n25821
https://lingualatina.github.io/texts/browsable/hyginus/104a/	104a.3	104a.3.23	Laodamia	noun: feminine vocative singular	urn:cite2:tabulae:ls.v1:n25821
https://lingualatina.github.io/texts/browsable/hyginus/104a/	104a.3	104a.3.24	dolorem	noun: masculine accusative singular	urn:cite2:tabulae:ls.v1:n14669
https://lingualatina.github.io/texts/browsable/hyginus/104a/	104a.3	104a.3.25	non	adverb: positive degree	urn:cite2:tabulae:ls.v1:n31151
https://lingualatina.github.io/texts/browsable/hyginus/104a/	104a.3	104a.3.26	sustinens	participle: present active masculine nominative singular	urn:cite2:tabulae:ls.v1:n47146
https://lingualatina.github.io/texts/browsable/hyginus/104a/	104a.3	104a.3.26	sustinens	participle: present active masculine vocative singular	urn:cite2:tabulae:ls.v1:n47146
https://lingualatina.github.io/texts/browsable/hyginus/104a/	104a.3	104a.3.26	sustinens	participle: present active feminine nominative singular	urn:cite2:tabulae:ls.v1:n47146
https://lingualatina.github.io/texts/browsable/hyginus/104a/	104a.3	104a.3.26	sustinens	participle: present active feminine vocative singular	urn:cite2:tabulae:ls.v1:n47146
https://lingualatina.github.io/texts/browsable/hyginus/104a/	104a.3	104a.3.26	sustinens	participle: present active neuter nominative singular	urn:cite2:tabulae:ls.v1:n47146
https://lingualatina.github.io/texts/browsable/hyginus/104a/	104a.3	104a.3.26	sustinens	participle: present active neuter nominative singular	urn:cite2:tabulae:ls.v1:n47146
https://lingualatina.github.io/texts/browsable/hyginus/104a/	104a.3	104a.3.26	sustinens	participle: present active neuter accusative singular	urn:cite2:tabulae:ls.v1:n47146
https://lingualatina.github.io/texts/browsable/hyginus/104a/	104a.3	104a.3.27	immisit		urn:cite2:tabulae:ls.v1:null
https://lingualatina.github.io/texts/browsable/hyginus/104a/	104a.3	104a.3.28	atque	uninflected conjunction	urn:cite2:tabulae:ls.v1:n4275
https://lingualatina.github.io/texts/browsable/hyginus/104a/	104a.3	104a.3.29	usta		urn:cite2:tabulae:ls.v1:null
https://lingualatina.github.io/texts/browsable/hyginus/104a/	104a.3	104a.3.30	est	finite verb: third singular present indicative active	urn:cite2:tabulae:ls.v1:n46529
https://lingualatina.github.io/texts/browsable/hyginus/104a/	104a.3	104a.3.30_0	.		urn:cite2:tabulae:ls.v1:null