url	passage	tokenid	token	form	lexeme
https://lingualatina.github.io/texts/browsable/hyginus/107a/	107a.3	107a.3.0	Aiax		urn:cite2:tabulae:ls.v1:null
https://lingualatina.github.io/texts/browsable/hyginus/107a/	107a.3	107a.3.1	furia	noun: feminine nominative singular	urn:cite2:tabulae:ls.v1:n19099
https://lingualatina.github.io/texts/browsable/hyginus/107a/	107a.3	107a.3.1	furia	noun: feminine ablative singular	urn:cite2:tabulae:ls.v1:n19099
https://lingualatina.github.io/texts/browsable/hyginus/107a/	107a.3	107a.3.1	furia	noun: feminine vocative singular	urn:cite2:tabulae:ls.v1:n19099
https://lingualatina.github.io/texts/browsable/hyginus/107a/	107a.3	107a.3.2	accepta	participle: perfect passive feminine nominative singular	urn:cite2:tabulae:ls.v1:n363
https://lingualatina.github.io/texts/browsable/hyginus/107a/	107a.3	107a.3.2	accepta	participle: perfect passive feminine ablative singular	urn:cite2:tabulae:ls.v1:n363
https://lingualatina.github.io/texts/browsable/hyginus/107a/	107a.3	107a.3.2	accepta	participle: perfect passive feminine vocative singular	urn:cite2:tabulae:ls.v1:n363
https://lingualatina.github.io/texts/browsable/hyginus/107a/	107a.3	107a.3.2	accepta	participle: perfect passive neuter nominative plural	urn:cite2:tabulae:ls.v1:n363
https://lingualatina.github.io/texts/browsable/hyginus/107a/	107a.3	107a.3.2	accepta	participle: perfect passive neuter accusative plural	urn:cite2:tabulae:ls.v1:n363
https://lingualatina.github.io/texts/browsable/hyginus/107a/	107a.3	107a.3.2	accepta	participle: perfect passive neuter vocative plural	urn:cite2:tabulae:ls.v1:n363
https://lingualatina.github.io/texts/browsable/hyginus/107a/	107a.3	107a.3.3	per	uninflected preposition	urn:cite2:tabulae:ls.v1:n34595
https://lingualatina.github.io/texts/browsable/hyginus/107a/	107a.3	107a.3.4	insaniam	noun: feminine accusative singular	urn:cite2:tabulae:ls.v1:n23716
https://lingualatina.github.io/texts/browsable/hyginus/107a/	107a.3	107a.3.5	pecora	noun: neuter nominative plural	urn:cite2:tabulae:ls.v1:n34312
https://lingualatina.github.io/texts/browsable/hyginus/107a/	107a.3	107a.3.5	pecora	noun: neuter accusative plural	urn:cite2:tabulae:ls.v1:n34312
https://lingualatina.github.io/texts/browsable/hyginus/107a/	107a.3	107a.3.5	pecora	noun: neuter vocative plural	urn:cite2:tabulae:ls.v1:n34312
https://lingualatina.github.io/texts/browsable/hyginus/107a/	107a.3	107a.3.6	sua	adjective: feminine nominative singular positive	urn:cite2:tabulae:ls.v1:n47174
https://lingualatina.github.io/texts/browsable/hyginus/107a/	107a.3	107a.3.6	sua	adjective: feminine ablative singular positive	urn:cite2:tabulae:ls.v1:n47174
https://lingualatina.github.io/texts/browsable/hyginus/107a/	107a.3	107a.3.6	sua	adjective: feminine vocative singular positive	urn:cite2:tabulae:ls.v1:n47174
https://lingualatina.github.io/texts/browsable/hyginus/107a/	107a.3	107a.3.6	sua	adjective: neuter nominative plural positive	urn:cite2:tabulae:ls.v1:n47174
https://lingualatina.github.io/texts/browsable/hyginus/107a/	107a.3	107a.3.6	sua	adjective: neuter accusative plural positive	urn:cite2:tabulae:ls.v1:n47174
https://lingualatina.github.io/texts/browsable/hyginus/107a/	107a.3	107a.3.6	sua	adjective: neuter vocative plural positive	urn:cite2:tabulae:ls.v1:n47174
https://lingualatina.github.io/texts/browsable/hyginus/107a/	107a.3	107a.3.7	et	uninflected conjunction	urn:cite2:tabulae:ls.v1:n16278
https://lingualatina.github.io/texts/browsable/hyginus/107a/	107a.3	107a.3.8	se	participle: perfect passive masculine vocative singular	urn:cite2:l3:composites.v1:do
https://lingualatina.github.io/texts/browsable/hyginus/107a/	107a.3	107a.3.8	se	pronoun: masculine accusative singular	urn:cite2:tabulae:ls.v1:n46498
https://lingualatina.github.io/texts/browsable/hyginus/107a/	107a.3	107a.3.8	se	pronoun: masculine ablative singular	urn:cite2:tabulae:ls.v1:n46498
https://lingualatina.github.io/texts/browsable/hyginus/107a/	107a.3	107a.3.8	se	pronoun: feminine ablative singular	urn:cite2:tabulae:ls.v1:n46498
https://lingualatina.github.io/texts/browsable/hyginus/107a/	107a.3	107a.3.8	se	pronoun: neuter ablative singular	urn:cite2:tabulae:ls.v1:n46498
https://lingualatina.github.io/texts/browsable/hyginus/107a/	107a.3	107a.3.8	se	pronoun: feminine ablative plural	urn:cite2:tabulae:ls.v1:n46498
https://lingualatina.github.io/texts/browsable/hyginus/107a/	107a.3	107a.3.8	se	pronoun: neuter accusative plural	urn:cite2:tabulae:ls.v1:n46498
https://lingualatina.github.io/texts/browsable/hyginus/107a/	107a.3	107a.3.8	se	pronoun: feminine accusative plural	urn:cite2:tabulae:ls.v1:n46498
https://lingualatina.github.io/texts/browsable/hyginus/107a/	107a.3	107a.3.8	se	pronoun: neuter ablative plural	urn:cite2:tabulae:ls.v1:n46498
https://lingualatina.github.io/texts/browsable/hyginus/107a/	107a.3	107a.3.8	se	pronoun: feminine accusative singular	urn:cite2:tabulae:ls.v1:n46498
https://lingualatina.github.io/texts/browsable/hyginus/107a/	107a.3	107a.3.8	se	pronoun: neuter accusative singular	urn:cite2:tabulae:ls.v1:n46498
https://lingualatina.github.io/texts/browsable/hyginus/107a/	107a.3	107a.3.8	se	pronoun: masculine accusative plural	urn:cite2:tabulae:ls.v1:n46498
https://lingualatina.github.io/texts/browsable/hyginus/107a/	107a.3	107a.3.8	se	pronoun: masculine ablative plural	urn:cite2:tabulae:ls.v1:n46498
https://lingualatina.github.io/texts/browsable/hyginus/107a/	107a.3	107a.3.9	ipsum	pronoun: masculine accusative singular	urn:cite2:tabulae:ls.v1:n24872
https://lingualatina.github.io/texts/browsable/hyginus/107a/	107a.3	107a.3.9	ipsum	pronoun: neuter accusative singular	urn:cite2:tabulae:ls.v1:n24872
https://lingualatina.github.io/texts/browsable/hyginus/107a/	107a.3	107a.3.9	ipsum	pronoun: neuter nominative singular	urn:cite2:tabulae:ls.v1:n24872
https://lingualatina.github.io/texts/browsable/hyginus/107a/	107a.3	107a.3.10	uulneratum		urn:cite2:tabulae:ls.v1:null
https://lingualatina.github.io/texts/browsable/hyginus/107a/	107a.3	107a.3.11	occidit	finite verb: third singular perfect indicative active	urn:cite2:tabulae:ls.v1:n32088
https://lingualatina.github.io/texts/browsable/hyginus/107a/	107a.3	107a.3.11	occidit	finite verb: third singular present indicative active	urn:cite2:tabulae:ls.v1:n32088
https://lingualatina.github.io/texts/browsable/hyginus/107a/	107a.3	107a.3.12	eo	pronoun: masculine ablative singular	urn:cite2:tabulae:ls.v1:n25029
https://lingualatina.github.io/texts/browsable/hyginus/107a/	107a.3	107a.3.12	eo	pronoun: neuter ablative singular	urn:cite2:tabulae:ls.v1:n25029
https://lingualatina.github.io/texts/browsable/hyginus/107a/	107a.3	107a.3.12	eo	finite verb: first singular present indicative active	urn:cite2:tabulae:ls.v1:n15868
https://lingualatina.github.io/texts/browsable/hyginus/107a/	107a.3	107a.3.13	gladio	noun: masculine dative singular	urn:cite2:tabulae:ls.v1:n19607
https://lingualatina.github.io/texts/browsable/hyginus/107a/	107a.3	107a.3.13	gladio	noun: masculine ablative singular	urn:cite2:tabulae:ls.v1:n19607
https://lingualatina.github.io/texts/browsable/hyginus/107a/	107a.3	107a.3.14	quem	pronoun: masculine accusative singular	urn:cite2:tabulae:ls.v1:n40242
https://lingualatina.github.io/texts/browsable/hyginus/107a/	107a.3	107a.3.14	quem	pronoun: feminine accusative singular	urn:cite2:tabulae:ls.v1:n40242
https://lingualatina.github.io/texts/browsable/hyginus/107a/	107a.3	107a.3.14	quem	pronoun: masculine accusative singular	urn:cite2:tabulae:ls.v1:n40103
https://lingualatina.github.io/texts/browsable/hyginus/107a/	107a.3	107a.3.15	ab	uninflected preposition	urn:cite2:tabulae:ls.v1:n4
https://lingualatina.github.io/texts/browsable/hyginus/107a/	107a.3	107a.3.16	Hectore	noun: masculine ablative singular	urn:cite2:tabulae:ls.v1:n20321
https://lingualatina.github.io/texts/browsable/hyginus/107a/	107a.3	107a.3.17	muneri	noun: neuter dative singular	urn:cite2:tabulae:ls.v1:n30017
https://lingualatina.github.io/texts/browsable/hyginus/107a/	107a.3	107a.3.18	accepit	finite verb: third singular perfect indicative active	urn:cite2:tabulae:ls.v1:n363
https://lingualatina.github.io/texts/browsable/hyginus/107a/	107a.3	107a.3.19	dum	uninflected conjunction	urn:cite2:tabulae:ls.v1:n14902
https://lingualatina.github.io/texts/browsable/hyginus/107a/	107a.3	107a.3.20	cum	uninflected preposition	urn:cite2:tabulae:ls.v1:n11872
https://lingualatina.github.io/texts/browsable/hyginus/107a/	107a.3	107a.3.21	eo	pronoun: masculine ablative singular	urn:cite2:tabulae:ls.v1:n25029
https://lingualatina.github.io/texts/browsable/hyginus/107a/	107a.3	107a.3.21	eo	pronoun: neuter ablative singular	urn:cite2:tabulae:ls.v1:n25029
https://lingualatina.github.io/texts/browsable/hyginus/107a/	107a.3	107a.3.21	eo	finite verb: first singular present indicative active	urn:cite2:tabulae:ls.v1:n15868
https://lingualatina.github.io/texts/browsable/hyginus/107a/	107a.3	107a.3.22	in	uninflected preposition	urn:cite2:tabulae:ls.v1:n22111
https://lingualatina.github.io/texts/browsable/hyginus/107a/	107a.3	107a.3.23	acie	noun: feminine genitive singular	urn:cite2:tabulae:ls.v1:n517
https://lingualatina.github.io/texts/browsable/hyginus/107a/	107a.3	107a.3.23	acie	noun: feminine dative singular	urn:cite2:tabulae:ls.v1:n517
https://lingualatina.github.io/texts/browsable/hyginus/107a/	107a.3	107a.3.23	acie	noun: feminine ablative singular	urn:cite2:tabulae:ls.v1:n517
https://lingualatina.github.io/texts/browsable/hyginus/107a/	107a.3	107a.3.24	contendit	finite verb: third singular perfect indicative active	urn:cite2:tabulae:ls.v1:n10770
https://lingualatina.github.io/texts/browsable/hyginus/107a/	107a.3	107a.3.24	contendit	finite verb: third singular present indicative active	urn:cite2:tabulae:ls.v1:n10770
https://lingualatina.github.io/texts/browsable/hyginus/107a/	107a.3	107a.3.24	contendit	finite verb: third singular perfect indicative active	urn:cite2:tabulae:ls.v1:n10770
https://lingualatina.github.io/texts/browsable/hyginus/107a/	107a.3	107a.3.24_0	.		urn:cite2:tabulae:ls.v1:null