url	passage	tokenid	token	form	lexeme
https://lingualatina.github.io/texts/browsable/hyginus/125a/	125a.6	125a.6.0	ad	uninflected preposition	urn:cite2:tabulae:ls.v1:n665
https://lingualatina.github.io/texts/browsable/hyginus/125a/	125a.6	125a.6.1	Aeolum	noun: masculine accusative singular	urn:cite2:tabulae:ls.v1:n1263
https://lingualatina.github.io/texts/browsable/hyginus/125a/	125a.6	125a.6.2	Hellenis		urn:cite2:tabulae:ls.v1:null
https://lingualatina.github.io/texts/browsable/hyginus/125a/	125a.6	125a.6.3	filium	noun: masculine accusative singular	urn:cite2:tabulae:ls.v1:n18185
https://lingualatina.github.io/texts/browsable/hyginus/125a/	125a.6	125a.6.3_0	,		urn:cite2:tabulae:ls.v1:null
https://lingualatina.github.io/texts/browsable/hyginus/125a/	125a.6	125a.6.4	cui	pronoun: masculine dative singular	urn:cite2:tabulae:ls.v1:n40242
https://lingualatina.github.io/texts/browsable/hyginus/125a/	125a.6	125a.6.4	cui	pronoun: neuter dative singular	urn:cite2:tabulae:ls.v1:n40242
https://lingualatina.github.io/texts/browsable/hyginus/125a/	125a.6	125a.6.4	cui	pronoun: feminine dative singular	urn:cite2:tabulae:ls.v1:n40242
https://lingualatina.github.io/texts/browsable/hyginus/125a/	125a.6	125a.6.4	cui	pronoun: masculine dative singular	urn:cite2:tabulae:ls.v1:n40103
https://lingualatina.github.io/texts/browsable/hyginus/125a/	125a.6	125a.6.4	cui	pronoun: neuter dative singular	urn:cite2:tabulae:ls.v1:n40103
https://lingualatina.github.io/texts/browsable/hyginus/125a/	125a.6	125a.6.4	cui	pronoun: feminine dative singular	urn:cite2:tabulae:ls.v1:n40103
https://lingualatina.github.io/texts/browsable/hyginus/125a/	125a.6	125a.6.5	ab	uninflected preposition	urn:cite2:tabulae:ls.v1:n4
https://lingualatina.github.io/texts/browsable/hyginus/125a/	125a.6	125a.6.6	Ioue		urn:cite2:tabulae:ls.v1:null
https://lingualatina.github.io/texts/browsable/hyginus/125a/	125a.6	125a.6.7	uentorum	participle: perfect passive masculine genitive plural	urn:cite2:tabulae:ls.v1:n50442
https://lingualatina.github.io/texts/browsable/hyginus/125a/	125a.6	125a.6.7	uentorum	participle: perfect passive neuter genitive plural	urn:cite2:tabulae:ls.v1:n50442
https://lingualatina.github.io/texts/browsable/hyginus/125a/	125a.6	125a.6.8	potestas	noun: feminine nominative singular	urn:cite2:tabulae:ls.v1:n37292
https://lingualatina.github.io/texts/browsable/hyginus/125a/	125a.6	125a.6.8	potestas	noun: feminine vocative singular	urn:cite2:tabulae:ls.v1:n37292
https://lingualatina.github.io/texts/browsable/hyginus/125a/	125a.6	125a.6.9	fuit	finite verb: third singular perfect indicative active	urn:cite2:tabulae:ls.v1:n46529
https://lingualatina.github.io/texts/browsable/hyginus/125a/	125a.6	125a.6.10	tradita	participle: perfect passive feminine nominative singular	urn:cite2:tabulae:ls.v1:n48671
https://lingualatina.github.io/texts/browsable/hyginus/125a/	125a.6	125a.6.10	tradita	participle: perfect passive feminine ablative singular	urn:cite2:tabulae:ls.v1:n48671
https://lingualatina.github.io/texts/browsable/hyginus/125a/	125a.6	125a.6.10	tradita	participle: perfect passive feminine vocative singular	urn:cite2:tabulae:ls.v1:n48671
https://lingualatina.github.io/texts/browsable/hyginus/125a/	125a.6	125a.6.10	tradita	participle: perfect passive neuter nominative plural	urn:cite2:tabulae:ls.v1:n48671
https://lingualatina.github.io/texts/browsable/hyginus/125a/	125a.6	125a.6.10	tradita	participle: perfect passive neuter accusative plural	urn:cite2:tabulae:ls.v1:n48671
https://lingualatina.github.io/texts/browsable/hyginus/125a/	125a.6	125a.6.10	tradita	participle: perfect passive neuter vocative plural	urn:cite2:tabulae:ls.v1:n48671
https://lingualatina.github.io/texts/browsable/hyginus/125a/	125a.6	125a.6.10_0	;		urn:cite2:tabulae:ls.v1:null
https://lingualatina.github.io/texts/browsable/hyginus/125a/	125a.6	125a.6.11	is	pronoun: masculine dative plural	urn:cite2:tabulae:ls.v1:n25029
https://lingualatina.github.io/texts/browsable/hyginus/125a/	125a.6	125a.6.11	is	pronoun: feminine dative plural	urn:cite2:tabulae:ls.v1:n25029
https://lingualatina.github.io/texts/browsable/hyginus/125a/	125a.6	125a.6.11	is	pronoun: feminine ablative plural	urn:cite2:tabulae:ls.v1:n25029
https://lingualatina.github.io/texts/browsable/hyginus/125a/	125a.6	125a.6.11	is	pronoun: neuter dative plural	urn:cite2:tabulae:ls.v1:n25029
https://lingualatina.github.io/texts/browsable/hyginus/125a/	125a.6	125a.6.11	is	pronoun: neuter ablative plural	urn:cite2:tabulae:ls.v1:n25029
https://lingualatina.github.io/texts/browsable/hyginus/125a/	125a.6	125a.6.11	is	pronoun: masculine nominative singular	urn:cite2:tabulae:ls.v1:n25029
https://lingualatina.github.io/texts/browsable/hyginus/125a/	125a.6	125a.6.11	is	pronoun: masculine ablative plural	urn:cite2:tabulae:ls.v1:n25029
https://lingualatina.github.io/texts/browsable/hyginus/125a/	125a.6	125a.6.11	is	finite verb: second singular present indicative active	urn:cite2:tabulae:ls.v1:n15868
https://lingualatina.github.io/texts/browsable/hyginus/125a/	125a.6	125a.6.12	Ulixem		urn:cite2:tabulae:ls.v1:null
https://lingualatina.github.io/texts/browsable/hyginus/125a/	125a.6	125a.6.13	hospitio	noun: neuter dative singular	urn:cite2:tabulae:ls.v1:n21007
https://lingualatina.github.io/texts/browsable/hyginus/125a/	125a.6	125a.6.13	hospitio	noun: neuter ablative singular	urn:cite2:tabulae:ls.v1:n21007
https://lingualatina.github.io/texts/browsable/hyginus/125a/	125a.6	125a.6.14	libere	finite verb: second singular present indicative passive	urn:cite2:tabulae:ls.v1:n26488
https://lingualatina.github.io/texts/browsable/hyginus/125a/	125a.6	125a.6.14	libere	finite verb: second singular present imperative passive	urn:cite2:tabulae:ls.v1:n26488
https://lingualatina.github.io/texts/browsable/hyginus/125a/	125a.6	125a.6.14	libere	infinitive: present active	urn:cite2:tabulae:ls.v1:n26488
https://lingualatina.github.io/texts/browsable/hyginus/125a/	125a.6	125a.6.15	accepit	finite verb: third singular perfect indicative active	urn:cite2:tabulae:ls.v1:n363
https://lingualatina.github.io/texts/browsable/hyginus/125a/	125a.6	125a.6.15_0	,		urn:cite2:tabulae:ls.v1:null
https://lingualatina.github.io/texts/browsable/hyginus/125a/	125a.6	125a.6.17	uentorum	participle: perfect passive masculine genitive plural	urn:cite2:tabulae:ls.v1:n50442
https://lingualatina.github.io/texts/browsable/hyginus/125a/	125a.6	125a.6.17	uentorum	participle: perfect passive neuter genitive plural	urn:cite2:tabulae:ls.v1:n50442
https://lingualatina.github.io/texts/browsable/hyginus/125a/	125a.6	125a.6.18	ei	pronoun: masculine dative singular	urn:cite2:tabulae:ls.v1:n25029
https://lingualatina.github.io/texts/browsable/hyginus/125a/	125a.6	125a.6.18	ei	pronoun: feminine dative singular	urn:cite2:tabulae:ls.v1:n25029
https://lingualatina.github.io/texts/browsable/hyginus/125a/	125a.6	125a.6.18	ei	pronoun: neuter dative singular	urn:cite2:tabulae:ls.v1:n25029
https://lingualatina.github.io/texts/browsable/hyginus/125a/	125a.6	125a.6.18	ei	pronoun: masculine nominative plural	urn:cite2:tabulae:ls.v1:n25029
https://lingualatina.github.io/texts/browsable/hyginus/125a/	125a.6	125a.6.19	plenos	adjective: masculine accusative plural positive	urn:cite2:tabulae:ls.v1:n36651
https://lingualatina.github.io/texts/browsable/hyginus/125a/	125a.6	125a.6.20	muneri	noun: neuter dative singular	urn:cite2:tabulae:ls.v1:n30017
https://lingualatina.github.io/texts/browsable/hyginus/125a/	125a.6	125a.6.21	dedit	finite verb: third singular perfect indicative active	urn:cite2:tabulae:ls.v1:n14599
https://lingualatina.github.io/texts/browsable/hyginus/125a/	125a.6	125a.6.21	dedit	finite verb: third singular present indicative active	urn:cite2:tabulae:ls.v1:n12628
https://lingualatina.github.io/texts/browsable/hyginus/125a/	125a.6	125a.6.21_0	.		urn:cite2:tabulae:ls.v1:null
https://lingualatina.github.io/texts/browsable/hyginus/125a/	125a.6	125a.6.22	socii	adjective: masculine nominative plural positive	urn:cite2:tabulae:ls.v1:n44562
https://lingualatina.github.io/texts/browsable/hyginus/125a/	125a.6	125a.6.22	socii	adjective: masculine genitive singular positive	urn:cite2:tabulae:ls.v1:n44562
https://lingualatina.github.io/texts/browsable/hyginus/125a/	125a.6	125a.6.22	socii	adjective: masculine vocative plural positive	urn:cite2:tabulae:ls.v1:n44562
https://lingualatina.github.io/texts/browsable/hyginus/125a/	125a.6	125a.6.22	socii	adjective: neuter genitive singular positive	urn:cite2:tabulae:ls.v1:n44562
https://lingualatina.github.io/texts/browsable/hyginus/125a/	125a.6	125a.6.23	uero	adjective: masculine dative singular positive	urn:cite2:tabulae:ls.v1:n50667
https://lingualatina.github.io/texts/browsable/hyginus/125a/	125a.6	125a.6.23	uero	adjective: masculine ablative singular positive	urn:cite2:tabulae:ls.v1:n50667
https://lingualatina.github.io/texts/browsable/hyginus/125a/	125a.6	125a.6.23	uero	adjective: neuter dative singular positive	urn:cite2:tabulae:ls.v1:n50667
https://lingualatina.github.io/texts/browsable/hyginus/125a/	125a.6	125a.6.23	uero	adjective: neuter ablative singular positive	urn:cite2:tabulae:ls.v1:n50667
https://lingualatina.github.io/texts/browsable/hyginus/125a/	125a.6	125a.6.24	aurum	noun: neuter nominative singular	urn:cite2:tabulae:ls.v1:n4588
https://lingualatina.github.io/texts/browsable/hyginus/125a/	125a.6	125a.6.24	aurum	noun: neuter accusative singular	urn:cite2:tabulae:ls.v1:n4588
https://lingualatina.github.io/texts/browsable/hyginus/125a/	125a.6	125a.6.24	aurum	noun: neuter vocative singular	urn:cite2:tabulae:ls.v1:n4588
https://lingualatina.github.io/texts/browsable/hyginus/125a/	125a.6	125a.6.26	credentes	participle: present active masculine nominative plural	urn:cite2:tabulae:ls.v1:n11525
https://lingualatina.github.io/texts/browsable/hyginus/125a/	125a.6	125a.6.26	credentes	participle: present active masculine accusative plural	urn:cite2:tabulae:ls.v1:n11525
https://lingualatina.github.io/texts/browsable/hyginus/125a/	125a.6	125a.6.26	credentes	participle: present active masculine vocative plural	urn:cite2:tabulae:ls.v1:n11525
https://lingualatina.github.io/texts/browsable/hyginus/125a/	125a.6	125a.6.26	credentes	participle: present active feminine nominative plural	urn:cite2:tabulae:ls.v1:n11525
https://lingualatina.github.io/texts/browsable/hyginus/125a/	125a.6	125a.6.26	credentes	participle: present active feminine accusative plural	urn:cite2:tabulae:ls.v1:n11525
https://lingualatina.github.io/texts/browsable/hyginus/125a/	125a.6	125a.6.26	credentes	participle: present active feminine vocative plural	urn:cite2:tabulae:ls.v1:n11525
https://lingualatina.github.io/texts/browsable/hyginus/125a/	125a.6	125a.6.27	cum	uninflected preposition	urn:cite2:tabulae:ls.v1:n11872
https://lingualatina.github.io/texts/browsable/hyginus/125a/	125a.6	125a.6.28	accepissent	finite verb: third plural pluperfect subjunctive active	urn:cite2:tabulae:ls.v1:n363
https://lingualatina.github.io/texts/browsable/hyginus/125a/	125a.6	125a.6.29	et	uninflected conjunction	urn:cite2:tabulae:ls.v1:n16278
https://lingualatina.github.io/texts/browsable/hyginus/125a/	125a.6	125a.6.30	se	participle: perfect passive masculine vocative singular	urn:cite2:l3:composites.v1:do
https://lingualatina.github.io/texts/browsable/hyginus/125a/	125a.6	125a.6.30	se	pronoun: masculine accusative singular	urn:cite2:tabulae:ls.v1:n46498
https://lingualatina.github.io/texts/browsable/hyginus/125a/	125a.6	125a.6.30	se	pronoun: masculine ablative singular	urn:cite2:tabulae:ls.v1:n46498
https://lingualatina.github.io/texts/browsable/hyginus/125a/	125a.6	125a.6.30	se	pronoun: feminine ablative singular	urn:cite2:tabulae:ls.v1:n46498
https://lingualatina.github.io/texts/browsable/hyginus/125a/	125a.6	125a.6.30	se	pronoun: neuter ablative singular	urn:cite2:tabulae:ls.v1:n46498
https://lingualatina.github.io/texts/browsable/hyginus/125a/	125a.6	125a.6.30	se	pronoun: feminine ablative plural	urn:cite2:tabulae:ls.v1:n46498
https://lingualatina.github.io/texts/browsable/hyginus/125a/	125a.6	125a.6.30	se	pronoun: neuter accusative plural	urn:cite2:tabulae:ls.v1:n46498
https://lingualatina.github.io/texts/browsable/hyginus/125a/	125a.6	125a.6.30	se	pronoun: feminine accusative plural	urn:cite2:tabulae:ls.v1:n46498
https://lingualatina.github.io/texts/browsable/hyginus/125a/	125a.6	125a.6.30	se	pronoun: neuter ablative plural	urn:cite2:tabulae:ls.v1:n46498
https://lingualatina.github.io/texts/browsable/hyginus/125a/	125a.6	125a.6.30	se	pronoun: feminine accusative singular	urn:cite2:tabulae:ls.v1:n46498
https://lingualatina.github.io/texts/browsable/hyginus/125a/	125a.6	125a.6.30	se	pronoun: neuter accusative singular	urn:cite2:tabulae:ls.v1:n46498
https://lingualatina.github.io/texts/browsable/hyginus/125a/	125a.6	125a.6.30	se	pronoun: masculine accusative plural	urn:cite2:tabulae:ls.v1:n46498
https://lingualatina.github.io/texts/browsable/hyginus/125a/	125a.6	125a.6.30	se	pronoun: masculine ablative plural	urn:cite2:tabulae:ls.v1:n46498
https://lingualatina.github.io/texts/browsable/hyginus/125a/	125a.6	125a.6.31	cum	uninflected preposition	urn:cite2:tabulae:ls.v1:n11872
https://lingualatina.github.io/texts/browsable/hyginus/125a/	125a.6	125a.6.32	partiri		urn:cite2:tabulae:ls.v1:null
https://lingualatina.github.io/texts/browsable/hyginus/125a/	125a.6	125a.6.33	uellent	finite verb: third plural imperfect subjunctive active	urn:cite2:tabulae:ls.v1:n51298
https://lingualatina.github.io/texts/browsable/hyginus/125a/	125a.6	125a.6.33_0	,		urn:cite2:tabulae:ls.v1:null
https://lingualatina.github.io/texts/browsable/hyginus/125a/	125a.6	125a.6.34	folles		urn:cite2:tabulae:ls.v1:null
https://lingualatina.github.io/texts/browsable/hyginus/125a/	125a.6	125a.6.35	clam	adverb: positive degree	urn:cite2:tabulae:ls.v1:n8472
https://lingualatina.github.io/texts/browsable/hyginus/125a/	125a.6	125a.6.36	soluerunt	finite verb: third plural perfect indicative active	urn:cite2:tabulae:ls.v1:n44608
https://lingualatina.github.io/texts/browsable/hyginus/125a/	125a.6	125a.6.38	euolauerunt		urn:cite2:tabulae:ls.v1:null
https://lingualatina.github.io/texts/browsable/hyginus/125a/	125a.6	125a.6.38_0	.		urn:cite2:tabulae:ls.v1:null
https://lingualatina.github.io/texts/browsable/hyginus/125a/	125a.6	125a.6.39	rursum		urn:cite2:tabulae:ls.v1:null
https://lingualatina.github.io/texts/browsable/hyginus/125a/	125a.6	125a.6.40	ad	uninflected preposition	urn:cite2:tabulae:ls.v1:n665
https://lingualatina.github.io/texts/browsable/hyginus/125a/	125a.6	125a.6.41	Aeolum	noun: masculine accusative singular	urn:cite2:tabulae:ls.v1:n1263
https://lingualatina.github.io/texts/browsable/hyginus/125a/	125a.6	125a.6.42	est	finite verb: third singular present indicative active	urn:cite2:tabulae:ls.v1:n46529
https://lingualatina.github.io/texts/browsable/hyginus/125a/	125a.6	125a.6.43	delatus	participle: perfect passive masculine nominative singular	urn:cite2:tabulae:ls.v1:n12677
https://lingualatina.github.io/texts/browsable/hyginus/125a/	125a.6	125a.6.43_0	,		urn:cite2:tabulae:ls.v1:null
https://lingualatina.github.io/texts/browsable/hyginus/125a/	125a.6	125a.6.44	a	uninflected preposition	urn:cite2:tabulae:ls.v1:n4
https://lingualatina.github.io/texts/browsable/hyginus/125a/	125a.6	125a.6.45	quo	pronoun: masculine ablative singular	urn:cite2:tabulae:ls.v1:n40242
https://lingualatina.github.io/texts/browsable/hyginus/125a/	125a.6	125a.6.45	quo	pronoun: feminine ablative singular	urn:cite2:tabulae:ls.v1:n40242
https://lingualatina.github.io/texts/browsable/hyginus/125a/	125a.6	125a.6.45	quo	pronoun: neuter ablative singular	urn:cite2:tabulae:ls.v1:n40242
https://lingualatina.github.io/texts/browsable/hyginus/125a/	125a.6	125a.6.45	quo	pronoun: masculine ablative singular	urn:cite2:tabulae:ls.v1:n40103
https://lingualatina.github.io/texts/browsable/hyginus/125a/	125a.6	125a.6.45	quo	pronoun: neuter ablative singular	urn:cite2:tabulae:ls.v1:n40103
https://lingualatina.github.io/texts/browsable/hyginus/125a/	125a.6	125a.6.46	eiectus	participle: perfect passive masculine nominative singular	urn:cite2:tabulae:ls.v1:n15344
https://lingualatina.github.io/texts/browsable/hyginus/125a/	125a.6	125a.6.47	est	finite verb: third singular present indicative active	urn:cite2:tabulae:ls.v1:n46529
https://lingualatina.github.io/texts/browsable/hyginus/125a/	125a.6	125a.6.47_0	,		urn:cite2:tabulae:ls.v1:null
https://lingualatina.github.io/texts/browsable/hyginus/125a/	125a.6	125a.6.48	quod	uninflected conjunction	urn:cite2:tabulae:ls.v1:n40262
https://lingualatina.github.io/texts/browsable/hyginus/125a/	125a.6	125a.6.48	quod	pronoun: neuter accusative singular	urn:cite2:tabulae:ls.v1:n40103
https://lingualatina.github.io/texts/browsable/hyginus/125a/	125a.6	125a.6.48	quod	pronoun: neuter nominative singular	urn:cite2:tabulae:ls.v1:n40103
https://lingualatina.github.io/texts/browsable/hyginus/125a/	125a.6	125a.6.49	uidebatur	finite verb: third singular imperfect indicative passive	urn:cite2:tabulae:ls.v1:n50883
https://lingualatina.github.io/texts/browsable/hyginus/125a/	125a.6	125a.6.49	uidebatur	finite verb: third singular imperfect indicative passive	urn:cite2:tabulae:ls.v1:n50883
https://lingualatina.github.io/texts/browsable/hyginus/125a/	125a.6	125a.6.50	Ulixes		urn:cite2:tabulae:ls.v1:null
https://lingualatina.github.io/texts/browsable/hyginus/125a/	125a.6	125a.6.51	numen	noun: neuter nominative singular	urn:cite2:tabulae:ls.v1:n31401
https://lingualatina.github.io/texts/browsable/hyginus/125a/	125a.6	125a.6.51	numen	noun: neuter accusative singular	urn:cite2:tabulae:ls.v1:n31401
https://lingualatina.github.io/texts/browsable/hyginus/125a/	125a.6	125a.6.51	numen	noun: neuter vocative singular	urn:cite2:tabulae:ls.v1:n31401
https://lingualatina.github.io/texts/browsable/hyginus/125a/	125a.6	125a.6.52	deorum	noun: masculine genitive plural	urn:cite2:tabulae:ls.v1:n13573
https://lingualatina.github.io/texts/browsable/hyginus/125a/	125a.6	125a.6.52	deorum	noun: masculine genitive plural	urn:cite2:tabulae:ls.v1:n13573
https://lingualatina.github.io/texts/browsable/hyginus/125a/	125a.6	125a.6.53	infestum	adjective: masculine accusative singular positive	urn:cite2:tabulae:ls.v1:n23184
https://lingualatina.github.io/texts/browsable/hyginus/125a/	125a.6	125a.6.53	infestum	adjective: neuter nominative singular positive	urn:cite2:tabulae:ls.v1:n23184
https://lingualatina.github.io/texts/browsable/hyginus/125a/	125a.6	125a.6.53	infestum	adjective: neuter accusative singular positive	urn:cite2:tabulae:ls.v1:n23184
https://lingualatina.github.io/texts/browsable/hyginus/125a/	125a.6	125a.6.53	infestum	adjective: neuter vocative singular positive	urn:cite2:tabulae:ls.v1:n23184
https://lingualatina.github.io/texts/browsable/hyginus/125a/	125a.6	125a.6.54	habere	finite verb: second singular present indicative passive	urn:cite2:tabulae:ls.v1:n20077
https://lingualatina.github.io/texts/browsable/hyginus/125a/	125a.6	125a.6.54	habere	finite verb: second singular present imperative passive	urn:cite2:tabulae:ls.v1:n20077
https://lingualatina.github.io/texts/browsable/hyginus/125a/	125a.6	125a.6.54	habere	infinitive: present active	urn:cite2:tabulae:ls.v1:n20077
https://lingualatina.github.io/texts/browsable/hyginus/125a/	125a.6	125a.6.54_0	,		urn:cite2:tabulae:ls.v1:null