url	passage	tokenid	token	form	lexeme
https://lingualatina.github.io/texts/browsable/hyginus/152a/	152a.2	152a.2.0	Iouis		ls.null
https://lingualatina.github.io/texts/browsable/hyginus/152a/	152a.2	152a.2.1	fulmine	noun: neuter ablative singular	ls.n18993:fulmen
https://lingualatina.github.io/texts/browsable/hyginus/152a/	152a.2	152a.2.2	ardenti	participle: present active masculine dative singular	ls.n3492:ardeo
https://lingualatina.github.io/texts/browsable/hyginus/152a/	152a.2	152a.2.2	ardenti	participle: present active masculine ablative singular	ls.n3492:ardeo
https://lingualatina.github.io/texts/browsable/hyginus/152a/	152a.2	152a.2.2	ardenti	participle: present active feminine dative singular	ls.n3492:ardeo
https://lingualatina.github.io/texts/browsable/hyginus/152a/	152a.2	152a.2.2	ardenti	participle: present active feminine ablative singular	ls.n3492:ardeo
https://lingualatina.github.io/texts/browsable/hyginus/152a/	152a.2	152a.2.2	ardenti	participle: present active neuter dative singular	ls.n3492:ardeo
https://lingualatina.github.io/texts/browsable/hyginus/152a/	152a.2	152a.2.2	ardenti	participle: present active neuter ablative singular	ls.n3492:ardeo
https://lingualatina.github.io/texts/browsable/hyginus/152a/	152a.2	152a.2.3	pectus	noun: neuter nominative singular	ls.n34282:pectus
https://lingualatina.github.io/texts/browsable/hyginus/152a/	152a.2	152a.2.3	pectus	noun: neuter accusative singular	ls.n34282:pectus
https://lingualatina.github.io/texts/browsable/hyginus/152a/	152a.2	152a.2.3	pectus	noun: neuter vocative singular	ls.n34282:pectus
https://lingualatina.github.io/texts/browsable/hyginus/152a/	152a.2	152a.2.4	eius	pronoun: feminine genitive singular	ls.n25029:is
https://lingualatina.github.io/texts/browsable/hyginus/152a/	152a.2	152a.2.4	eius	pronoun: neuter genitive singular	ls.n25029:is
https://lingualatina.github.io/texts/browsable/hyginus/152a/	152a.2	152a.2.4	eius	pronoun: masculine genitive singular	ls.n25029:is
https://lingualatina.github.io/texts/browsable/hyginus/152a/	152a.2	152a.2.5	percussit	finite verb: third singular perfect indicative active	ls.n34771:percutio
https://lingualatina.github.io/texts/browsable/hyginus/152a/	152a.2	152a.2.5_0	;		ls.null
https://lingualatina.github.io/texts/browsable/hyginus/152a/	152a.2	152a.2.6	cui	pronoun: masculine dative singular	ls.n40242:quis1
https://lingualatina.github.io/texts/browsable/hyginus/152a/	152a.2	152a.2.6	cui	pronoun: neuter dative singular	ls.n40242:quis1
https://lingualatina.github.io/texts/browsable/hyginus/152a/	152a.2	152a.2.6	cui	pronoun: feminine dative singular	ls.n40242:quis1
https://lingualatina.github.io/texts/browsable/hyginus/152a/	152a.2	152a.2.6	cui	pronoun: masculine dative singular	ls.n40103:qui1
https://lingualatina.github.io/texts/browsable/hyginus/152a/	152a.2	152a.2.6	cui	pronoun: neuter dative singular	ls.n40103:qui1
https://lingualatina.github.io/texts/browsable/hyginus/152a/	152a.2	152a.2.6	cui	pronoun: feminine dative singular	ls.n40103:qui1
https://lingualatina.github.io/texts/browsable/hyginus/152a/	152a.2	152a.2.7	cum	uninflected preposition	ls.n11872:cum1
https://lingualatina.github.io/texts/browsable/hyginus/152a/	152a.2	152a.2.8	flaglaret		ls.null
https://lingualatina.github.io/texts/browsable/hyginus/152a/	152a.2	152a.2.9	montem	noun: masculine accusative singular	ls.n29604:mons
https://lingualatina.github.io/texts/browsable/hyginus/152a/	152a.2	152a.2.10	Aetnam		ls.null
https://lingualatina.github.io/texts/browsable/hyginus/152a/	152a.2	152a.2.11	qui	pronoun: masculine nominative plural	ls.n40242:quis1
https://lingualatina.github.io/texts/browsable/hyginus/152a/	152a.2	152a.2.11	qui	pronoun: masculine nominative plural	ls.n40103:qui1
https://lingualatina.github.io/texts/browsable/hyginus/152a/	152a.2	152a.2.11	qui	pronoun: masculine nominative singular	ls.n40103:qui1
https://lingualatina.github.io/texts/browsable/hyginus/152a/	152a.2	152a.2.12	est	finite verb: third singular present indicative active	ls.n46529:sum1
https://lingualatina.github.io/texts/browsable/hyginus/152a/	152a.2	152a.2.13	in	uninflected preposition	ls.n22111:in1
https://lingualatina.github.io/texts/browsable/hyginus/152a/	152a.2	152a.2.14	Sicilia		ls.null
https://lingualatina.github.io/texts/browsable/hyginus/152a/	152a.2	152a.2.15	super	uninflected preposition	ls.n46609:super2
https://lingualatina.github.io/texts/browsable/hyginus/152a/	152a.2	152a.2.15	super	adverb: positive degree	ls.n46609:super2
https://lingualatina.github.io/texts/browsable/hyginus/152a/	152a.2	152a.2.16	eum	pronoun: masculine accusative singular	ls.n25029:is
https://lingualatina.github.io/texts/browsable/hyginus/152a/	152a.2	152a.2.17	imposuit	finite verb: third singular perfect indicative active	ls.n21980:impono
https://lingualatina.github.io/texts/browsable/hyginus/152a/	152a.2	152a.2.17_0	,		ls.null
https://lingualatina.github.io/texts/browsable/hyginus/152a/	152a.2	152a.2.18	qui	pronoun: masculine nominative plural	ls.n40242:quis1
https://lingualatina.github.io/texts/browsable/hyginus/152a/	152a.2	152a.2.18	qui	pronoun: masculine nominative plural	ls.n40103:qui1
https://lingualatina.github.io/texts/browsable/hyginus/152a/	152a.2	152a.2.18	qui	pronoun: masculine nominative singular	ls.n40103:qui1
https://lingualatina.github.io/texts/browsable/hyginus/152a/	152a.2	152a.2.19	ex	uninflected conjunction	ls.n16519:ex
https://lingualatina.github.io/texts/browsable/hyginus/152a/	152a.2	152a.2.20	eo	pronoun: masculine ablative singular	ls.n25029:is
https://lingualatina.github.io/texts/browsable/hyginus/152a/	152a.2	152a.2.20	eo	pronoun: neuter ablative singular	ls.n25029:is
https://lingualatina.github.io/texts/browsable/hyginus/152a/	152a.2	152a.2.20	eo	finite verb: first singular present indicative active	ls.n15868:eo1
https://lingualatina.github.io/texts/browsable/hyginus/152a/	152a.2	152a.2.21	adhuc	adverb: positive degree	ls.n790:adhuc
https://lingualatina.github.io/texts/browsable/hyginus/152a/	152a.2	152a.2.22	ardere	finite verb: second singular present indicative passive	ls.n3492:ardeo
https://lingualatina.github.io/texts/browsable/hyginus/152a/	152a.2	152a.2.22	ardere	finite verb: second singular present imperative passive	ls.n3492:ardeo
https://lingualatina.github.io/texts/browsable/hyginus/152a/	152a.2	152a.2.22	ardere	infinitive: present active	ls.n3492:ardeo
https://lingualatina.github.io/texts/browsable/hyginus/152a/	152a.2	152a.2.23	dicitur	finite verb: third singular present indicative passive	ls.n13804:dico2
https://lingualatina.github.io/texts/browsable/hyginus/152a/	152a.2	152a.2.23_0	.		ls.null