url	passage	tokenid	token	form	lexeme
https://lingualatina.github.io/texts/browsable/hyginus/165a/	165a.3	165a.3.0	quas	pronoun: feminine accusative plural	ls.n40242:quis1
https://lingualatina.github.io/texts/browsable/hyginus/165a/	165a.3	165a.3.0	quas	pronoun: feminine accusative plural	ls.n40103:qui1
https://lingualatina.github.io/texts/browsable/hyginus/165a/	165a.3	165a.3.1	Marsyas		ls.null
https://lingualatina.github.io/texts/browsable/hyginus/165a/	165a.3	165a.3.2	Oeagri		ls.null
https://lingualatina.github.io/texts/browsable/hyginus/165a/	165a.3	165a.3.3	filius	noun: masculine nominative singular	ls.n18185:filius
https://lingualatina.github.io/texts/browsable/hyginus/165a/	165a.3	165a.3.4	pastor	noun: masculine nominative singular	ls.n34067:pastor
https://lingualatina.github.io/texts/browsable/hyginus/165a/	165a.3	165a.3.4	pastor	noun: masculine vocative singular	ls.n34067:pastor
https://lingualatina.github.io/texts/browsable/hyginus/165a/	165a.3	165a.3.5	unus	adjective: masculine nominative singular positive	ls.n49871:unus
https://lingualatina.github.io/texts/browsable/hyginus/165a/	165a.3	165a.3.6	e	uninflected conjunction	ls.n16519:ex
https://lingualatina.github.io/texts/browsable/hyginus/165a/	165a.3	165a.3.7	satyris	noun: masculine dative plural	ls.n42755:satyrus
https://lingualatina.github.io/texts/browsable/hyginus/165a/	165a.3	165a.3.7	satyris	noun: masculine ablative plural	ls.n42755:satyrus
https://lingualatina.github.io/texts/browsable/hyginus/165a/	165a.3	165a.3.8	inuenit	finite verb: third singular perfect indicative active	ls.n24717:invenio
https://lingualatina.github.io/texts/browsable/hyginus/165a/	165a.3	165a.3.8	inuenit	finite verb: third singular present indicative active	ls.n24717:invenio
https://lingualatina.github.io/texts/browsable/hyginus/165a/	165a.3	165a.3.8_0	,		ls.null
https://lingualatina.github.io/texts/browsable/hyginus/165a/	165a.3	165a.3.9	quibus	pronoun: masculine dative plural	ls.n40242:quis1
https://lingualatina.github.io/texts/browsable/hyginus/165a/	165a.3	165a.3.9	quibus	pronoun: masculine ablative plural	ls.n40242:quis1
https://lingualatina.github.io/texts/browsable/hyginus/165a/	165a.3	165a.3.9	quibus	pronoun: feminine ablative plural	ls.n40242:quis1
https://lingualatina.github.io/texts/browsable/hyginus/165a/	165a.3	165a.3.9	quibus	pronoun: neuter dative plural	ls.n40242:quis1
https://lingualatina.github.io/texts/browsable/hyginus/165a/	165a.3	165a.3.9	quibus	pronoun: neuter ablative plural	ls.n40242:quis1
https://lingualatina.github.io/texts/browsable/hyginus/165a/	165a.3	165a.3.9	quibus	pronoun: feminine dative plural	ls.n40242:quis1
https://lingualatina.github.io/texts/browsable/hyginus/165a/	165a.3	165a.3.9	quibus	pronoun: masculine dative plural	ls.n40103:qui1
https://lingualatina.github.io/texts/browsable/hyginus/165a/	165a.3	165a.3.9	quibus	pronoun: neuter ablative plural	ls.n40103:qui1
https://lingualatina.github.io/texts/browsable/hyginus/165a/	165a.3	165a.3.9	quibus	pronoun: neuter dative plural	ls.n40103:qui1
https://lingualatina.github.io/texts/browsable/hyginus/165a/	165a.3	165a.3.9	quibus	pronoun: feminine ablative plural	ls.n40103:qui1
https://lingualatina.github.io/texts/browsable/hyginus/165a/	165a.3	165a.3.9	quibus	pronoun: feminine dative plural	ls.n40103:qui1
https://lingualatina.github.io/texts/browsable/hyginus/165a/	165a.3	165a.3.9	quibus	pronoun: masculine ablative plural	ls.n40103:qui1
https://lingualatina.github.io/texts/browsable/hyginus/165a/	165a.3	165a.3.10	assidue		ls.null
https://lingualatina.github.io/texts/browsable/hyginus/165a/	165a.3	165a.3.11	commeletando		ls.null
https://lingualatina.github.io/texts/browsable/hyginus/165a/	165a.3	165a.3.12	sonum		ls.null
https://lingualatina.github.io/texts/browsable/hyginus/165a/	165a.3	165a.3.13	suauiorem		ls.null
https://lingualatina.github.io/texts/browsable/hyginus/165a/	165a.3	165a.3.14	in	uninflected preposition	ls.n22111:in1
https://lingualatina.github.io/texts/browsable/hyginus/165a/	165a.3	165a.3.15	dies	noun: feminine nominative singular	ls.n13847:dies
https://lingualatina.github.io/texts/browsable/hyginus/165a/	165a.3	165a.3.15	dies	noun: feminine nominative plural	ls.n13847:dies
https://lingualatina.github.io/texts/browsable/hyginus/165a/	165a.3	165a.3.15	dies	noun: feminine accusative plural	ls.n13847:dies
https://lingualatina.github.io/texts/browsable/hyginus/165a/	165a.3	165a.3.15	dies	noun: feminine vocative singular	ls.n13847:dies
https://lingualatina.github.io/texts/browsable/hyginus/165a/	165a.3	165a.3.15	dies	noun: feminine vocative plural	ls.n13847:dies
https://lingualatina.github.io/texts/browsable/hyginus/165a/	165a.3	165a.3.16	faciebat	finite verb: third singular imperfect indicative active	ls.n17516:facio
https://lingualatina.github.io/texts/browsable/hyginus/165a/	165a.3	165a.3.16_0	,		ls.null
https://lingualatina.github.io/texts/browsable/hyginus/165a/	165a.3	165a.3.17	adeo	adverb: positive degree	ls.n754:adeo2
https://lingualatina.github.io/texts/browsable/hyginus/165a/	165a.3	165a.3.18	ut	uninflected conjunction	ls.n49975:ut
https://lingualatina.github.io/texts/browsable/hyginus/165a/	165a.3	165a.3.19	Apollinem	noun: masculine accusative singular	ls.n3063:Apollo
https://lingualatina.github.io/texts/browsable/hyginus/165a/	165a.3	165a.3.20	ad	uninflected preposition	ls.n665:ad
https://lingualatina.github.io/texts/browsable/hyginus/165a/	165a.3	165a.3.21	citharae	noun: feminine nominative plural	ls.n8428:cithara
https://lingualatina.github.io/texts/browsable/hyginus/165a/	165a.3	165a.3.21	citharae	noun: feminine genitive singular	ls.n8428:cithara
https://lingualatina.github.io/texts/browsable/hyginus/165a/	165a.3	165a.3.21	citharae	noun: feminine dative singular	ls.n8428:cithara
https://lingualatina.github.io/texts/browsable/hyginus/165a/	165a.3	165a.3.21	citharae	noun: feminine vocative plural	ls.n8428:cithara
https://lingualatina.github.io/texts/browsable/hyginus/165a/	165a.3	165a.3.22	cantum	noun: masculine accusative singular	ls.n6576:cantus
https://lingualatina.github.io/texts/browsable/hyginus/165a/	165a.3	165a.3.22	cantum	participle: perfect passive masculine accusative singular	ls.n6524:cano
https://lingualatina.github.io/texts/browsable/hyginus/165a/	165a.3	165a.3.22	cantum	participle: perfect passive neuter nominative singular	ls.n6524:cano
https://lingualatina.github.io/texts/browsable/hyginus/165a/	165a.3	165a.3.22	cantum	participle: perfect passive neuter vocative singular	ls.n6524:cano
https://lingualatina.github.io/texts/browsable/hyginus/165a/	165a.3	165a.3.22	cantum	supine: accusative	ls.n6524:cano
https://lingualatina.github.io/texts/browsable/hyginus/165a/	165a.3	165a.3.23	in	uninflected preposition	ls.n22111:in1
https://lingualatina.github.io/texts/browsable/hyginus/165a/	165a.3	165a.3.24	certamen	noun: neuter nominative singular	ls.n7579:certamen
https://lingualatina.github.io/texts/browsable/hyginus/165a/	165a.3	165a.3.24	certamen	noun: neuter accusative singular	ls.n7579:certamen
https://lingualatina.github.io/texts/browsable/hyginus/165a/	165a.3	165a.3.24	certamen	noun: neuter vocative singular	ls.n7579:certamen
https://lingualatina.github.io/texts/browsable/hyginus/165a/	165a.3	165a.3.25	prouocaret	finite verb: third singular imperfect subjunctive active	ls.n39228:provoco
https://lingualatina.github.io/texts/browsable/hyginus/165a/	165a.3	165a.3.25_0	.		ls.null