url	passage	tokenid	token	form	lexeme
https://lingualatina.github.io/texts/browsable/hyginus/165a/	165a.5	165a.5.0	itaque	uninflected conjunction	ls.n25104:itaque
https://lingualatina.github.io/texts/browsable/hyginus/165a/	165a.5	165a.5.1	Apollo	noun: masculine nominative singular	ls.n3063:Apollo
https://lingualatina.github.io/texts/browsable/hyginus/165a/	165a.5	165a.5.1	Apollo	noun: masculine vocative singular	ls.n3063:Apollo
https://lingualatina.github.io/texts/browsable/hyginus/165a/	165a.5	165a.5.2	uictum	participle: perfect passive masculine accusative singular	ls.n50968:vinco
https://lingualatina.github.io/texts/browsable/hyginus/165a/	165a.5	165a.5.2	uictum	participle: perfect passive neuter nominative singular	ls.n50968:vinco
https://lingualatina.github.io/texts/browsable/hyginus/165a/	165a.5	165a.5.2	uictum	participle: perfect passive neuter vocative singular	ls.n50968:vinco
https://lingualatina.github.io/texts/browsable/hyginus/165a/	165a.5	165a.5.2	uictum	participle: perfect passive masculine accusative singular	ls.n51238:vivo
https://lingualatina.github.io/texts/browsable/hyginus/165a/	165a.5	165a.5.2	uictum	participle: perfect passive neuter nominative singular	ls.n51238:vivo
https://lingualatina.github.io/texts/browsable/hyginus/165a/	165a.5	165a.5.2	uictum	participle: perfect passive neuter vocative singular	ls.n51238:vivo
https://lingualatina.github.io/texts/browsable/hyginus/165a/	165a.5	165a.5.3	Marsyan		ls.null
https://lingualatina.github.io/texts/browsable/hyginus/165a/	165a.5	165a.5.4	ad	uninflected preposition	ls.n665:ad
https://lingualatina.github.io/texts/browsable/hyginus/165a/	165a.5	165a.5.5	arborem	noun: feminine accusative singular	ls.n3372:arbor1
https://lingualatina.github.io/texts/browsable/hyginus/165a/	165a.5	165a.5.6	religatum	supine: accusative	ls.n40980:religo
https://lingualatina.github.io/texts/browsable/hyginus/165a/	165a.5	165a.5.6	religatum	participle: perfect passive masculine accusative singular	ls.n40980:religo
https://lingualatina.github.io/texts/browsable/hyginus/165a/	165a.5	165a.5.6	religatum	participle: perfect passive neuter nominative singular	ls.n40980:religo
https://lingualatina.github.io/texts/browsable/hyginus/165a/	165a.5	165a.5.6	religatum	participle: perfect passive neuter accusative singular	ls.n40980:religo
https://lingualatina.github.io/texts/browsable/hyginus/165a/	165a.5	165a.5.6	religatum	participle: perfect passive neuter vocative singular	ls.n40980:religo
https://lingualatina.github.io/texts/browsable/hyginus/165a/	165a.5	165a.5.7	Scythae		ls.null
https://lingualatina.github.io/texts/browsable/hyginus/165a/	165a.5	165a.5.8	tradidit	finite verb: third singular perfect indicative active	ls.n48671:trado
https://lingualatina.github.io/texts/browsable/hyginus/165a/	165a.5	165a.5.8_0	,		ls.null
https://lingualatina.github.io/texts/browsable/hyginus/165a/	165a.5	165a.5.9	qui	pronoun: masculine nominative plural	ls.n40242:quis1
https://lingualatina.github.io/texts/browsable/hyginus/165a/	165a.5	165a.5.9	qui	pronoun: masculine nominative plural	ls.n40103:qui1
https://lingualatina.github.io/texts/browsable/hyginus/165a/	165a.5	165a.5.9	qui	pronoun: masculine nominative singular	ls.n40103:qui1
https://lingualatina.github.io/texts/browsable/hyginus/165a/	165a.5	165a.5.10	eum	pronoun: masculine accusative singular	ls.n25029:is
https://lingualatina.github.io/texts/browsable/hyginus/165a/	165a.5	165a.5.11	membratim		ls.null
https://lingualatina.github.io/texts/browsable/hyginus/165a/	165a.5	165a.5.12	cute		ls.null
https://lingualatina.github.io/texts/browsable/hyginus/165a/	165a.5	165a.5.13	separauit	finite verb: third singular perfect indicative active	ls.n43701:separo
https://lingualatina.github.io/texts/browsable/hyginus/165a/	165a.5	165a.5.13_0	;		ls.null
https://lingualatina.github.io/texts/browsable/hyginus/165a/	165a.5	165a.5.14	reliquum	adjective: masculine accusative singular positive	ls.n40989:reliquus
https://lingualatina.github.io/texts/browsable/hyginus/165a/	165a.5	165a.5.14	reliquum	adjective: neuter nominative singular positive	ls.n40989:reliquus
https://lingualatina.github.io/texts/browsable/hyginus/165a/	165a.5	165a.5.14	reliquum	adjective: neuter accusative singular positive	ls.n40989:reliquus
https://lingualatina.github.io/texts/browsable/hyginus/165a/	165a.5	165a.5.14	reliquum	adjective: neuter vocative singular positive	ls.n40989:reliquus
https://lingualatina.github.io/texts/browsable/hyginus/165a/	165a.5	165a.5.15	corpus	noun: neuter nominative singular	ls.n11268:corpus
https://lingualatina.github.io/texts/browsable/hyginus/165a/	165a.5	165a.5.15	corpus	noun: neuter accusative singular	ls.n11268:corpus
https://lingualatina.github.io/texts/browsable/hyginus/165a/	165a.5	165a.5.15	corpus	noun: neuter vocative singular	ls.n11268:corpus
https://lingualatina.github.io/texts/browsable/hyginus/165a/	165a.5	165a.5.16	discipulo		ls.null
https://lingualatina.github.io/texts/browsable/hyginus/165a/	165a.5	165a.5.17	Olympo		ls.null
https://lingualatina.github.io/texts/browsable/hyginus/165a/	165a.5	165a.5.18	sepulturae	noun: feminine nominative plural	ls.n43803:sepultura
https://lingualatina.github.io/texts/browsable/hyginus/165a/	165a.5	165a.5.18	sepulturae	noun: feminine genitive singular	ls.n43803:sepultura
https://lingualatina.github.io/texts/browsable/hyginus/165a/	165a.5	165a.5.18	sepulturae	noun: feminine dative singular	ls.n43803:sepultura
https://lingualatina.github.io/texts/browsable/hyginus/165a/	165a.5	165a.5.18	sepulturae	noun: feminine vocative plural	ls.n43803:sepultura
https://lingualatina.github.io/texts/browsable/hyginus/165a/	165a.5	165a.5.18	sepulturae	participle: future active feminine nominative plural	ls.n43703:sepelio
https://lingualatina.github.io/texts/browsable/hyginus/165a/	165a.5	165a.5.18	sepulturae	participle: future active feminine genitive singular	ls.n43703:sepelio
https://lingualatina.github.io/texts/browsable/hyginus/165a/	165a.5	165a.5.18	sepulturae	participle: future active feminine dative singular	ls.n43703:sepelio
https://lingualatina.github.io/texts/browsable/hyginus/165a/	165a.5	165a.5.18	sepulturae	participle: future active feminine vocative plural	ls.n43703:sepelio
https://lingualatina.github.io/texts/browsable/hyginus/165a/	165a.5	165a.5.19	tradidit	finite verb: third singular perfect indicative active	ls.n48671:trado
https://lingualatina.github.io/texts/browsable/hyginus/165a/	165a.5	165a.5.19_0	,		ls.null
https://lingualatina.github.io/texts/browsable/hyginus/165a/	165a.5	165a.5.20	e	uninflected conjunction	ls.n16519:ex
https://lingualatina.github.io/texts/browsable/hyginus/165a/	165a.5	165a.5.21	cuius	pronoun: feminine genitive singular	ls.n40242:quis1
https://lingualatina.github.io/texts/browsable/hyginus/165a/	165a.5	165a.5.21	cuius	pronoun: neuter genitive singular	ls.n40242:quis1
https://lingualatina.github.io/texts/browsable/hyginus/165a/	165a.5	165a.5.21	cuius	pronoun: masculine genitive singular	ls.n40242:quis1
https://lingualatina.github.io/texts/browsable/hyginus/165a/	165a.5	165a.5.21	cuius	pronoun: feminine genitive singular	ls.n40103:qui1
https://lingualatina.github.io/texts/browsable/hyginus/165a/	165a.5	165a.5.21	cuius	pronoun: neuter genitive singular	ls.n40103:qui1
https://lingualatina.github.io/texts/browsable/hyginus/165a/	165a.5	165a.5.21	cuius	pronoun: masculine genitive singular	ls.n40103:qui1
https://lingualatina.github.io/texts/browsable/hyginus/165a/	165a.5	165a.5.22	sanguine	noun: masculine ablative singular	ls.n42533:sanguis
https://lingualatina.github.io/texts/browsable/hyginus/165a/	165a.5	165a.5.23	flumen	noun: neuter nominative singular	ls.n18442:flumen
https://lingualatina.github.io/texts/browsable/hyginus/165a/	165a.5	165a.5.23	flumen	noun: neuter accusative singular	ls.n18442:flumen
https://lingualatina.github.io/texts/browsable/hyginus/165a/	165a.5	165a.5.23	flumen	noun: neuter vocative singular	ls.n18442:flumen
https://lingualatina.github.io/texts/browsable/hyginus/165a/	165a.5	165a.5.24	Marsya		ls.null
https://lingualatina.github.io/texts/browsable/hyginus/165a/	165a.5	165a.5.25	est	finite verb: third singular present indicative active	ls.n46529:sum1
https://lingualatina.github.io/texts/browsable/hyginus/165a/	165a.5	165a.5.26	appellatum	supine: accusative	ls.n3134:appello2
https://lingualatina.github.io/texts/browsable/hyginus/165a/	165a.5	165a.5.26	appellatum	participle: perfect passive masculine accusative singular	ls.n3134:appello2
https://lingualatina.github.io/texts/browsable/hyginus/165a/	165a.5	165a.5.26	appellatum	participle: perfect passive neuter nominative singular	ls.n3134:appello2
https://lingualatina.github.io/texts/browsable/hyginus/165a/	165a.5	165a.5.26	appellatum	participle: perfect passive neuter accusative singular	ls.n3134:appello2
https://lingualatina.github.io/texts/browsable/hyginus/165a/	165a.5	165a.5.26	appellatum	participle: perfect passive neuter vocative singular	ls.n3134:appello2
https://lingualatina.github.io/texts/browsable/hyginus/165a/	165a.5	165a.5.26_0	.		ls.null