url	passage	tokenid	token	form	lexeme
https://lingualatina.github.io/texts/browsable/hyginus/166a/	166a.5	166a.5.0	hae	pronoun: feminine nominative plural	ls.n20640:hic
https://lingualatina.github.io/texts/browsable/hyginus/166a/	166a.5	166a.5.1	cum	uninflected preposition	ls.n11872:cum1
https://lingualatina.github.io/texts/browsable/hyginus/166a/	166a.5	166a.5.2	cistulam		ls.null
https://lingualatina.github.io/texts/browsable/hyginus/166a/	166a.5	166a.5.3	aperuissent	finite verb: third plural pluperfect subjunctive active	ls.n2980:aperio
https://lingualatina.github.io/texts/browsable/hyginus/166a/	166a.5	166a.5.3_0	,		ls.null
https://lingualatina.github.io/texts/browsable/hyginus/166a/	166a.5	166a.5.4	cornix		ls.null
https://lingualatina.github.io/texts/browsable/hyginus/166a/	166a.5	166a.5.5	indicauit	finite verb: third singular perfect indicative active	ls.n22781:indico1
https://lingualatina.github.io/texts/browsable/hyginus/166a/	166a.5	166a.5.5_0	,		ls.null
https://lingualatina.github.io/texts/browsable/hyginus/166a/	166a.5	166a.5.6	illae	pronoun: feminine nominative plural	ls.n21494:ille
https://lingualatina.github.io/texts/browsable/hyginus/166a/	166a.5	166a.5.7	a	uninflected preposition	ls.n4:ab
https://lingualatina.github.io/texts/browsable/hyginus/166a/	166a.5	166a.5.8	Minerua		ls.null
https://lingualatina.github.io/texts/browsable/hyginus/166a/	166a.5	166a.5.9	insania	noun: feminine nominative singular	ls.n23716:insania
https://lingualatina.github.io/texts/browsable/hyginus/166a/	166a.5	166a.5.9	insania	noun: feminine ablative singular	ls.n23716:insania
https://lingualatina.github.io/texts/browsable/hyginus/166a/	166a.5	166a.5.9	insania	noun: feminine vocative singular	ls.n23716:insania
https://lingualatina.github.io/texts/browsable/hyginus/166a/	166a.5	166a.5.10	obiecta	participle: perfect passive feminine nominative singular	ls.n31628:obicio
https://lingualatina.github.io/texts/browsable/hyginus/166a/	166a.5	166a.5.10	obiecta	participle: perfect passive feminine ablative singular	ls.n31628:obicio
https://lingualatina.github.io/texts/browsable/hyginus/166a/	166a.5	166a.5.10	obiecta	participle: perfect passive feminine vocative singular	ls.n31628:obicio
https://lingualatina.github.io/texts/browsable/hyginus/166a/	166a.5	166a.5.10	obiecta	participle: perfect passive neuter nominative plural	ls.n31628:obicio
https://lingualatina.github.io/texts/browsable/hyginus/166a/	166a.5	166a.5.10	obiecta	participle: perfect passive neuter accusative plural	ls.n31628:obicio
https://lingualatina.github.io/texts/browsable/hyginus/166a/	166a.5	166a.5.10	obiecta	participle: perfect passive neuter vocative plural	ls.n31628:obicio
https://lingualatina.github.io/texts/browsable/hyginus/166a/	166a.5	166a.5.11	ipsae	pronoun: feminine nominative plural	ls.n24872:ipse
https://lingualatina.github.io/texts/browsable/hyginus/166a/	166a.5	166a.5.12	se	participle: perfect passive masculine vocative singular	ls.do
https://lingualatina.github.io/texts/browsable/hyginus/166a/	166a.5	166a.5.12	se	pronoun: masculine accusative singular	ls.n46498:sui
https://lingualatina.github.io/texts/browsable/hyginus/166a/	166a.5	166a.5.12	se	pronoun: masculine ablative singular	ls.n46498:sui
https://lingualatina.github.io/texts/browsable/hyginus/166a/	166a.5	166a.5.12	se	pronoun: feminine ablative singular	ls.n46498:sui
https://lingualatina.github.io/texts/browsable/hyginus/166a/	166a.5	166a.5.12	se	pronoun: neuter ablative singular	ls.n46498:sui
https://lingualatina.github.io/texts/browsable/hyginus/166a/	166a.5	166a.5.12	se	pronoun: feminine ablative plural	ls.n46498:sui
https://lingualatina.github.io/texts/browsable/hyginus/166a/	166a.5	166a.5.12	se	pronoun: neuter accusative plural	ls.n46498:sui
https://lingualatina.github.io/texts/browsable/hyginus/166a/	166a.5	166a.5.12	se	pronoun: feminine accusative plural	ls.n46498:sui
https://lingualatina.github.io/texts/browsable/hyginus/166a/	166a.5	166a.5.12	se	pronoun: neuter ablative plural	ls.n46498:sui
https://lingualatina.github.io/texts/browsable/hyginus/166a/	166a.5	166a.5.12	se	pronoun: feminine accusative singular	ls.n46498:sui
https://lingualatina.github.io/texts/browsable/hyginus/166a/	166a.5	166a.5.12	se	pronoun: neuter accusative singular	ls.n46498:sui
https://lingualatina.github.io/texts/browsable/hyginus/166a/	166a.5	166a.5.12	se	pronoun: masculine accusative plural	ls.n46498:sui
https://lingualatina.github.io/texts/browsable/hyginus/166a/	166a.5	166a.5.12	se	pronoun: masculine ablative plural	ls.n46498:sui
https://lingualatina.github.io/texts/browsable/hyginus/166a/	166a.5	166a.5.13	in	uninflected preposition	ls.n22111:in1
https://lingualatina.github.io/texts/browsable/hyginus/166a/	166a.5	166a.5.14	mare	noun: neuter nominative singular	ls.n28019:mare
https://lingualatina.github.io/texts/browsable/hyginus/166a/	166a.5	166a.5.14	mare	noun: neuter accusative singular	ls.n28019:mare
https://lingualatina.github.io/texts/browsable/hyginus/166a/	166a.5	166a.5.14	mare	noun: neuter vocative singular	ls.n28019:mare
https://lingualatina.github.io/texts/browsable/hyginus/166a/	166a.5	166a.5.15	praecipitauerunt	finite verb: third plural perfect indicative active	ls.n37415:praecipito
https://lingualatina.github.io/texts/browsable/hyginus/166a/	166a.5	166a.5.15_0	.		ls.null