url	passage	tokenid	token	form	lexeme
https://lingualatina.github.io/texts/browsable/hyginus/185a/	185a.5	185a.5.0	cui	pronoun: masculine dative singular	urn:cite2:tabulae:ls.v1:n40242
https://lingualatina.github.io/texts/browsable/hyginus/185a/	185a.5	185a.5.0	cui	pronoun: neuter dative singular	urn:cite2:tabulae:ls.v1:n40242
https://lingualatina.github.io/texts/browsable/hyginus/185a/	185a.5	185a.5.0	cui	pronoun: feminine dative singular	urn:cite2:tabulae:ls.v1:n40242
https://lingualatina.github.io/texts/browsable/hyginus/185a/	185a.5	185a.5.0	cui	pronoun: masculine dative singular	urn:cite2:tabulae:ls.v1:n40103
https://lingualatina.github.io/texts/browsable/hyginus/185a/	185a.5	185a.5.0	cui	pronoun: neuter dative singular	urn:cite2:tabulae:ls.v1:n40103
https://lingualatina.github.io/texts/browsable/hyginus/185a/	185a.5	185a.5.0	cui	pronoun: feminine dative singular	urn:cite2:tabulae:ls.v1:n40103
https://lingualatina.github.io/texts/browsable/hyginus/185a/	185a.5	185a.5.1	Schoeneus		urn:cite2:tabulae:ls.v1:null
https://lingualatina.github.io/texts/browsable/hyginus/185a/	185a.5	185a.5.2	ob	uninflected preposition	urn:cite2:tabulae:ls.v1:n31564
https://lingualatina.github.io/texts/browsable/hyginus/185a/	185a.5	185a.5.3	industriam		urn:cite2:tabulae:ls.v1:null
https://lingualatina.github.io/texts/browsable/hyginus/185a/	185a.5	185a.5.4	libens	participle: present active masculine nominative singular	urn:cite2:tabulae:ls.v1:n26488
https://lingualatina.github.io/texts/browsable/hyginus/185a/	185a.5	185a.5.4	libens	participle: present active masculine vocative singular	urn:cite2:tabulae:ls.v1:n26488
https://lingualatina.github.io/texts/browsable/hyginus/185a/	185a.5	185a.5.4	libens	participle: present active feminine nominative singular	urn:cite2:tabulae:ls.v1:n26488
https://lingualatina.github.io/texts/browsable/hyginus/185a/	185a.5	185a.5.4	libens	participle: present active feminine vocative singular	urn:cite2:tabulae:ls.v1:n26488
https://lingualatina.github.io/texts/browsable/hyginus/185a/	185a.5	185a.5.4	libens	participle: present active neuter nominative singular	urn:cite2:tabulae:ls.v1:n26488
https://lingualatina.github.io/texts/browsable/hyginus/185a/	185a.5	185a.5.4	libens	participle: present active neuter nominative singular	urn:cite2:tabulae:ls.v1:n26488
https://lingualatina.github.io/texts/browsable/hyginus/185a/	185a.5	185a.5.4	libens	participle: present active neuter accusative singular	urn:cite2:tabulae:ls.v1:n26488
https://lingualatina.github.io/texts/browsable/hyginus/185a/	185a.5	185a.5.5	filiam	noun: feminine accusative singular	urn:cite2:tabulae:ls.v1:n18173
https://lingualatina.github.io/texts/browsable/hyginus/185a/	185a.5	185a.5.6	suam	adjective: feminine accusative singular positive	urn:cite2:tabulae:ls.v1:n47174
https://lingualatina.github.io/texts/browsable/hyginus/185a/	185a.5	185a.5.7	dedit	finite verb: third singular perfect indicative active	urn:cite2:tabulae:ls.v1:n14599
https://lingualatina.github.io/texts/browsable/hyginus/185a/	185a.5	185a.5.7	dedit	finite verb: third singular present indicative active	urn:cite2:tabulae:ls.v1:n12628
https://lingualatina.github.io/texts/browsable/hyginus/185a/	185a.5	185a.5.8	uxorem	noun: feminine accusative singular	urn:cite2:tabulae:ls.v1:n50039
https://lingualatina.github.io/texts/browsable/hyginus/185a/	185a.5	185a.5.8_0	.		urn:cite2:tabulae:ls.v1:null
https://lingualatina.github.io/texts/browsable/hyginus/185a/	185a.5	185a.5.9	hanc	pronoun: feminine accusative singular	urn:cite2:tabulae:ls.v1:n20640
https://lingualatina.github.io/texts/browsable/hyginus/185a/	185a.5	185a.5.10	cum	uninflected preposition	urn:cite2:tabulae:ls.v1:n11872
https://lingualatina.github.io/texts/browsable/hyginus/185a/	185a.5	185a.5.11	in	uninflected preposition	urn:cite2:tabulae:ls.v1:n22111
https://lingualatina.github.io/texts/browsable/hyginus/185a/	185a.5	185a.5.12	patriam	noun: feminine accusative singular	urn:cite2:tabulae:ls.v1:n34131
https://lingualatina.github.io/texts/browsable/hyginus/185a/	185a.5	185a.5.13	duceret	finite verb: third singular imperfect subjunctive active	urn:cite2:tabulae:ls.v1:n14847
https://lingualatina.github.io/texts/browsable/hyginus/185a/	185a.5	185a.5.13_0	,		urn:cite2:tabulae:ls.v1:null
https://lingualatina.github.io/texts/browsable/hyginus/185a/	185a.5	185a.5.14	oblitus		urn:cite2:tabulae:ls.v1:null
https://lingualatina.github.io/texts/browsable/hyginus/185a/	185a.5	185a.5.15	beneficio	noun: neuter dative singular	urn:cite2:tabulae:ls.v1:n5180
https://lingualatina.github.io/texts/browsable/hyginus/185a/	185a.5	185a.5.15	beneficio	noun: neuter ablative singular	urn:cite2:tabulae:ls.v1:n5180
https://lingualatina.github.io/texts/browsable/hyginus/185a/	185a.5	185a.5.17	se	participle: perfect passive masculine vocative singular	urn:cite2:l3:composites.v1:do
https://lingualatina.github.io/texts/browsable/hyginus/185a/	185a.5	185a.5.17	se	pronoun: masculine accusative singular	urn:cite2:tabulae:ls.v1:n46498
https://lingualatina.github.io/texts/browsable/hyginus/185a/	185a.5	185a.5.17	se	pronoun: masculine ablative singular	urn:cite2:tabulae:ls.v1:n46498
https://lingualatina.github.io/texts/browsable/hyginus/185a/	185a.5	185a.5.17	se	pronoun: feminine ablative singular	urn:cite2:tabulae:ls.v1:n46498
https://lingualatina.github.io/texts/browsable/hyginus/185a/	185a.5	185a.5.17	se	pronoun: neuter ablative singular	urn:cite2:tabulae:ls.v1:n46498
https://lingualatina.github.io/texts/browsable/hyginus/185a/	185a.5	185a.5.17	se	pronoun: feminine ablative plural	urn:cite2:tabulae:ls.v1:n46498
https://lingualatina.github.io/texts/browsable/hyginus/185a/	185a.5	185a.5.17	se	pronoun: neuter accusative plural	urn:cite2:tabulae:ls.v1:n46498
https://lingualatina.github.io/texts/browsable/hyginus/185a/	185a.5	185a.5.17	se	pronoun: feminine accusative plural	urn:cite2:tabulae:ls.v1:n46498
https://lingualatina.github.io/texts/browsable/hyginus/185a/	185a.5	185a.5.17	se	pronoun: neuter ablative plural	urn:cite2:tabulae:ls.v1:n46498
https://lingualatina.github.io/texts/browsable/hyginus/185a/	185a.5	185a.5.17	se	pronoun: feminine accusative singular	urn:cite2:tabulae:ls.v1:n46498
https://lingualatina.github.io/texts/browsable/hyginus/185a/	185a.5	185a.5.17	se	pronoun: neuter accusative singular	urn:cite2:tabulae:ls.v1:n46498
https://lingualatina.github.io/texts/browsable/hyginus/185a/	185a.5	185a.5.17	se	pronoun: masculine accusative plural	urn:cite2:tabulae:ls.v1:n46498
https://lingualatina.github.io/texts/browsable/hyginus/185a/	185a.5	185a.5.17	se	pronoun: masculine ablative plural	urn:cite2:tabulae:ls.v1:n46498
https://lingualatina.github.io/texts/browsable/hyginus/185a/	185a.5	185a.5.18	uicisse	infinitive: perfect active	urn:cite2:tabulae:ls.v1:n50968
https://lingualatina.github.io/texts/browsable/hyginus/185a/	185a.5	185a.5.18_0	,		urn:cite2:tabulae:ls.v1:null
https://lingualatina.github.io/texts/browsable/hyginus/185a/	185a.5	185a.5.19	grates		urn:cite2:tabulae:ls.v1:null
https://lingualatina.github.io/texts/browsable/hyginus/185a/	185a.5	185a.5.20	ei	pronoun: masculine dative singular	urn:cite2:tabulae:ls.v1:n25029
https://lingualatina.github.io/texts/browsable/hyginus/185a/	185a.5	185a.5.20	ei	pronoun: feminine dative singular	urn:cite2:tabulae:ls.v1:n25029
https://lingualatina.github.io/texts/browsable/hyginus/185a/	185a.5	185a.5.20	ei	pronoun: neuter dative singular	urn:cite2:tabulae:ls.v1:n25029
https://lingualatina.github.io/texts/browsable/hyginus/185a/	185a.5	185a.5.20	ei	pronoun: masculine nominative plural	urn:cite2:tabulae:ls.v1:n25029
https://lingualatina.github.io/texts/browsable/hyginus/185a/	185a.5	185a.5.21	non	adverb: positive degree	urn:cite2:tabulae:ls.v1:n31151
https://lingualatina.github.io/texts/browsable/hyginus/185a/	185a.5	185a.5.22	egit	finite verb: third singular perfect indicative active	urn:cite2:tabulae:ls.v1:n1605
https://lingualatina.github.io/texts/browsable/hyginus/185a/	185a.5	185a.5.22_0	.		urn:cite2:tabulae:ls.v1:null