url	passage	tokenid	token	form	lexeme
https://lingualatina.github.io/texts/browsable/hyginus/186a/	186a.7	186a.7.0	illi	pronoun: masculine dative singular	urn:cite2:tabulae:ls.v1:n21494
https://lingualatina.github.io/texts/browsable/hyginus/186a/	186a.7	186a.7.0	illi	pronoun: masculine nominative plural	urn:cite2:tabulae:ls.v1:n21494
https://lingualatina.github.io/texts/browsable/hyginus/186a/	186a.7	186a.7.0	illi	pronoun: feminine dative singular	urn:cite2:tabulae:ls.v1:n21494
https://lingualatina.github.io/texts/browsable/hyginus/186a/	186a.7	186a.7.0	illi	pronoun: neuter dative singular	urn:cite2:tabulae:ls.v1:n21494
https://lingualatina.github.io/texts/browsable/hyginus/186a/	186a.7	186a.7.1	autem	uninflected conjunction	urn:cite2:tabulae:ls.v1:n4633
https://lingualatina.github.io/texts/browsable/hyginus/186a/	186a.7	186a.7.2	matris	noun: feminine genitive singular	urn:cite2:tabulae:ls.v1:n28181
https://lingualatina.github.io/texts/browsable/hyginus/186a/	186a.7	186a.7.3	monitu	supine: ablative	urn:cite2:tabulae:ls.v1:n29544
https://lingualatina.github.io/texts/browsable/hyginus/186a/	186a.7	186a.7.4	cum	uninflected preposition	urn:cite2:tabulae:ls.v1:n11872
https://lingualatina.github.io/texts/browsable/hyginus/186a/	186a.7	186a.7.5	in	uninflected preposition	urn:cite2:tabulae:ls.v1:n22111
https://lingualatina.github.io/texts/browsable/hyginus/186a/	186a.7	186a.7.6	montem	noun: masculine accusative singular	urn:cite2:tabulae:ls.v1:n29604
https://lingualatina.github.io/texts/browsable/hyginus/186a/	186a.7	186a.7.7	exissent	finite verb: third plural pluperfect subjunctive active	urn:cite2:tabulae:ls.v1:n16804
https://lingualatina.github.io/texts/browsable/hyginus/186a/	186a.7	186a.7.7_0	,		urn:cite2:tabulae:ls.v1:null
https://lingualatina.github.io/texts/browsable/hyginus/186a/	186a.7	186a.7.8	proelium	noun: neuter nominative singular	urn:cite2:tabulae:ls.v1:n38589
https://lingualatina.github.io/texts/browsable/hyginus/186a/	186a.7	186a.7.8	proelium	noun: neuter accusative singular	urn:cite2:tabulae:ls.v1:n38589
https://lingualatina.github.io/texts/browsable/hyginus/186a/	186a.7	186a.7.8	proelium	noun: neuter vocative singular	urn:cite2:tabulae:ls.v1:n38589
https://lingualatina.github.io/texts/browsable/hyginus/186a/	186a.7	186a.7.9	inter	uninflected preposition	urn:cite2:tabulae:ls.v1:n24154
https://lingualatina.github.io/texts/browsable/hyginus/186a/	186a.7	186a.7.10	se	participle: perfect passive masculine vocative singular	urn:cite2:l3:composites.v1:do
https://lingualatina.github.io/texts/browsable/hyginus/186a/	186a.7	186a.7.10	se	pronoun: masculine accusative singular	urn:cite2:tabulae:ls.v1:n46498
https://lingualatina.github.io/texts/browsable/hyginus/186a/	186a.7	186a.7.10	se	pronoun: masculine ablative singular	urn:cite2:tabulae:ls.v1:n46498
https://lingualatina.github.io/texts/browsable/hyginus/186a/	186a.7	186a.7.10	se	pronoun: feminine ablative singular	urn:cite2:tabulae:ls.v1:n46498
https://lingualatina.github.io/texts/browsable/hyginus/186a/	186a.7	186a.7.10	se	pronoun: neuter ablative singular	urn:cite2:tabulae:ls.v1:n46498
https://lingualatina.github.io/texts/browsable/hyginus/186a/	186a.7	186a.7.10	se	pronoun: feminine ablative plural	urn:cite2:tabulae:ls.v1:n46498
https://lingualatina.github.io/texts/browsable/hyginus/186a/	186a.7	186a.7.10	se	pronoun: neuter accusative plural	urn:cite2:tabulae:ls.v1:n46498
https://lingualatina.github.io/texts/browsable/hyginus/186a/	186a.7	186a.7.10	se	pronoun: feminine accusative plural	urn:cite2:tabulae:ls.v1:n46498
https://lingualatina.github.io/texts/browsable/hyginus/186a/	186a.7	186a.7.10	se	pronoun: neuter ablative plural	urn:cite2:tabulae:ls.v1:n46498
https://lingualatina.github.io/texts/browsable/hyginus/186a/	186a.7	186a.7.10	se	pronoun: feminine accusative singular	urn:cite2:tabulae:ls.v1:n46498
https://lingualatina.github.io/texts/browsable/hyginus/186a/	186a.7	186a.7.10	se	pronoun: neuter accusative singular	urn:cite2:tabulae:ls.v1:n46498
https://lingualatina.github.io/texts/browsable/hyginus/186a/	186a.7	186a.7.10	se	pronoun: masculine accusative plural	urn:cite2:tabulae:ls.v1:n46498
https://lingualatina.github.io/texts/browsable/hyginus/186a/	186a.7	186a.7.10	se	pronoun: masculine ablative plural	urn:cite2:tabulae:ls.v1:n46498
https://lingualatina.github.io/texts/browsable/hyginus/186a/	186a.7	186a.7.11	commiserunt	finite verb: third plural perfect indicative active	urn:cite2:tabulae:ls.v1:n9404
https://lingualatina.github.io/texts/browsable/hyginus/186a/	186a.7	186a.7.11_0	.		urn:cite2:tabulae:ls.v1:null
https://lingualatina.github.io/texts/browsable/hyginus/186a/	186a.7	186a.7.12	Neptuno		urn:cite2:tabulae:ls.v1:null
https://lingualatina.github.io/texts/browsable/hyginus/186a/	186a.7	186a.7.13	autem	uninflected conjunction	urn:cite2:tabulae:ls.v1:n4633
https://lingualatina.github.io/texts/browsable/hyginus/186a/	186a.7	186a.7.14	adiuuante	participle: present active masculine ablative singular	urn:cite2:tabulae:ls.v1:n862
https://lingualatina.github.io/texts/browsable/hyginus/186a/	186a.7	186a.7.14	adiuuante	participle: present active feminine ablative singular	urn:cite2:tabulae:ls.v1:n862
https://lingualatina.github.io/texts/browsable/hyginus/186a/	186a.7	186a.7.14	adiuuante	participle: present active neuter ablative singular	urn:cite2:tabulae:ls.v1:n862
https://lingualatina.github.io/texts/browsable/hyginus/186a/	186a.7	186a.7.15	Neptuni		urn:cite2:tabulae:ls.v1:null
https://lingualatina.github.io/texts/browsable/hyginus/186a/	186a.7	186a.7.16	filii	noun: masculine nominative plural	urn:cite2:tabulae:ls.v1:n18185
https://lingualatina.github.io/texts/browsable/hyginus/186a/	186a.7	186a.7.16	filii	noun: masculine genitive singular	urn:cite2:tabulae:ls.v1:n18185
https://lingualatina.github.io/texts/browsable/hyginus/186a/	186a.7	186a.7.16	filii	noun: masculine vocative plural	urn:cite2:tabulae:ls.v1:n18185
https://lingualatina.github.io/texts/browsable/hyginus/186a/	186a.7	186a.7.17	uicerunt	finite verb: third plural perfect indicative active	urn:cite2:tabulae:ls.v1:n50968
https://lingualatina.github.io/texts/browsable/hyginus/186a/	186a.7	186a.7.18	et	uninflected conjunction	urn:cite2:tabulae:ls.v1:n16278
https://lingualatina.github.io/texts/browsable/hyginus/186a/	186a.7	186a.7.19	eos	pronoun: masculine accusative plural	urn:cite2:tabulae:ls.v1:n25029
https://lingualatina.github.io/texts/browsable/hyginus/186a/	186a.7	186a.7.20	interfecerunt	finite verb: third plural perfect indicative active	urn:cite2:tabulae:ls.v1:n24257
https://lingualatina.github.io/texts/browsable/hyginus/186a/	186a.7	186a.7.20_0	;		urn:cite2:tabulae:ls.v1:null
https://lingualatina.github.io/texts/browsable/hyginus/186a/	186a.7	186a.7.21	quorum	pronoun: masculine genitive plural	urn:cite2:tabulae:ls.v1:n40242
https://lingualatina.github.io/texts/browsable/hyginus/186a/	186a.7	186a.7.21	quorum	pronoun: neuter genitive plural	urn:cite2:tabulae:ls.v1:n40242
https://lingualatina.github.io/texts/browsable/hyginus/186a/	186a.7	186a.7.21	quorum	pronoun: masculine genitive plural	urn:cite2:tabulae:ls.v1:n40103
https://lingualatina.github.io/texts/browsable/hyginus/186a/	186a.7	186a.7.21	quorum	pronoun: neuter genitive plural	urn:cite2:tabulae:ls.v1:n40103
https://lingualatina.github.io/texts/browsable/hyginus/186a/	186a.7	186a.7.22	corpora	noun: neuter nominative plural	urn:cite2:tabulae:ls.v1:n11268
https://lingualatina.github.io/texts/browsable/hyginus/186a/	186a.7	186a.7.22	corpora	noun: neuter accusative plural	urn:cite2:tabulae:ls.v1:n11268
https://lingualatina.github.io/texts/browsable/hyginus/186a/	186a.7	186a.7.22	corpora	noun: neuter vocative plural	urn:cite2:tabulae:ls.v1:n11268
https://lingualatina.github.io/texts/browsable/hyginus/186a/	186a.7	186a.7.23	cum	uninflected preposition	urn:cite2:tabulae:ls.v1:n11872
https://lingualatina.github.io/texts/browsable/hyginus/186a/	186a.7	186a.7.24	in	uninflected preposition	urn:cite2:tabulae:ls.v1:n22111
https://lingualatina.github.io/texts/browsable/hyginus/186a/	186a.7	186a.7.25	regia	adjective: feminine nominative singular positive	urn:cite2:tabulae:ls.v1:n40905
https://lingualatina.github.io/texts/browsable/hyginus/186a/	186a.7	186a.7.25	regia	adjective: feminine ablative singular positive	urn:cite2:tabulae:ls.v1:n40905
https://lingualatina.github.io/texts/browsable/hyginus/186a/	186a.7	186a.7.25	regia	adjective: feminine vocative singular positive	urn:cite2:tabulae:ls.v1:n40905
https://lingualatina.github.io/texts/browsable/hyginus/186a/	186a.7	186a.7.25	regia	adjective: neuter nominative plural positive	urn:cite2:tabulae:ls.v1:n40905
https://lingualatina.github.io/texts/browsable/hyginus/186a/	186a.7	186a.7.25	regia	adjective: neuter accusative plural positive	urn:cite2:tabulae:ls.v1:n40905
https://lingualatina.github.io/texts/browsable/hyginus/186a/	186a.7	186a.7.25	regia	adjective: neuter vocative plural positive	urn:cite2:tabulae:ls.v1:n40905
https://lingualatina.github.io/texts/browsable/hyginus/186a/	186a.7	186a.7.26	allata	participle: perfect passive feminine nominative singular	urn:cite2:tabulae:ls.v1:n12664
https://lingualatina.github.io/texts/browsable/hyginus/186a/	186a.7	186a.7.26	allata	participle: perfect passive feminine ablative singular	urn:cite2:tabulae:ls.v1:n12664
https://lingualatina.github.io/texts/browsable/hyginus/186a/	186a.7	186a.7.26	allata	participle: perfect passive feminine vocative singular	urn:cite2:tabulae:ls.v1:n12664
https://lingualatina.github.io/texts/browsable/hyginus/186a/	186a.7	186a.7.26	allata	participle: perfect passive neuter nominative plural	urn:cite2:tabulae:ls.v1:n12664
https://lingualatina.github.io/texts/browsable/hyginus/186a/	186a.7	186a.7.26	allata	participle: perfect passive neuter accusative plural	urn:cite2:tabulae:ls.v1:n12664
https://lingualatina.github.io/texts/browsable/hyginus/186a/	186a.7	186a.7.26	allata	participle: perfect passive neuter vocative plural	urn:cite2:tabulae:ls.v1:n12664
https://lingualatina.github.io/texts/browsable/hyginus/186a/	186a.7	186a.7.27	essent	finite verb: third plural imperfect subjunctive active	urn:cite2:tabulae:ls.v1:n46529
https://lingualatina.github.io/texts/browsable/hyginus/186a/	186a.7	186a.7.27_0	,		urn:cite2:tabulae:ls.v1:null
https://lingualatina.github.io/texts/browsable/hyginus/186a/	186a.7	186a.7.28	Theano		urn:cite2:tabulae:ls.v1:null
https://lingualatina.github.io/texts/browsable/hyginus/186a/	186a.7	186a.7.29	cultro	noun: masculine dative singular	urn:cite2:tabulae:ls.v1:n11860
https://lingualatina.github.io/texts/browsable/hyginus/186a/	186a.7	186a.7.29	cultro	noun: masculine ablative singular	urn:cite2:tabulae:ls.v1:n11860
https://lingualatina.github.io/texts/browsable/hyginus/186a/	186a.7	186a.7.30	uenatorio		urn:cite2:tabulae:ls.v1:null
https://lingualatina.github.io/texts/browsable/hyginus/186a/	186a.7	186a.7.31	se	participle: perfect passive masculine vocative singular	urn:cite2:l3:composites.v1:do
https://lingualatina.github.io/texts/browsable/hyginus/186a/	186a.7	186a.7.31	se	pronoun: masculine accusative singular	urn:cite2:tabulae:ls.v1:n46498
https://lingualatina.github.io/texts/browsable/hyginus/186a/	186a.7	186a.7.31	se	pronoun: masculine ablative singular	urn:cite2:tabulae:ls.v1:n46498
https://lingualatina.github.io/texts/browsable/hyginus/186a/	186a.7	186a.7.31	se	pronoun: feminine ablative singular	urn:cite2:tabulae:ls.v1:n46498
https://lingualatina.github.io/texts/browsable/hyginus/186a/	186a.7	186a.7.31	se	pronoun: neuter ablative singular	urn:cite2:tabulae:ls.v1:n46498
https://lingualatina.github.io/texts/browsable/hyginus/186a/	186a.7	186a.7.31	se	pronoun: feminine ablative plural	urn:cite2:tabulae:ls.v1:n46498
https://lingualatina.github.io/texts/browsable/hyginus/186a/	186a.7	186a.7.31	se	pronoun: neuter accusative plural	urn:cite2:tabulae:ls.v1:n46498
https://lingualatina.github.io/texts/browsable/hyginus/186a/	186a.7	186a.7.31	se	pronoun: feminine accusative plural	urn:cite2:tabulae:ls.v1:n46498
https://lingualatina.github.io/texts/browsable/hyginus/186a/	186a.7	186a.7.31	se	pronoun: neuter ablative plural	urn:cite2:tabulae:ls.v1:n46498
https://lingualatina.github.io/texts/browsable/hyginus/186a/	186a.7	186a.7.31	se	pronoun: feminine accusative singular	urn:cite2:tabulae:ls.v1:n46498
https://lingualatina.github.io/texts/browsable/hyginus/186a/	186a.7	186a.7.31	se	pronoun: neuter accusative singular	urn:cite2:tabulae:ls.v1:n46498
https://lingualatina.github.io/texts/browsable/hyginus/186a/	186a.7	186a.7.31	se	pronoun: masculine accusative plural	urn:cite2:tabulae:ls.v1:n46498
https://lingualatina.github.io/texts/browsable/hyginus/186a/	186a.7	186a.7.31	se	pronoun: masculine ablative plural	urn:cite2:tabulae:ls.v1:n46498
https://lingualatina.github.io/texts/browsable/hyginus/186a/	186a.7	186a.7.32	interfecit	finite verb: third singular perfect indicative active	urn:cite2:tabulae:ls.v1:n24257
https://lingualatina.github.io/texts/browsable/hyginus/186a/	186a.7	186a.7.32_0	.		urn:cite2:tabulae:ls.v1:null