url	passage	tokenid	token	form	lexeme
https://lingualatina.github.io/texts/browsable/hyginus/189a/	189a.4	189a.4.0	quae	pronoun: feminine nominative plural	urn:cite2:tabulae:ls.v1:n40242
https://lingualatina.github.io/texts/browsable/hyginus/189a/	189a.4	189a.4.0	quae	pronoun: neuter accusative plural	urn:cite2:tabulae:ls.v1:n40242
https://lingualatina.github.io/texts/browsable/hyginus/189a/	189a.4	189a.4.0	quae	pronoun: neuter nominative plural	urn:cite2:tabulae:ls.v1:n40242
https://lingualatina.github.io/texts/browsable/hyginus/189a/	189a.4	189a.4.0	quae	pronoun: neuter accusative plural	urn:cite2:tabulae:ls.v1:n40103
https://lingualatina.github.io/texts/browsable/hyginus/189a/	189a.4	189a.4.0	quae	pronoun: neuter nominative plural	urn:cite2:tabulae:ls.v1:n40103
https://lingualatina.github.io/texts/browsable/hyginus/189a/	189a.4	189a.4.0	quae	pronoun: feminine nominative plural	urn:cite2:tabulae:ls.v1:n40103
https://lingualatina.github.io/texts/browsable/hyginus/189a/	189a.4	189a.4.0	quae	pronoun: feminine nominative singular	urn:cite2:tabulae:ls.v1:n40103
https://lingualatina.github.io/texts/browsable/hyginus/189a/	189a.4	189a.4.1	cum	uninflected preposition	urn:cite2:tabulae:ls.v1:n11872
https://lingualatina.github.io/texts/browsable/hyginus/189a/	189a.4	189a.4.2	Cephalum		urn:cite2:tabulae:ls.v1:null
https://lingualatina.github.io/texts/browsable/hyginus/189a/	189a.4	189a.4.3	uidisset	finite verb: third singular pluperfect subjunctive active	urn:cite2:tabulae:ls.v1:n50883
https://lingualatina.github.io/texts/browsable/hyginus/189a/	189a.4	189a.4.3	uidisset	finite verb: third singular pluperfect subjunctive active	urn:cite2:tabulae:ls.v1:n50883
https://lingualatina.github.io/texts/browsable/hyginus/189a/	189a.4	189a.4.3_0	,		urn:cite2:tabulae:ls.v1:null
https://lingualatina.github.io/texts/browsable/hyginus/189a/	189a.4	189a.4.4	sensit	finite verb: third singular perfect indicative active	urn:cite2:tabulae:ls.v1:n43681
https://lingualatina.github.io/texts/browsable/hyginus/189a/	189a.4	189a.4.5	se	participle: perfect passive masculine vocative singular	urn:cite2:l3:composites.v1:do
https://lingualatina.github.io/texts/browsable/hyginus/189a/	189a.4	189a.4.5	se	pronoun: masculine accusative singular	urn:cite2:tabulae:ls.v1:n46498
https://lingualatina.github.io/texts/browsable/hyginus/189a/	189a.4	189a.4.5	se	pronoun: masculine ablative singular	urn:cite2:tabulae:ls.v1:n46498
https://lingualatina.github.io/texts/browsable/hyginus/189a/	189a.4	189a.4.5	se	pronoun: feminine ablative singular	urn:cite2:tabulae:ls.v1:n46498
https://lingualatina.github.io/texts/browsable/hyginus/189a/	189a.4	189a.4.5	se	pronoun: neuter ablative singular	urn:cite2:tabulae:ls.v1:n46498
https://lingualatina.github.io/texts/browsable/hyginus/189a/	189a.4	189a.4.5	se	pronoun: feminine ablative plural	urn:cite2:tabulae:ls.v1:n46498
https://lingualatina.github.io/texts/browsable/hyginus/189a/	189a.4	189a.4.5	se	pronoun: neuter accusative plural	urn:cite2:tabulae:ls.v1:n46498
https://lingualatina.github.io/texts/browsable/hyginus/189a/	189a.4	189a.4.5	se	pronoun: feminine accusative plural	urn:cite2:tabulae:ls.v1:n46498
https://lingualatina.github.io/texts/browsable/hyginus/189a/	189a.4	189a.4.5	se	pronoun: neuter ablative plural	urn:cite2:tabulae:ls.v1:n46498
https://lingualatina.github.io/texts/browsable/hyginus/189a/	189a.4	189a.4.5	se	pronoun: feminine accusative singular	urn:cite2:tabulae:ls.v1:n46498
https://lingualatina.github.io/texts/browsable/hyginus/189a/	189a.4	189a.4.5	se	pronoun: neuter accusative singular	urn:cite2:tabulae:ls.v1:n46498
https://lingualatina.github.io/texts/browsable/hyginus/189a/	189a.4	189a.4.5	se	pronoun: masculine accusative plural	urn:cite2:tabulae:ls.v1:n46498
https://lingualatina.github.io/texts/browsable/hyginus/189a/	189a.4	189a.4.5	se	pronoun: masculine ablative plural	urn:cite2:tabulae:ls.v1:n46498
https://lingualatina.github.io/texts/browsable/hyginus/189a/	189a.4	189a.4.6	ab	uninflected preposition	urn:cite2:tabulae:ls.v1:n4
https://lingualatina.github.io/texts/browsable/hyginus/189a/	189a.4	189a.4.7	Aurora	noun: feminine nominative singular	urn:cite2:tabulae:ls.v1:n4581
https://lingualatina.github.io/texts/browsable/hyginus/189a/	189a.4	189a.4.7	Aurora	noun: feminine ablative singular	urn:cite2:tabulae:ls.v1:n4581
https://lingualatina.github.io/texts/browsable/hyginus/189a/	189a.4	189a.4.7	Aurora	noun: feminine vocative singular	urn:cite2:tabulae:ls.v1:n4581
https://lingualatina.github.io/texts/browsable/hyginus/189a/	189a.4	189a.4.8	deceptam	participle: perfect passive feminine accusative singular	urn:cite2:tabulae:ls.v1:n12498
https://lingualatina.github.io/texts/browsable/hyginus/189a/	189a.4	189a.4.9	et	uninflected conjunction	urn:cite2:tabulae:ls.v1:n16278
https://lingualatina.github.io/texts/browsable/hyginus/189a/	189a.4	189a.4.10	inde	adverb: positive degree	urn:cite2:tabulae:ls.v1:n22699
https://lingualatina.github.io/texts/browsable/hyginus/189a/	189a.4	189a.4.11	profugit	finite verb: third singular present indicative active	urn:cite2:tabulae:ls.v1:n38642
https://lingualatina.github.io/texts/browsable/hyginus/189a/	189a.4	189a.4.11	profugit	finite verb: third singular perfect indicative active	urn:cite2:tabulae:ls.v1:n38642
https://lingualatina.github.io/texts/browsable/hyginus/189a/	189a.4	189a.4.12	in	uninflected preposition	urn:cite2:tabulae:ls.v1:n22111
https://lingualatina.github.io/texts/browsable/hyginus/189a/	189a.4	189a.4.13	Cretam	participle: perfect passive feminine accusative singular	urn:cite2:tabulae:ls.v1:n11570
https://lingualatina.github.io/texts/browsable/hyginus/189a/	189a.4	189a.4.14	insulam	noun: feminine accusative singular	urn:cite2:tabulae:ls.v1:n24040
https://lingualatina.github.io/texts/browsable/hyginus/189a/	189a.4	189a.4.14_0	,		urn:cite2:tabulae:ls.v1:null
https://lingualatina.github.io/texts/browsable/hyginus/189a/	189a.4	189a.4.15	ubi	uninflected conjunction	urn:cite2:tabulae:ls.v1:n49615
https://lingualatina.github.io/texts/browsable/hyginus/189a/	189a.4	189a.4.16	Diana	noun: feminine nominative singular	urn:cite2:tabulae:ls.v1:n13731
https://lingualatina.github.io/texts/browsable/hyginus/189a/	189a.4	189a.4.16	Diana	noun: feminine ablative singular	urn:cite2:tabulae:ls.v1:n13731
https://lingualatina.github.io/texts/browsable/hyginus/189a/	189a.4	189a.4.16	Diana	noun: feminine vocative singular	urn:cite2:tabulae:ls.v1:n13731
https://lingualatina.github.io/texts/browsable/hyginus/189a/	189a.4	189a.4.17	uenabatur	finite verb: third singular imperfect indicative passive	urn:cite2:tabulae:ls.v1:n50445
https://lingualatina.github.io/texts/browsable/hyginus/189a/	189a.4	189a.4.17_0	.		urn:cite2:tabulae:ls.v1:null
https://lingualatina.github.io/texts/browsable/hyginus/189a/	189a.4	189a.4.18	quam	pronoun: feminine accusative singular	urn:cite2:tabulae:ls.v1:n40103
https://lingualatina.github.io/texts/browsable/hyginus/189a/	189a.4	189a.4.19	cum	uninflected preposition	urn:cite2:tabulae:ls.v1:n11872
https://lingualatina.github.io/texts/browsable/hyginus/189a/	189a.4	189a.4.20	Diana	noun: feminine nominative singular	urn:cite2:tabulae:ls.v1:n13731
https://lingualatina.github.io/texts/browsable/hyginus/189a/	189a.4	189a.4.20	Diana	noun: feminine ablative singular	urn:cite2:tabulae:ls.v1:n13731
https://lingualatina.github.io/texts/browsable/hyginus/189a/	189a.4	189a.4.20	Diana	noun: feminine vocative singular	urn:cite2:tabulae:ls.v1:n13731
https://lingualatina.github.io/texts/browsable/hyginus/189a/	189a.4	189a.4.21	conspexisset	finite verb: third singular pluperfect subjunctive active	urn:cite2:tabulae:ls.v1:n10586
https://lingualatina.github.io/texts/browsable/hyginus/189a/	189a.4	189a.4.21_0	,		urn:cite2:tabulae:ls.v1:null
https://lingualatina.github.io/texts/browsable/hyginus/189a/	189a.4	189a.4.22	ait	finite verb: third singular present indicative active	urn:cite2:tabulae:ls.v1:n1659
https://lingualatina.github.io/texts/browsable/hyginus/189a/	189a.4	189a.4.23	ei	pronoun: masculine dative singular	urn:cite2:tabulae:ls.v1:n25029
https://lingualatina.github.io/texts/browsable/hyginus/189a/	189a.4	189a.4.23	ei	pronoun: feminine dative singular	urn:cite2:tabulae:ls.v1:n25029
https://lingualatina.github.io/texts/browsable/hyginus/189a/	189a.4	189a.4.23	ei	pronoun: neuter dative singular	urn:cite2:tabulae:ls.v1:n25029
https://lingualatina.github.io/texts/browsable/hyginus/189a/	189a.4	189a.4.23	ei	pronoun: masculine nominative plural	urn:cite2:tabulae:ls.v1:n25029
https://lingualatina.github.io/texts/browsable/hyginus/189a/	189a.4	189a.4.23_0	,		urn:cite2:tabulae:ls.v1:null
https://lingualatina.github.io/texts/browsable/hyginus/189a/	189a.4	189a.4.25	uirgines	noun: feminine nominative plural	urn:cite2:tabulae:ls.v1:n51069
https://lingualatina.github.io/texts/browsable/hyginus/189a/	189a.4	189a.4.25	uirgines	noun: feminine accusative plural	urn:cite2:tabulae:ls.v1:n51069
https://lingualatina.github.io/texts/browsable/hyginus/189a/	189a.4	189a.4.25	uirgines	noun: feminine vocative plural	urn:cite2:tabulae:ls.v1:n51069
https://lingualatina.github.io/texts/browsable/hyginus/189a/	189a.4	189a.4.26	uenantur	finite verb: third plural present indicative passive	urn:cite2:tabulae:ls.v1:n50445
https://lingualatina.github.io/texts/browsable/hyginus/189a/	189a.4	189a.4.26_0	,		urn:cite2:tabulae:ls.v1:null
https://lingualatina.github.io/texts/browsable/hyginus/189a/	189a.4	189a.4.27	tu	pronoun: feminine nominative singular	urn:cite2:tabulae:ls.v1:n49339
https://lingualatina.github.io/texts/browsable/hyginus/189a/	189a.4	189a.4.27	tu	pronoun: masculine nominative singular	urn:cite2:tabulae:ls.v1:n49339
https://lingualatina.github.io/texts/browsable/hyginus/189a/	189a.4	189a.4.28	uirgo	noun: feminine nominative singular	urn:cite2:tabulae:ls.v1:n51069
https://lingualatina.github.io/texts/browsable/hyginus/189a/	189a.4	189a.4.28	uirgo	noun: feminine vocative singular	urn:cite2:tabulae:ls.v1:n51069
https://lingualatina.github.io/texts/browsable/hyginus/189a/	189a.4	189a.4.29	non	adverb: positive degree	urn:cite2:tabulae:ls.v1:n31151
https://lingualatina.github.io/texts/browsable/hyginus/189a/	189a.4	189a.4.30	es	finite verb: second singular present imperative active	urn:cite2:tabulae:ls.v1:n46529
https://lingualatina.github.io/texts/browsable/hyginus/189a/	189a.4	189a.4.30	es	finite verb: second singular present indicative active	urn:cite2:tabulae:ls.v1:n46529
https://lingualatina.github.io/texts/browsable/hyginus/189a/	189a.4	189a.4.30_0	;		urn:cite2:tabulae:ls.v1:null
https://lingualatina.github.io/texts/browsable/hyginus/189a/	189a.4	189a.4.31	recede		urn:cite2:tabulae:ls.v1:null
https://lingualatina.github.io/texts/browsable/hyginus/189a/	189a.4	189a.4.32	de	finite verb: second singular present imperative active	urn:cite2:l3:composites.v1:do
https://lingualatina.github.io/texts/browsable/hyginus/189a/	189a.4	189a.4.32	de	uninflected preposition	urn:cite2:tabulae:ls.v1:n12361
https://lingualatina.github.io/texts/browsable/hyginus/189a/	189a.4	189a.4.33	coetu	noun: masculine dative singular	urn:cite2:tabulae:ls.v1:n8979
https://lingualatina.github.io/texts/browsable/hyginus/189a/	189a.4	189a.4.33	coetu	noun: masculine ablative singular	urn:cite2:tabulae:ls.v1:n8979
https://lingualatina.github.io/texts/browsable/hyginus/189a/	189a.4	189a.4.33_0	.		urn:cite2:tabulae:ls.v1:null