url	passage	tokenid	token	form	lexeme
https://lingualatina.github.io/texts/browsable/hyginus/18pr/	18pr.1	18pr.1.0	Lycus	noun: masculine nominative singular	ls.n27366:Lycus
https://lingualatina.github.io/texts/browsable/hyginus/18pr/	18pr.1	18pr.1.1	rex	noun: masculine nominative singular	ls.n41625:rex1
https://lingualatina.github.io/texts/browsable/hyginus/18pr/	18pr.1	18pr.1.1	rex	noun: masculine vocative singular	ls.n41625:rex1
https://lingualatina.github.io/texts/browsable/hyginus/18pr/	18pr.1	18pr.1.2	insulae	noun: feminine nominative plural	ls.n24040:insula1
https://lingualatina.github.io/texts/browsable/hyginus/18pr/	18pr.1	18pr.1.2	insulae	noun: feminine genitive singular	ls.n24040:insula1
https://lingualatina.github.io/texts/browsable/hyginus/18pr/	18pr.1	18pr.1.2	insulae	noun: feminine dative singular	ls.n24040:insula1
https://lingualatina.github.io/texts/browsable/hyginus/18pr/	18pr.1	18pr.1.2	insulae	noun: feminine vocative plural	ls.n24040:insula1
https://lingualatina.github.io/texts/browsable/hyginus/18pr/	18pr.1	18pr.1.3	Propontidis		ls.null
https://lingualatina.github.io/texts/browsable/hyginus/18pr/	18pr.1	18pr.1.4	Argonautas	noun: masculine accusative plural	ls.n3577:Argonautae
https://lingualatina.github.io/texts/browsable/hyginus/18pr/	18pr.1	18pr.1.5	recepit	finite verb: third singular perfect indicative active	ls.n40577:recipio
https://lingualatina.github.io/texts/browsable/hyginus/18pr/	18pr.1	18pr.1.6	hospitio	noun: neuter dative singular	ls.n21007:hospitium
https://lingualatina.github.io/texts/browsable/hyginus/18pr/	18pr.1	18pr.1.6	hospitio	noun: neuter ablative singular	ls.n21007:hospitium
https://lingualatina.github.io/texts/browsable/hyginus/18pr/	18pr.1	18pr.1.7	in	uninflected preposition	ls.n22111:in1
https://lingualatina.github.io/texts/browsable/hyginus/18pr/	18pr.1	18pr.1.8	honorem	noun: masculine accusative singular	ls.n20890:honor
https://lingualatina.github.io/texts/browsable/hyginus/18pr/	18pr.1	18pr.1.8_0	,		ls.null
https://lingualatina.github.io/texts/browsable/hyginus/18pr/	18pr.1	18pr.1.9	eo	pronoun: masculine ablative singular	ls.n25029:is
https://lingualatina.github.io/texts/browsable/hyginus/18pr/	18pr.1	18pr.1.9	eo	pronoun: neuter ablative singular	ls.n25029:is
https://lingualatina.github.io/texts/browsable/hyginus/18pr/	18pr.1	18pr.1.9	eo	finite verb: first singular present indicative active	ls.n15868:eo1
https://lingualatina.github.io/texts/browsable/hyginus/18pr/	18pr.1	18pr.1.10	quod	uninflected conjunction	ls.n40262:quod1
https://lingualatina.github.io/texts/browsable/hyginus/18pr/	18pr.1	18pr.1.10	quod	pronoun: neuter accusative singular	ls.n40103:qui1
https://lingualatina.github.io/texts/browsable/hyginus/18pr/	18pr.1	18pr.1.10	quod	pronoun: neuter nominative singular	ls.n40103:qui1
https://lingualatina.github.io/texts/browsable/hyginus/18pr/	18pr.1	18pr.1.11	Amycum		ls.null
https://lingualatina.github.io/texts/browsable/hyginus/18pr/	18pr.1	18pr.1.12	interfecerant	finite verb: third plural pluperfect indicative active	ls.n24257:interficio
https://lingualatina.github.io/texts/browsable/hyginus/18pr/	18pr.1	18pr.1.12_0	,		ls.null
https://lingualatina.github.io/texts/browsable/hyginus/18pr/	18pr.1	18pr.1.13	quod	uninflected conjunction	ls.n40262:quod1
https://lingualatina.github.io/texts/browsable/hyginus/18pr/	18pr.1	18pr.1.13	quod	pronoun: neuter accusative singular	ls.n40103:qui1
https://lingualatina.github.io/texts/browsable/hyginus/18pr/	18pr.1	18pr.1.13	quod	pronoun: neuter nominative singular	ls.n40103:qui1
https://lingualatina.github.io/texts/browsable/hyginus/18pr/	18pr.1	18pr.1.14	eum	pronoun: masculine accusative singular	ls.n25029:is
https://lingualatina.github.io/texts/browsable/hyginus/18pr/	18pr.1	18pr.1.15	saepe	adverb: positive degree	ls.n42211:saepe
https://lingualatina.github.io/texts/browsable/hyginus/18pr/	18pr.1	18pr.1.16	inficiaretur		ls.null
https://lingualatina.github.io/texts/browsable/hyginus/18pr/	18pr.1	18pr.1.16_0	.		ls.null
https://lingualatina.github.io/texts/browsable/hyginus/18pr/	18pr.1	18pr.1.17	Argonautae	noun: masculine nominative plural	ls.n3577:Argonautae
https://lingualatina.github.io/texts/browsable/hyginus/18pr/	18pr.1	18pr.1.17	Argonautae	noun: masculine genitive singular	ls.n3577:Argonautae
https://lingualatina.github.io/texts/browsable/hyginus/18pr/	18pr.1	18pr.1.17	Argonautae	noun: masculine dative singular	ls.n3577:Argonautae
https://lingualatina.github.io/texts/browsable/hyginus/18pr/	18pr.1	18pr.1.17	Argonautae	noun: masculine vocative plural	ls.n3577:Argonautae
https://lingualatina.github.io/texts/browsable/hyginus/18pr/	18pr.1	18pr.1.18	dum	uninflected conjunction	ls.n14902:dum
https://lingualatina.github.io/texts/browsable/hyginus/18pr/	18pr.1	18pr.1.19	apud	uninflected preposition	ls.n3250:apud
https://lingualatina.github.io/texts/browsable/hyginus/18pr/	18pr.1	18pr.1.20	Lycum	noun: masculine accusative singular	ls.n27366:Lycus
https://lingualatina.github.io/texts/browsable/hyginus/18pr/	18pr.1	18pr.1.21	morantur	finite verb: third plural present indicative passive	ls.n29751:morum
https://lingualatina.github.io/texts/browsable/hyginus/18pr/	18pr.1	18pr.1.22	et	uninflected conjunction	ls.n16278:et
https://lingualatina.github.io/texts/browsable/hyginus/18pr/	18pr.1	18pr.1.23	stramentatum	participle: perfect passive masculine accusative singular	ls.n45502:stramentor
https://lingualatina.github.io/texts/browsable/hyginus/18pr/	18pr.1	18pr.1.23	stramentatum	participle: perfect passive neuter nominative singular	ls.n45502:stramentor
https://lingualatina.github.io/texts/browsable/hyginus/18pr/	18pr.1	18pr.1.23	stramentatum	participle: perfect passive neuter accusative singular	ls.n45502:stramentor
https://lingualatina.github.io/texts/browsable/hyginus/18pr/	18pr.1	18pr.1.23	stramentatum	participle: perfect passive neuter vocative singular	ls.n45502:stramentor
https://lingualatina.github.io/texts/browsable/hyginus/18pr/	18pr.1	18pr.1.24	exissent	finite verb: third plural pluperfect subjunctive active	ls.n16804:exeo
https://lingualatina.github.io/texts/browsable/hyginus/18pr/	18pr.1	18pr.1.24_0	,		ls.null
https://lingualatina.github.io/texts/browsable/hyginus/18pr/	18pr.1	18pr.1.25	Idmon		ls.null
https://lingualatina.github.io/texts/browsable/hyginus/18pr/	18pr.1	18pr.1.26	Apollinis	noun: masculine genitive singular	ls.n3063:Apollo
https://lingualatina.github.io/texts/browsable/hyginus/18pr/	18pr.1	18pr.1.27	filius	noun: masculine nominative singular	ls.n18185:filius
https://lingualatina.github.io/texts/browsable/hyginus/18pr/	18pr.1	18pr.1.28	ab	uninflected preposition	ls.n4:ab
https://lingualatina.github.io/texts/browsable/hyginus/18pr/	18pr.1	18pr.1.29	apro	noun: masculine dative singular	ls.n2976:aper1
https://lingualatina.github.io/texts/browsable/hyginus/18pr/	18pr.1	18pr.1.29	apro	noun: masculine ablative singular	ls.n2976:aper1
https://lingualatina.github.io/texts/browsable/hyginus/18pr/	18pr.1	18pr.1.30	percussus	participle: perfect passive masculine nominative singular	ls.n34771:percutio
https://lingualatina.github.io/texts/browsable/hyginus/18pr/	18pr.1	18pr.1.31	interiit	finite verb: third singular perfect indicative active	ls.n24288:interitus1
https://lingualatina.github.io/texts/browsable/hyginus/18pr/	18pr.1	18pr.1.31	interiit	finite verb: third singular perfect indicative active	ls.n24241:intereo
https://lingualatina.github.io/texts/browsable/hyginus/18pr/	18pr.1	18pr.1.31_0	,		ls.null
https://lingualatina.github.io/texts/browsable/hyginus/18pr/	18pr.1	18pr.1.32	in	uninflected preposition	ls.n22111:in1
https://lingualatina.github.io/texts/browsable/hyginus/18pr/	18pr.1	18pr.1.33	cuius	pronoun: feminine genitive singular	ls.n40242:quis1
https://lingualatina.github.io/texts/browsable/hyginus/18pr/	18pr.1	18pr.1.33	cuius	pronoun: neuter genitive singular	ls.n40242:quis1
https://lingualatina.github.io/texts/browsable/hyginus/18pr/	18pr.1	18pr.1.33	cuius	pronoun: masculine genitive singular	ls.n40242:quis1
https://lingualatina.github.io/texts/browsable/hyginus/18pr/	18pr.1	18pr.1.33	cuius	pronoun: feminine genitive singular	ls.n40103:qui1
https://lingualatina.github.io/texts/browsable/hyginus/18pr/	18pr.1	18pr.1.33	cuius	pronoun: neuter genitive singular	ls.n40103:qui1
https://lingualatina.github.io/texts/browsable/hyginus/18pr/	18pr.1	18pr.1.33	cuius	pronoun: masculine genitive singular	ls.n40103:qui1
https://lingualatina.github.io/texts/browsable/hyginus/18pr/	18pr.1	18pr.1.34	dum	uninflected conjunction	ls.n14902:dum
https://lingualatina.github.io/texts/browsable/hyginus/18pr/	18pr.1	18pr.1.35	diutius		ls.null
https://lingualatina.github.io/texts/browsable/hyginus/18pr/	18pr.1	18pr.1.36	sepultura	noun: feminine nominative singular	ls.n43803:sepultura
https://lingualatina.github.io/texts/browsable/hyginus/18pr/	18pr.1	18pr.1.36	sepultura	noun: feminine ablative singular	ls.n43803:sepultura
https://lingualatina.github.io/texts/browsable/hyginus/18pr/	18pr.1	18pr.1.36	sepultura	noun: feminine vocative singular	ls.n43803:sepultura
https://lingualatina.github.io/texts/browsable/hyginus/18pr/	18pr.1	18pr.1.36	sepultura	participle: future active feminine nominative singular	ls.n43703:sepelio
https://lingualatina.github.io/texts/browsable/hyginus/18pr/	18pr.1	18pr.1.36	sepultura	participle: future active feminine ablative singular	ls.n43703:sepelio
https://lingualatina.github.io/texts/browsable/hyginus/18pr/	18pr.1	18pr.1.36	sepultura	participle: future active feminine vocative singular	ls.n43703:sepelio
https://lingualatina.github.io/texts/browsable/hyginus/18pr/	18pr.1	18pr.1.36	sepultura	participle: future active neuter nominative plural	ls.n43703:sepelio
https://lingualatina.github.io/texts/browsable/hyginus/18pr/	18pr.1	18pr.1.36	sepultura	participle: future active neuter accusative plural	ls.n43703:sepelio
https://lingualatina.github.io/texts/browsable/hyginus/18pr/	18pr.1	18pr.1.36	sepultura	participle: future active neuter vocative plural	ls.n43703:sepelio
https://lingualatina.github.io/texts/browsable/hyginus/18pr/	18pr.1	18pr.1.37	morantur	finite verb: third plural present indicative passive	ls.n29751:morum
https://lingualatina.github.io/texts/browsable/hyginus/18pr/	18pr.1	18pr.1.37_0	,		ls.null
https://lingualatina.github.io/texts/browsable/hyginus/18pr/	18pr.1	18pr.1.38	Tiphys		ls.null
https://lingualatina.github.io/texts/browsable/hyginus/18pr/	18pr.1	18pr.1.39	Phorbantis		ls.null
https://lingualatina.github.io/texts/browsable/hyginus/18pr/	18pr.1	18pr.1.40	filius	noun: masculine nominative singular	ls.n18185:filius
https://lingualatina.github.io/texts/browsable/hyginus/18pr/	18pr.1	18pr.1.41	moritur	finite verb: third singular present indicative passive	ls.n29707:morior
https://lingualatina.github.io/texts/browsable/hyginus/18pr/	18pr.1	18pr.1.41_0	.		ls.null
https://lingualatina.github.io/texts/browsable/hyginus/18pr/	18pr.1	18pr.1.42	tunc	adverb: positive degree	ls.n49420:tunc
https://lingualatina.github.io/texts/browsable/hyginus/18pr/	18pr.1	18pr.1.43	Argonautae	noun: masculine nominative plural	ls.n3577:Argonautae
https://lingualatina.github.io/texts/browsable/hyginus/18pr/	18pr.1	18pr.1.43	Argonautae	noun: masculine genitive singular	ls.n3577:Argonautae
https://lingualatina.github.io/texts/browsable/hyginus/18pr/	18pr.1	18pr.1.43	Argonautae	noun: masculine dative singular	ls.n3577:Argonautae
https://lingualatina.github.io/texts/browsable/hyginus/18pr/	18pr.1	18pr.1.43	Argonautae	noun: masculine vocative plural	ls.n3577:Argonautae
https://lingualatina.github.io/texts/browsable/hyginus/18pr/	18pr.1	18pr.1.44	Ancaeo		ls.null
https://lingualatina.github.io/texts/browsable/hyginus/18pr/	18pr.1	18pr.1.45	Neptuni		ls.null
https://lingualatina.github.io/texts/browsable/hyginus/18pr/	18pr.1	18pr.1.46	filio	noun: masculine dative singular	ls.n18185:filius
https://lingualatina.github.io/texts/browsable/hyginus/18pr/	18pr.1	18pr.1.46	filio	noun: masculine ablative singular	ls.n18185:filius
https://lingualatina.github.io/texts/browsable/hyginus/18pr/	18pr.1	18pr.1.47	nauem	noun: feminine accusative singular	ls.n30568:navis
https://lingualatina.github.io/texts/browsable/hyginus/18pr/	18pr.1	18pr.1.48	Argo		ls.null
https://lingualatina.github.io/texts/browsable/hyginus/18pr/	18pr.1	18pr.1.49	gubernandam		ls.null
https://lingualatina.github.io/texts/browsable/hyginus/18pr/	18pr.1	18pr.1.50	dederunt	finite verb: third plural perfect indicative active	ls.n14599:do1
https://lingualatina.github.io/texts/browsable/hyginus/18pr/	18pr.1	18pr.1.50_0	.		ls.null