url	passage	tokenid	token	form	lexeme
https://lingualatina.github.io/texts/browsable/hyginus/190a/	190a.6	190a.6.0	quem	pronoun: masculine accusative singular	ls.n40242:quis1
https://lingualatina.github.io/texts/browsable/hyginus/190a/	190a.6	190a.6.0	quem	pronoun: feminine accusative singular	ls.n40242:quis1
https://lingualatina.github.io/texts/browsable/hyginus/190a/	190a.6	190a.6.0	quem	pronoun: masculine accusative singular	ls.n40103:qui1
https://lingualatina.github.io/texts/browsable/hyginus/190a/	190a.6	190a.6.1	ad	uninflected preposition	ls.n665:ad
https://lingualatina.github.io/texts/browsable/hyginus/190a/	190a.6	190a.6.2	interficiendum	gerundive: masculine accusative singular	ls.n24257:interficio
https://lingualatina.github.io/texts/browsable/hyginus/190a/	190a.6	190a.6.2	interficiendum	gerundive: neuter nominative singular	ls.n24257:interficio
https://lingualatina.github.io/texts/browsable/hyginus/190a/	190a.6	190a.6.2	interficiendum	gerundive: neuter nominative singular	ls.n24257:interficio
https://lingualatina.github.io/texts/browsable/hyginus/190a/	190a.6	190a.6.2	interficiendum	gerundive: neuter accusative singular	ls.n24257:interficio
https://lingualatina.github.io/texts/browsable/hyginus/190a/	190a.6	190a.6.2	interficiendum	gerund: accusative	ls.n24257:interficio
https://lingualatina.github.io/texts/browsable/hyginus/190a/	190a.6	190a.6.3	mittitur	finite verb: third singular present indicative passive	ls.n29328:mitto
https://lingualatina.github.io/texts/browsable/hyginus/190a/	190a.6	190a.6.4	senex	noun: masculine vocative singular	ls.n43634:senex
https://lingualatina.github.io/texts/browsable/hyginus/190a/	190a.6	190a.6.4	senex	noun: masculine nominative singular	ls.n43634:senex
https://lingualatina.github.io/texts/browsable/hyginus/190a/	190a.6	190a.6.5	Thestor		ls.null
https://lingualatina.github.io/texts/browsable/hyginus/190a/	190a.6	190a.6.6	imprudens	adjective: masculine nominative singular positive	ls.n22067:imprudens
https://lingualatina.github.io/texts/browsable/hyginus/190a/	190a.6	190a.6.6	imprudens	adjective: feminine nominative singular positive	ls.n22067:imprudens
https://lingualatina.github.io/texts/browsable/hyginus/190a/	190a.6	190a.6.6	imprudens	adjective: neuter nominative singular positive	ls.n22067:imprudens
https://lingualatina.github.io/texts/browsable/hyginus/190a/	190a.6	190a.6.6	imprudens	adjective: neuter accusative singular positive	ls.n22067:imprudens
https://lingualatina.github.io/texts/browsable/hyginus/190a/	190a.6	190a.6.7	ad	uninflected preposition	ls.n665:ad
https://lingualatina.github.io/texts/browsable/hyginus/190a/	190a.6	190a.6.8	filiam	noun: feminine accusative singular	ls.n18173:filia
https://lingualatina.github.io/texts/browsable/hyginus/190a/	190a.6	190a.6.9	suam	adjective: feminine accusative singular positive	ls.n47174:suus
https://lingualatina.github.io/texts/browsable/hyginus/190a/	190a.6	190a.6.9_0	;		ls.null
https://lingualatina.github.io/texts/browsable/hyginus/190a/	190a.6	190a.6.10	quem	pronoun: masculine accusative singular	ls.n40242:quis1
https://lingualatina.github.io/texts/browsable/hyginus/190a/	190a.6	190a.6.10	quem	pronoun: feminine accusative singular	ls.n40242:quis1
https://lingualatina.github.io/texts/browsable/hyginus/190a/	190a.6	190a.6.10	quem	pronoun: masculine accusative singular	ls.n40103:qui1
https://lingualatina.github.io/texts/browsable/hyginus/190a/	190a.6	190a.6.11	Theonoe		ls.null
https://lingualatina.github.io/texts/browsable/hyginus/190a/	190a.6	190a.6.12	non	adverb: positive degree	ls.n31151:non
https://lingualatina.github.io/texts/browsable/hyginus/190a/	190a.6	190a.6.13	agnouit	finite verb: third singular perfect indicative active	ls.n1603:agnosco
https://lingualatina.github.io/texts/browsable/hyginus/190a/	190a.6	190a.6.13_0	,		ls.null
https://lingualatina.github.io/texts/browsable/hyginus/190a/	190a.6	190a.6.15	ei	pronoun: masculine dative singular	ls.n25029:is
https://lingualatina.github.io/texts/browsable/hyginus/190a/	190a.6	190a.6.15	ei	pronoun: feminine dative singular	ls.n25029:is
https://lingualatina.github.io/texts/browsable/hyginus/190a/	190a.6	190a.6.15	ei	pronoun: neuter dative singular	ls.n25029:is
https://lingualatina.github.io/texts/browsable/hyginus/190a/	190a.6	190a.6.15	ei	pronoun: masculine nominative plural	ls.n25029:is
https://lingualatina.github.io/texts/browsable/hyginus/190a/	190a.6	190a.6.16	gladium	noun: masculine accusative singular	ls.n19607:gladius
https://lingualatina.github.io/texts/browsable/hyginus/190a/	190a.6	190a.6.17	et	uninflected conjunction	ls.n16278:et
https://lingualatina.github.io/texts/browsable/hyginus/190a/	190a.6	190a.6.18	iubet	finite verb: third singular present indicative active	ls.n25264:jubeo
https://lingualatina.github.io/texts/browsable/hyginus/190a/	190a.6	190a.6.18	iubet	finite verb: third singular present indicative active	ls.n25264:jubeo
https://lingualatina.github.io/texts/browsable/hyginus/190a/	190a.6	190a.6.19	eum	pronoun: masculine accusative singular	ls.n25029:is
https://lingualatina.github.io/texts/browsable/hyginus/190a/	190a.6	190a.6.20	sacerdotem	noun: masculine accusative singular	ls.n42158:sacerdos1
https://lingualatina.github.io/texts/browsable/hyginus/190a/	190a.6	190a.6.20	sacerdotem	noun: feminine accusative singular	ls.n42158:sacerdos1
https://lingualatina.github.io/texts/browsable/hyginus/190a/	190a.6	190a.6.21	interficere	finite verb: second singular present indicative passive	ls.n24257:interficio
https://lingualatina.github.io/texts/browsable/hyginus/190a/	190a.6	190a.6.21	interficere	infinitive: present active	ls.n24257:interficio
https://lingualatina.github.io/texts/browsable/hyginus/190a/	190a.6	190a.6.21_0	.		ls.null
https://lingualatina.github.io/texts/browsable/hyginus/190a/	190a.6	190a.6.22	qui	pronoun: masculine nominative plural	ls.n40242:quis1
https://lingualatina.github.io/texts/browsable/hyginus/190a/	190a.6	190a.6.22	qui	pronoun: masculine nominative plural	ls.n40103:qui1
https://lingualatina.github.io/texts/browsable/hyginus/190a/	190a.6	190a.6.22	qui	pronoun: masculine nominative singular	ls.n40103:qui1
https://lingualatina.github.io/texts/browsable/hyginus/190a/	190a.6	190a.6.23	cum	uninflected preposition	ls.n11872:cum1
https://lingualatina.github.io/texts/browsable/hyginus/190a/	190a.6	190a.6.24	intrasset	finite verb: third singular pluperfect subjunctive active	ls.n24610:intro2
https://lingualatina.github.io/texts/browsable/hyginus/190a/	190a.6	190a.6.25	et	uninflected conjunction	ls.n16278:et
https://lingualatina.github.io/texts/browsable/hyginus/190a/	190a.6	190a.6.26	gladium	noun: masculine accusative singular	ls.n19607:gladius
https://lingualatina.github.io/texts/browsable/hyginus/190a/	190a.6	190a.6.27	teneret	finite verb: third singular imperfect subjunctive active	ls.n47770:teneo
https://lingualatina.github.io/texts/browsable/hyginus/190a/	190a.6	190a.6.27_0	,		ls.null
https://lingualatina.github.io/texts/browsable/hyginus/190a/	190a.6	190a.6.28	Thestorem		ls.null
https://lingualatina.github.io/texts/browsable/hyginus/190a/	190a.6	190a.6.29	se	participle: perfect passive masculine vocative singular	ls.do
https://lingualatina.github.io/texts/browsable/hyginus/190a/	190a.6	190a.6.29	se	pronoun: masculine accusative singular	ls.n46498:sui
https://lingualatina.github.io/texts/browsable/hyginus/190a/	190a.6	190a.6.29	se	pronoun: masculine ablative singular	ls.n46498:sui
https://lingualatina.github.io/texts/browsable/hyginus/190a/	190a.6	190a.6.29	se	pronoun: feminine ablative singular	ls.n46498:sui
https://lingualatina.github.io/texts/browsable/hyginus/190a/	190a.6	190a.6.29	se	pronoun: neuter ablative singular	ls.n46498:sui
https://lingualatina.github.io/texts/browsable/hyginus/190a/	190a.6	190a.6.29	se	pronoun: feminine ablative plural	ls.n46498:sui
https://lingualatina.github.io/texts/browsable/hyginus/190a/	190a.6	190a.6.29	se	pronoun: neuter accusative plural	ls.n46498:sui
https://lingualatina.github.io/texts/browsable/hyginus/190a/	190a.6	190a.6.29	se	pronoun: feminine accusative plural	ls.n46498:sui
https://lingualatina.github.io/texts/browsable/hyginus/190a/	190a.6	190a.6.29	se	pronoun: neuter ablative plural	ls.n46498:sui
https://lingualatina.github.io/texts/browsable/hyginus/190a/	190a.6	190a.6.29	se	pronoun: feminine accusative singular	ls.n46498:sui
https://lingualatina.github.io/texts/browsable/hyginus/190a/	190a.6	190a.6.29	se	pronoun: neuter accusative singular	ls.n46498:sui
https://lingualatina.github.io/texts/browsable/hyginus/190a/	190a.6	190a.6.29	se	pronoun: masculine accusative plural	ls.n46498:sui
https://lingualatina.github.io/texts/browsable/hyginus/190a/	190a.6	190a.6.29	se	pronoun: masculine ablative plural	ls.n46498:sui
https://lingualatina.github.io/texts/browsable/hyginus/190a/	190a.6	190a.6.30	uocitari		ls.null
https://lingualatina.github.io/texts/browsable/hyginus/190a/	190a.6	190a.6.31	dixit	finite verb: third singular perfect indicative active	ls.n13804:dico2
https://lingualatina.github.io/texts/browsable/hyginus/190a/	190a.6	190a.6.31_0	;		ls.null
https://lingualatina.github.io/texts/browsable/hyginus/190a/	190a.6	190a.6.32	duabus	adjective: feminine ablative plural positive	ls.n14914:duo
https://lingualatina.github.io/texts/browsable/hyginus/190a/	190a.6	190a.6.32	duabus	adjective: feminine dative plural positive	ls.n14914:duo
https://lingualatina.github.io/texts/browsable/hyginus/190a/	190a.6	190a.6.33	filiis	noun: masculine dative plural	ls.n18185:filius
https://lingualatina.github.io/texts/browsable/hyginus/190a/	190a.6	190a.6.33	filiis	noun: masculine ablative plural	ls.n18185:filius
https://lingualatina.github.io/texts/browsable/hyginus/190a/	190a.6	190a.6.33	filiis	noun: feminine dative plural	ls.n18173:filia
https://lingualatina.github.io/texts/browsable/hyginus/190a/	190a.6	190a.6.33	filiis	noun: feminine ablative plural	ls.n18173:filia
https://lingualatina.github.io/texts/browsable/hyginus/190a/	190a.6	190a.6.34	Leucippe		ls.null
https://lingualatina.github.io/texts/browsable/hyginus/190a/	190a.6	190a.6.35	et	uninflected conjunction	ls.n16278:et
https://lingualatina.github.io/texts/browsable/hyginus/190a/	190a.6	190a.6.36	Theonoe		ls.null
https://lingualatina.github.io/texts/browsable/hyginus/190a/	190a.6	190a.6.37	amissis	participle: perfect passive masculine dative plural	ls.n2260:amitto
https://lingualatina.github.io/texts/browsable/hyginus/190a/	190a.6	190a.6.37	amissis	participle: perfect passive masculine ablative plural	ls.n2260:amitto
https://lingualatina.github.io/texts/browsable/hyginus/190a/	190a.6	190a.6.37	amissis	participle: perfect passive feminine dative plural	ls.n2260:amitto
https://lingualatina.github.io/texts/browsable/hyginus/190a/	190a.6	190a.6.37	amissis	participle: perfect passive feminine ablative plural	ls.n2260:amitto
https://lingualatina.github.io/texts/browsable/hyginus/190a/	190a.6	190a.6.37	amissis	participle: perfect passive neuter dative plural	ls.n2260:amitto
https://lingualatina.github.io/texts/browsable/hyginus/190a/	190a.6	190a.6.37	amissis	participle: perfect passive neuter ablative plural	ls.n2260:amitto
https://lingualatina.github.io/texts/browsable/hyginus/190a/	190a.6	190a.6.38	ad	uninflected preposition	ls.n665:ad
https://lingualatina.github.io/texts/browsable/hyginus/190a/	190a.6	190a.6.39	hoc	pronoun: neuter accusative singular	ls.n20640:hic
https://lingualatina.github.io/texts/browsable/hyginus/190a/	190a.6	190a.6.39	hoc	pronoun: neuter ablative singular	ls.n20640:hic
https://lingualatina.github.io/texts/browsable/hyginus/190a/	190a.6	190a.6.39	hoc	pronoun: masculine ablative singular	ls.n20640:hic
https://lingualatina.github.io/texts/browsable/hyginus/190a/	190a.6	190a.6.39	hoc	pronoun: neuter nominative singular	ls.n20640:hic
https://lingualatina.github.io/texts/browsable/hyginus/190a/	190a.6	190a.6.40	exitium	noun: neuter nominative singular	ls.n16904:exitium
https://lingualatina.github.io/texts/browsable/hyginus/190a/	190a.6	190a.6.40	exitium	noun: neuter accusative singular	ls.n16904:exitium
https://lingualatina.github.io/texts/browsable/hyginus/190a/	190a.6	190a.6.40	exitium	noun: neuter vocative singular	ls.n16904:exitium
https://lingualatina.github.io/texts/browsable/hyginus/190a/	190a.6	190a.6.41	uenisse	infinitive: perfect active	ls.n50442:venio
https://lingualatina.github.io/texts/browsable/hyginus/190a/	190a.6	190a.6.42	ut	uninflected conjunction	ls.n49975:ut
https://lingualatina.github.io/texts/browsable/hyginus/190a/	190a.6	190a.6.43	sibi	pronoun: masculine dative singular	ls.n46498:sui
https://lingualatina.github.io/texts/browsable/hyginus/190a/	190a.6	190a.6.43	sibi	pronoun: neuter dative singular	ls.n46498:sui
https://lingualatina.github.io/texts/browsable/hyginus/190a/	190a.6	190a.6.43	sibi	pronoun: masculine dative plural	ls.n46498:sui
https://lingualatina.github.io/texts/browsable/hyginus/190a/	190a.6	190a.6.43	sibi	pronoun: feminine dative plural	ls.n46498:sui
https://lingualatina.github.io/texts/browsable/hyginus/190a/	190a.6	190a.6.43	sibi	pronoun: neuter dative plural	ls.n46498:sui
https://lingualatina.github.io/texts/browsable/hyginus/190a/	190a.6	190a.6.43	sibi	pronoun: feminine dative singular	ls.n46498:sui
https://lingualatina.github.io/texts/browsable/hyginus/190a/	190a.6	190a.6.44	scelus	noun: neuter nominative singular	ls.n42918:scelus
https://lingualatina.github.io/texts/browsable/hyginus/190a/	190a.6	190a.6.44	scelus	noun: neuter accusative singular	ls.n42918:scelus
https://lingualatina.github.io/texts/browsable/hyginus/190a/	190a.6	190a.6.44	scelus	noun: neuter vocative singular	ls.n42918:scelus
https://lingualatina.github.io/texts/browsable/hyginus/190a/	190a.6	190a.6.45	imperaretur	finite verb: third singular imperfect subjunctive passive	ls.n21886:impero
https://lingualatina.github.io/texts/browsable/hyginus/190a/	190a.6	190a.6.45_0	.		ls.null