url	passage	tokenid	token	form	lexeme
https://lingualatina.github.io/texts/browsable/hyginus/197a/	197a.1	197a.1.0	In	uninflected preposition	ls.n22111:in1
https://lingualatina.github.io/texts/browsable/hyginus/197a/	197a.1	197a.1.1	Euphraten		ls.null
https://lingualatina.github.io/texts/browsable/hyginus/197a/	197a.1	197a.1.2	flumen	noun: neuter nominative singular	ls.n18442:flumen
https://lingualatina.github.io/texts/browsable/hyginus/197a/	197a.1	197a.1.2	flumen	noun: neuter accusative singular	ls.n18442:flumen
https://lingualatina.github.io/texts/browsable/hyginus/197a/	197a.1	197a.1.2	flumen	noun: neuter vocative singular	ls.n18442:flumen
https://lingualatina.github.io/texts/browsable/hyginus/197a/	197a.1	197a.1.3	de	finite verb: second singular present imperative active	ls.do
https://lingualatina.github.io/texts/browsable/hyginus/197a/	197a.1	197a.1.3	de	uninflected preposition	ls.n12361:de2
https://lingualatina.github.io/texts/browsable/hyginus/197a/	197a.1	197a.1.4	caelo	noun: neuter dative singular	ls.n6042:caelum2
https://lingualatina.github.io/texts/browsable/hyginus/197a/	197a.1	197a.1.4	caelo	noun: neuter ablative singular	ls.n6042:caelum2
https://lingualatina.github.io/texts/browsable/hyginus/197a/	197a.1	197a.1.5	ouum		ls.null
https://lingualatina.github.io/texts/browsable/hyginus/197a/	197a.1	197a.1.6	mira	adjective: feminine nominative singular positive	ls.n29235:mirus
https://lingualatina.github.io/texts/browsable/hyginus/197a/	197a.1	197a.1.6	mira	adjective: feminine ablative singular positive	ls.n29235:mirus
https://lingualatina.github.io/texts/browsable/hyginus/197a/	197a.1	197a.1.6	mira	adjective: feminine vocative singular positive	ls.n29235:mirus
https://lingualatina.github.io/texts/browsable/hyginus/197a/	197a.1	197a.1.6	mira	adjective: neuter nominative plural positive	ls.n29235:mirus
https://lingualatina.github.io/texts/browsable/hyginus/197a/	197a.1	197a.1.6	mira	adjective: neuter accusative plural positive	ls.n29235:mirus
https://lingualatina.github.io/texts/browsable/hyginus/197a/	197a.1	197a.1.6	mira	adjective: neuter vocative plural positive	ls.n29235:mirus
https://lingualatina.github.io/texts/browsable/hyginus/197a/	197a.1	197a.1.7	magnitudine	noun: feminine ablative singular	ls.n27647:magnitudo
https://lingualatina.github.io/texts/browsable/hyginus/197a/	197a.1	197a.1.8	cecidisse	infinitive: perfect active	ls.n6011:caedo
https://lingualatina.github.io/texts/browsable/hyginus/197a/	197a.1	197a.1.9	dicitur	finite verb: third singular present indicative passive	ls.n13804:dico2
https://lingualatina.github.io/texts/browsable/hyginus/197a/	197a.1	197a.1.9_0	,		ls.null
https://lingualatina.github.io/texts/browsable/hyginus/197a/	197a.1	197a.1.10	quod	uninflected conjunction	ls.n40262:quod1
https://lingualatina.github.io/texts/browsable/hyginus/197a/	197a.1	197a.1.10	quod	pronoun: neuter accusative singular	ls.n40103:qui1
https://lingualatina.github.io/texts/browsable/hyginus/197a/	197a.1	197a.1.10	quod	pronoun: neuter nominative singular	ls.n40103:qui1
https://lingualatina.github.io/texts/browsable/hyginus/197a/	197a.1	197a.1.11	pisces	noun: masculine nominative plural	ls.n36428:piscis
https://lingualatina.github.io/texts/browsable/hyginus/197a/	197a.1	197a.1.11	pisces	noun: masculine accusative plural	ls.n36428:piscis
https://lingualatina.github.io/texts/browsable/hyginus/197a/	197a.1	197a.1.11	pisces	noun: masculine vocative plural	ls.n36428:piscis
https://lingualatina.github.io/texts/browsable/hyginus/197a/	197a.1	197a.1.12	ad	uninflected preposition	ls.n665:ad
https://lingualatina.github.io/texts/browsable/hyginus/197a/	197a.1	197a.1.13	ripam	noun: feminine accusative singular	ls.n41774:ripa
https://lingualatina.github.io/texts/browsable/hyginus/197a/	197a.1	197a.1.14	euoluerunt		ls.null
https://lingualatina.github.io/texts/browsable/hyginus/197a/	197a.1	197a.1.14_0	,		ls.null
https://lingualatina.github.io/texts/browsable/hyginus/197a/	197a.1	197a.1.15	super	uninflected preposition	ls.n46609:super2
https://lingualatina.github.io/texts/browsable/hyginus/197a/	197a.1	197a.1.15	super	adverb: positive degree	ls.n46609:super2
https://lingualatina.github.io/texts/browsable/hyginus/197a/	197a.1	197a.1.16	quod	uninflected conjunction	ls.n40262:quod1
https://lingualatina.github.io/texts/browsable/hyginus/197a/	197a.1	197a.1.16	quod	pronoun: neuter accusative singular	ls.n40103:qui1
https://lingualatina.github.io/texts/browsable/hyginus/197a/	197a.1	197a.1.16	quod	pronoun: neuter nominative singular	ls.n40103:qui1
https://lingualatina.github.io/texts/browsable/hyginus/197a/	197a.1	197a.1.17	columbae	noun: feminine nominative plural	ls.n9183:columba
https://lingualatina.github.io/texts/browsable/hyginus/197a/	197a.1	197a.1.17	columbae	noun: feminine genitive singular	ls.n9183:columba
https://lingualatina.github.io/texts/browsable/hyginus/197a/	197a.1	197a.1.17	columbae	noun: feminine dative singular	ls.n9183:columba
https://lingualatina.github.io/texts/browsable/hyginus/197a/	197a.1	197a.1.17	columbae	noun: feminine vocative plural	ls.n9183:columba
https://lingualatina.github.io/texts/browsable/hyginus/197a/	197a.1	197a.1.18	consederunt		ls.null
https://lingualatina.github.io/texts/browsable/hyginus/197a/	197a.1	197a.1.19	et	uninflected conjunction	ls.n16278:et
https://lingualatina.github.io/texts/browsable/hyginus/197a/	197a.1	197a.1.20	excalfactum		ls.null
https://lingualatina.github.io/texts/browsable/hyginus/197a/	197a.1	197a.1.21	exclusisse		ls.null
https://lingualatina.github.io/texts/browsable/hyginus/197a/	197a.1	197a.1.22_0	,		ls.null
https://lingualatina.github.io/texts/browsable/hyginus/197a/	197a.1	197a.1.23	quae	pronoun: feminine nominative plural	ls.n40242:quis1
https://lingualatina.github.io/texts/browsable/hyginus/197a/	197a.1	197a.1.23	quae	pronoun: neuter accusative plural	ls.n40242:quis1
https://lingualatina.github.io/texts/browsable/hyginus/197a/	197a.1	197a.1.23	quae	pronoun: neuter nominative plural	ls.n40242:quis1
https://lingualatina.github.io/texts/browsable/hyginus/197a/	197a.1	197a.1.23	quae	pronoun: neuter accusative plural	ls.n40103:qui1
https://lingualatina.github.io/texts/browsable/hyginus/197a/	197a.1	197a.1.23	quae	pronoun: neuter nominative plural	ls.n40103:qui1
https://lingualatina.github.io/texts/browsable/hyginus/197a/	197a.1	197a.1.23	quae	pronoun: feminine nominative plural	ls.n40103:qui1
https://lingualatina.github.io/texts/browsable/hyginus/197a/	197a.1	197a.1.23	quae	pronoun: feminine nominative singular	ls.n40103:qui1
https://lingualatina.github.io/texts/browsable/hyginus/197a/	197a.1	197a.1.24	postea	adverb: positive degree	ls.n37196:postea
https://lingualatina.github.io/texts/browsable/hyginus/197a/	197a.1	197a.1.25	dea	noun: feminine nominative singular	ls.n12362:dea
https://lingualatina.github.io/texts/browsable/hyginus/197a/	197a.1	197a.1.25	dea	noun: feminine ablative singular	ls.n12362:dea
https://lingualatina.github.io/texts/browsable/hyginus/197a/	197a.1	197a.1.25	dea	noun: feminine vocative singular	ls.n12362:dea
https://lingualatina.github.io/texts/browsable/hyginus/197a/	197a.1	197a.1.26	Syria		ls.null
https://lingualatina.github.io/texts/browsable/hyginus/197a/	197a.1	197a.1.27	est	finite verb: third singular present indicative active	ls.n46529:sum1
https://lingualatina.github.io/texts/browsable/hyginus/197a/	197a.1	197a.1.28	appellata	participle: perfect passive feminine nominative singular	ls.n3134:appello2
https://lingualatina.github.io/texts/browsable/hyginus/197a/	197a.1	197a.1.28	appellata	participle: perfect passive feminine ablative singular	ls.n3134:appello2
https://lingualatina.github.io/texts/browsable/hyginus/197a/	197a.1	197a.1.28	appellata	participle: perfect passive feminine vocative singular	ls.n3134:appello2
https://lingualatina.github.io/texts/browsable/hyginus/197a/	197a.1	197a.1.28	appellata	participle: perfect passive neuter nominative plural	ls.n3134:appello2
https://lingualatina.github.io/texts/browsable/hyginus/197a/	197a.1	197a.1.28	appellata	participle: perfect passive neuter accusative plural	ls.n3134:appello2
https://lingualatina.github.io/texts/browsable/hyginus/197a/	197a.1	197a.1.28	appellata	participle: perfect passive neuter vocative plural	ls.n3134:appello2
https://lingualatina.github.io/texts/browsable/hyginus/197a/	197a.1	197a.1.28_0	;		ls.null
https://lingualatina.github.io/texts/browsable/hyginus/197a/	197a.1	197a.1.29	ea	pronoun: feminine nominative singular	ls.n25029:is
https://lingualatina.github.io/texts/browsable/hyginus/197a/	197a.1	197a.1.29	ea	pronoun: feminine ablative singular	ls.n25029:is
https://lingualatina.github.io/texts/browsable/hyginus/197a/	197a.1	197a.1.29	ea	pronoun: neuter nominative plural	ls.n25029:is
https://lingualatina.github.io/texts/browsable/hyginus/197a/	197a.1	197a.1.29	ea	pronoun: neuter accusative plural	ls.n25029:is
https://lingualatina.github.io/texts/browsable/hyginus/197a/	197a.1	197a.1.30	iustitia		ls.null
https://lingualatina.github.io/texts/browsable/hyginus/197a/	197a.1	197a.1.31	et	uninflected conjunction	ls.n16278:et
https://lingualatina.github.io/texts/browsable/hyginus/197a/	197a.1	197a.1.32	probitate		ls.null
https://lingualatina.github.io/texts/browsable/hyginus/197a/	197a.1	197a.1.33	cum	uninflected preposition	ls.n11872:cum1
https://lingualatina.github.io/texts/browsable/hyginus/197a/	197a.1	197a.1.34	ceteros	adjective: masculine accusative plural positive	ls.n7640:ceterus
https://lingualatina.github.io/texts/browsable/hyginus/197a/	197a.1	197a.1.35	exsuperasset		ls.null
https://lingualatina.github.io/texts/browsable/hyginus/197a/	197a.1	197a.1.35_0	,		ls.null
https://lingualatina.github.io/texts/browsable/hyginus/197a/	197a.1	197a.1.36	et	uninflected conjunction	ls.n16278:et
https://lingualatina.github.io/texts/browsable/hyginus/197a/	197a.1	197a.1.37	ab	uninflected preposition	ls.n4:ab
https://lingualatina.github.io/texts/browsable/hyginus/197a/	197a.1	197a.1.38	Ioue		ls.null
https://lingualatina.github.io/texts/browsable/hyginus/197a/	197a.1	197a.1.39	optione		ls.null
https://lingualatina.github.io/texts/browsable/hyginus/197a/	197a.1	197a.1.40	data	participle: perfect passive feminine nominative singular	ls.n14599:do1
https://lingualatina.github.io/texts/browsable/hyginus/197a/	197a.1	197a.1.40	data	participle: perfect passive feminine ablative singular	ls.n14599:do1
https://lingualatina.github.io/texts/browsable/hyginus/197a/	197a.1	197a.1.40	data	participle: perfect passive feminine vocative singular	ls.n14599:do1
https://lingualatina.github.io/texts/browsable/hyginus/197a/	197a.1	197a.1.40	data	participle: perfect passive neuter nominative plural	ls.n14599:do1
https://lingualatina.github.io/texts/browsable/hyginus/197a/	197a.1	197a.1.40	data	participle: perfect passive neuter accusative plural	ls.n14599:do1
https://lingualatina.github.io/texts/browsable/hyginus/197a/	197a.1	197a.1.40	data	participle: perfect passive neuter vocative plural	ls.n14599:do1
https://lingualatina.github.io/texts/browsable/hyginus/197a/	197a.1	197a.1.41	pisces	noun: masculine nominative plural	ls.n36428:piscis
https://lingualatina.github.io/texts/browsable/hyginus/197a/	197a.1	197a.1.41	pisces	noun: masculine accusative plural	ls.n36428:piscis
https://lingualatina.github.io/texts/browsable/hyginus/197a/	197a.1	197a.1.41	pisces	noun: masculine vocative plural	ls.n36428:piscis
https://lingualatina.github.io/texts/browsable/hyginus/197a/	197a.1	197a.1.42	in	uninflected preposition	ls.n22111:in1
https://lingualatina.github.io/texts/browsable/hyginus/197a/	197a.1	197a.1.43	astrorum	noun: neuter genitive plural	ls.n4190:astrum
https://lingualatina.github.io/texts/browsable/hyginus/197a/	197a.1	197a.1.44	numerum	noun: masculine accusative singular	ls.n31419:numerus
https://lingualatina.github.io/texts/browsable/hyginus/197a/	197a.1	197a.1.45	relati	participle: perfect passive masculine nominative plural	ls.n40791:refero
https://lingualatina.github.io/texts/browsable/hyginus/197a/	197a.1	197a.1.45	relati	participle: perfect passive masculine genitive singular	ls.n40791:refero
https://lingualatina.github.io/texts/browsable/hyginus/197a/	197a.1	197a.1.45	relati	participle: perfect passive masculine vocative plural	ls.n40791:refero
https://lingualatina.github.io/texts/browsable/hyginus/197a/	197a.1	197a.1.45	relati	participle: perfect passive neuter genitive singular	ls.n40791:refero
https://lingualatina.github.io/texts/browsable/hyginus/197a/	197a.1	197a.1.46	sunt	finite verb: third plural present indicative active	ls.n46529:sum1
https://lingualatina.github.io/texts/browsable/hyginus/197a/	197a.1	197a.1.46_0	,		ls.null
https://lingualatina.github.io/texts/browsable/hyginus/197a/	197a.1	197a.1.47	et	uninflected conjunction	ls.n16278:et
https://lingualatina.github.io/texts/browsable/hyginus/197a/	197a.1	197a.1.48	ob	uninflected preposition	ls.n31564:ob
https://lingualatina.github.io/texts/browsable/hyginus/197a/	197a.1	197a.1.49	id	pronoun: neuter nominative singular	ls.n25029:is
https://lingualatina.github.io/texts/browsable/hyginus/197a/	197a.1	197a.1.49	id	pronoun: neuter accusative singular	ls.n25029:is
https://lingualatina.github.io/texts/browsable/hyginus/197a/	197a.1	197a.1.50	Syri		ls.null
https://lingualatina.github.io/texts/browsable/hyginus/197a/	197a.1	197a.1.51	pisces	noun: masculine nominative plural	ls.n36428:piscis
https://lingualatina.github.io/texts/browsable/hyginus/197a/	197a.1	197a.1.51	pisces	noun: masculine accusative plural	ls.n36428:piscis
https://lingualatina.github.io/texts/browsable/hyginus/197a/	197a.1	197a.1.51	pisces	noun: masculine vocative plural	ls.n36428:piscis
https://lingualatina.github.io/texts/browsable/hyginus/197a/	197a.1	197a.1.52	et	uninflected conjunction	ls.n16278:et
https://lingualatina.github.io/texts/browsable/hyginus/197a/	197a.1	197a.1.53	columbas	noun: feminine accusative plural	ls.n9183:columba
https://lingualatina.github.io/texts/browsable/hyginus/197a/	197a.1	197a.1.54	ex	uninflected conjunction	ls.n16519:ex
https://lingualatina.github.io/texts/browsable/hyginus/197a/	197a.1	197a.1.55	deorum	noun: masculine genitive plural	ls.n13573:deus
https://lingualatina.github.io/texts/browsable/hyginus/197a/	197a.1	197a.1.55	deorum	noun: masculine genitive plural	ls.n13573:deus
https://lingualatina.github.io/texts/browsable/hyginus/197a/	197a.1	197a.1.56	numero	noun: masculine dative singular	ls.n31419:numerus
https://lingualatina.github.io/texts/browsable/hyginus/197a/	197a.1	197a.1.56	numero	noun: masculine ablative singular	ls.n31419:numerus
https://lingualatina.github.io/texts/browsable/hyginus/197a/	197a.1	197a.1.57	habentes	participle: present active masculine nominative plural	ls.n20077:habeo
https://lingualatina.github.io/texts/browsable/hyginus/197a/	197a.1	197a.1.57	habentes	participle: present active masculine accusative plural	ls.n20077:habeo
https://lingualatina.github.io/texts/browsable/hyginus/197a/	197a.1	197a.1.57	habentes	participle: present active masculine vocative plural	ls.n20077:habeo
https://lingualatina.github.io/texts/browsable/hyginus/197a/	197a.1	197a.1.57	habentes	participle: present active feminine nominative plural	ls.n20077:habeo
https://lingualatina.github.io/texts/browsable/hyginus/197a/	197a.1	197a.1.57	habentes	participle: present active feminine accusative plural	ls.n20077:habeo
https://lingualatina.github.io/texts/browsable/hyginus/197a/	197a.1	197a.1.57	habentes	participle: present active feminine vocative plural	ls.n20077:habeo
https://lingualatina.github.io/texts/browsable/hyginus/197a/	197a.1	197a.1.58	non	adverb: positive degree	ls.n31151:non
https://lingualatina.github.io/texts/browsable/hyginus/197a/	197a.1	197a.1.59	edunt	finite verb: third plural present indicative active	ls.n15157:edo2
https://lingualatina.github.io/texts/browsable/hyginus/197a/	197a.1	197a.1.59_0	.		ls.null