url	passage	tokenid	token	form	lexeme
https://lingualatina.github.io/texts/browsable/hyginus/201a/	201a.4	201a.4.0	qui	pronoun: masculine nominative plural	ls.n40242:quis1
https://lingualatina.github.io/texts/browsable/hyginus/201a/	201a.4	201a.4.0	qui	pronoun: masculine nominative plural	ls.n40103:qui1
https://lingualatina.github.io/texts/browsable/hyginus/201a/	201a.4	201a.4.0	qui	pronoun: masculine nominative singular	ls.n40103:qui1
https://lingualatina.github.io/texts/browsable/hyginus/201a/	201a.4	201a.4.1	cum	uninflected preposition	ls.n11872:cum1
https://lingualatina.github.io/texts/browsable/hyginus/201a/	201a.4	201a.4.2	ibi	adverb: positive degree	ls.n21296:ibi
https://lingualatina.github.io/texts/browsable/hyginus/201a/	201a.4	201a.4.3	moraretur	finite verb: third singular imperfect subjunctive passive	ls.n29751:morum
https://lingualatina.github.io/texts/browsable/hyginus/201a/	201a.4	201a.4.3_0	,		ls.null
https://lingualatina.github.io/texts/browsable/hyginus/201a/	201a.4	201a.4.4	Sisyphus		ls.null
https://lingualatina.github.io/texts/browsable/hyginus/201a/	201a.4	201a.4.5	Anticliam		ls.null
https://lingualatina.github.io/texts/browsable/hyginus/201a/	201a.4	201a.4.6	Autolyci		ls.null
https://lingualatina.github.io/texts/browsable/hyginus/201a/	201a.4	201a.4.7	filiam	noun: feminine accusative singular	ls.n18173:filia
https://lingualatina.github.io/texts/browsable/hyginus/201a/	201a.4	201a.4.8	compressit	finite verb: third singular perfect indicative active	ls.n9689:comprimo
https://lingualatina.github.io/texts/browsable/hyginus/201a/	201a.4	201a.4.8_0	,		ls.null
https://lingualatina.github.io/texts/browsable/hyginus/201a/	201a.4	201a.4.9	quae	pronoun: feminine nominative plural	ls.n40242:quis1
https://lingualatina.github.io/texts/browsable/hyginus/201a/	201a.4	201a.4.9	quae	pronoun: neuter accusative plural	ls.n40242:quis1
https://lingualatina.github.io/texts/browsable/hyginus/201a/	201a.4	201a.4.9	quae	pronoun: neuter nominative plural	ls.n40242:quis1
https://lingualatina.github.io/texts/browsable/hyginus/201a/	201a.4	201a.4.9	quae	pronoun: neuter accusative plural	ls.n40103:qui1
https://lingualatina.github.io/texts/browsable/hyginus/201a/	201a.4	201a.4.9	quae	pronoun: neuter nominative plural	ls.n40103:qui1
https://lingualatina.github.io/texts/browsable/hyginus/201a/	201a.4	201a.4.9	quae	pronoun: feminine nominative plural	ls.n40103:qui1
https://lingualatina.github.io/texts/browsable/hyginus/201a/	201a.4	201a.4.9	quae	pronoun: feminine nominative singular	ls.n40103:qui1
https://lingualatina.github.io/texts/browsable/hyginus/201a/	201a.4	201a.4.10	postea	adverb: positive degree	ls.n37196:postea
https://lingualatina.github.io/texts/browsable/hyginus/201a/	201a.4	201a.4.11	Laertae		ls.null
https://lingualatina.github.io/texts/browsable/hyginus/201a/	201a.4	201a.4.12	data	participle: perfect passive feminine nominative singular	ls.n14599:do1
https://lingualatina.github.io/texts/browsable/hyginus/201a/	201a.4	201a.4.12	data	participle: perfect passive feminine ablative singular	ls.n14599:do1
https://lingualatina.github.io/texts/browsable/hyginus/201a/	201a.4	201a.4.12	data	participle: perfect passive feminine vocative singular	ls.n14599:do1
https://lingualatina.github.io/texts/browsable/hyginus/201a/	201a.4	201a.4.12	data	participle: perfect passive neuter nominative plural	ls.n14599:do1
https://lingualatina.github.io/texts/browsable/hyginus/201a/	201a.4	201a.4.12	data	participle: perfect passive neuter accusative plural	ls.n14599:do1
https://lingualatina.github.io/texts/browsable/hyginus/201a/	201a.4	201a.4.12	data	participle: perfect passive neuter vocative plural	ls.n14599:do1
https://lingualatina.github.io/texts/browsable/hyginus/201a/	201a.4	201a.4.13	est	finite verb: third singular present indicative active	ls.n46529:sum1
https://lingualatina.github.io/texts/browsable/hyginus/201a/	201a.4	201a.4.14	in	uninflected preposition	ls.n22111:in1
https://lingualatina.github.io/texts/browsable/hyginus/201a/	201a.4	201a.4.15	coniugium	noun: neuter nominative singular	ls.n10349:conjugium
https://lingualatina.github.io/texts/browsable/hyginus/201a/	201a.4	201a.4.15	coniugium	noun: neuter accusative singular	ls.n10349:conjugium
https://lingualatina.github.io/texts/browsable/hyginus/201a/	201a.4	201a.4.15	coniugium	noun: neuter vocative singular	ls.n10349:conjugium
https://lingualatina.github.io/texts/browsable/hyginus/201a/	201a.4	201a.4.15_0	,		ls.null
https://lingualatina.github.io/texts/browsable/hyginus/201a/	201a.4	201a.4.16	ex	uninflected conjunction	ls.n16519:ex
https://lingualatina.github.io/texts/browsable/hyginus/201a/	201a.4	201a.4.17	qua	pronoun: feminine ablative singular	ls.n40103:qui1
https://lingualatina.github.io/texts/browsable/hyginus/201a/	201a.4	201a.4.18	natus	participle: perfect passive masculine nominative singular	ls.n30423:nascor
https://lingualatina.github.io/texts/browsable/hyginus/201a/	201a.4	201a.4.19	est	finite verb: third singular present indicative active	ls.n46529:sum1
https://lingualatina.github.io/texts/browsable/hyginus/201a/	201a.4	201a.4.20	Ulixes		ls.null
https://lingualatina.github.io/texts/browsable/hyginus/201a/	201a.4	201a.4.20_0	.		ls.null
https://lingualatina.github.io/texts/browsable/hyginus/201a/	201a.4	201a.4.21	ideo	adverb: positive degree	ls.n21345:ideo
https://lingualatina.github.io/texts/browsable/hyginus/201a/	201a.4	201a.4.22	nonnulli	adjective: masculine nominative plural positive	ls.n31185:nonnullus
https://lingualatina.github.io/texts/browsable/hyginus/201a/	201a.4	201a.4.22	nonnulli	adjective: masculine dative singular positive	ls.n31185:nonnullus
https://lingualatina.github.io/texts/browsable/hyginus/201a/	201a.4	201a.4.22	nonnulli	adjective: masculine vocative plural positive	ls.n31185:nonnullus
https://lingualatina.github.io/texts/browsable/hyginus/201a/	201a.4	201a.4.22	nonnulli	adjective: feminine dative singular positive	ls.n31185:nonnullus
https://lingualatina.github.io/texts/browsable/hyginus/201a/	201a.4	201a.4.22	nonnulli	adjective: neuter dative singular positive	ls.n31185:nonnullus
https://lingualatina.github.io/texts/browsable/hyginus/201a/	201a.4	201a.4.23	auctores	noun: masculine nominative plural	ls.n4420:auctor
https://lingualatina.github.io/texts/browsable/hyginus/201a/	201a.4	201a.4.23	auctores	noun: masculine accusative plural	ls.n4420:auctor
https://lingualatina.github.io/texts/browsable/hyginus/201a/	201a.4	201a.4.23	auctores	noun: masculine vocative plural	ls.n4420:auctor
https://lingualatina.github.io/texts/browsable/hyginus/201a/	201a.4	201a.4.24	dicunt	finite verb: third plural present indicative active	ls.n13804:dico2
https://lingualatina.github.io/texts/browsable/hyginus/201a/	201a.4	201a.4.25_0	.		ls.null
https://lingualatina.github.io/texts/browsable/hyginus/201a/	201a.4	201a.4.26	ob	uninflected preposition	ls.n31564:ob
https://lingualatina.github.io/texts/browsable/hyginus/201a/	201a.4	201a.4.27	hoc	pronoun: neuter accusative singular	ls.n20640:hic
https://lingualatina.github.io/texts/browsable/hyginus/201a/	201a.4	201a.4.27	hoc	pronoun: neuter ablative singular	ls.n20640:hic
https://lingualatina.github.io/texts/browsable/hyginus/201a/	201a.4	201a.4.27	hoc	pronoun: masculine ablative singular	ls.n20640:hic
https://lingualatina.github.io/texts/browsable/hyginus/201a/	201a.4	201a.4.27	hoc	pronoun: neuter nominative singular	ls.n20640:hic
https://lingualatina.github.io/texts/browsable/hyginus/201a/	201a.4	201a.4.28	Ulixes		ls.null
https://lingualatina.github.io/texts/browsable/hyginus/201a/	201a.4	201a.4.29	uersutus		ls.null
https://lingualatina.github.io/texts/browsable/hyginus/201a/	201a.4	201a.4.30	fuit	finite verb: third singular perfect indicative active	ls.n46529:sum1
https://lingualatina.github.io/texts/browsable/hyginus/201a/	201a.4	201a.4.30_0	.		ls.null