url	passage	tokenid	token	form	lexeme
https://lingualatina.github.io/texts/browsable/hyginus/219_218/	219_218.2	219_218.2.0	qui	pronoun: masculine nominative plural	ls.n40242:quis1
https://lingualatina.github.io/texts/browsable/hyginus/219_218/	219_218.2	219_218.2.0	qui	pronoun: masculine nominative plural	ls.n40103:qui1
https://lingualatina.github.io/texts/browsable/hyginus/219_218/	219_218.2	219_218.2.0	qui	pronoun: masculine nominative singular	ls.n40103:qui1
https://lingualatina.github.io/texts/browsable/hyginus/219_218/	219_218.2	219_218.2.1	hostes	noun: masculine nominative plural	ls.n21026:hostis
https://lingualatina.github.io/texts/browsable/hyginus/219_218/	219_218.2	219_218.2.1	hostes	noun: masculine accusative plural	ls.n21026:hostis
https://lingualatina.github.io/texts/browsable/hyginus/219_218/	219_218.2	219_218.2.1	hostes	noun: masculine vocative plural	ls.n21026:hostis
https://lingualatina.github.io/texts/browsable/hyginus/219_218/	219_218.2	219_218.2.1	hostes	noun: feminine nominative plural	ls.n21026:hostis
https://lingualatina.github.io/texts/browsable/hyginus/219_218/	219_218.2	219_218.2.1	hostes	noun: feminine accusative plural	ls.n21026:hostis
https://lingualatina.github.io/texts/browsable/hyginus/219_218/	219_218.2	219_218.2.1	hostes	noun: feminine vocative plural	ls.n21026:hostis
https://lingualatina.github.io/texts/browsable/hyginus/219_218/	219_218.2	219_218.2.2	uno	adjective: masculine ablative singular positive	ls.n49871:unus
https://lingualatina.github.io/texts/browsable/hyginus/219_218/	219_218.2	219_218.2.2	uno	adjective: neuter ablative singular positive	ls.n49871:unus
https://lingualatina.github.io/texts/browsable/hyginus/219_218/	219_218.2	219_218.2.3	proelio	noun: neuter dative singular	ls.n38589:proelium
https://lingualatina.github.io/texts/browsable/hyginus/219_218/	219_218.2	219_218.2.3	proelio	noun: neuter ablative singular	ls.n38589:proelium
https://lingualatina.github.io/texts/browsable/hyginus/219_218/	219_218.2	219_218.2.4	fugauit	finite verb: third singular perfect indicative active	ls.n18949:fugo
https://lingualatina.github.io/texts/browsable/hyginus/219_218/	219_218.2	219_218.2.5	et	uninflected conjunction	ls.n16278:et
https://lingualatina.github.io/texts/browsable/hyginus/219_218/	219_218.2	219_218.2.6	ab	uninflected preposition	ls.n4:ab
https://lingualatina.github.io/texts/browsable/hyginus/219_218/	219_218.2	219_218.2.7	rege	noun: masculine ablative singular	ls.n41625:rex1
https://lingualatina.github.io/texts/browsable/hyginus/219_218/	219_218.2	219_218.2.8	pollicita	participle: perfect passive feminine nominative singular	ls.n36862:polliceor
https://lingualatina.github.io/texts/browsable/hyginus/219_218/	219_218.2	219_218.2.8	pollicita	participle: perfect passive feminine ablative singular	ls.n36862:polliceor
https://lingualatina.github.io/texts/browsable/hyginus/219_218/	219_218.2	219_218.2.8	pollicita	participle: perfect passive feminine vocative singular	ls.n36862:polliceor
https://lingualatina.github.io/texts/browsable/hyginus/219_218/	219_218.2	219_218.2.8	pollicita	participle: perfect passive neuter nominative plural	ls.n36862:polliceor
https://lingualatina.github.io/texts/browsable/hyginus/219_218/	219_218.2	219_218.2.8	pollicita	participle: perfect passive neuter accusative plural	ls.n36862:polliceor
https://lingualatina.github.io/texts/browsable/hyginus/219_218/	219_218.2	219_218.2.8	pollicita	participle: perfect passive neuter vocative plural	ls.n36862:polliceor
https://lingualatina.github.io/texts/browsable/hyginus/219_218/	219_218.2	219_218.2.9	petit	finite verb: third singular present indicative active	ls.n35822:peto
https://lingualatina.github.io/texts/browsable/hyginus/219_218/	219_218.2	219_218.2.9_0	.		ls.null
https://lingualatina.github.io/texts/browsable/hyginus/219_218/	219_218.2	219_218.2.10	ille	pronoun: masculine nominative singular	ls.n21494:ille
https://lingualatina.github.io/texts/browsable/hyginus/219_218/	219_218.2	219_218.2.11	ab	uninflected preposition	ls.n4:ab
https://lingualatina.github.io/texts/browsable/hyginus/219_218/	219_218.2	219_218.2.12	amicis	adjective: masculine dative plural positive	ls.n2246:amicus1
https://lingualatina.github.io/texts/browsable/hyginus/219_218/	219_218.2	219_218.2.12	amicis	adjective: masculine ablative plural positive	ls.n2246:amicus1
https://lingualatina.github.io/texts/browsable/hyginus/219_218/	219_218.2	219_218.2.12	amicis	adjective: feminine dative plural positive	ls.n2246:amicus1
https://lingualatina.github.io/texts/browsable/hyginus/219_218/	219_218.2	219_218.2.12	amicis	adjective: feminine ablative plural positive	ls.n2246:amicus1
https://lingualatina.github.io/texts/browsable/hyginus/219_218/	219_218.2	219_218.2.12	amicis	adjective: neuter dative plural positive	ls.n2246:amicus1
https://lingualatina.github.io/texts/browsable/hyginus/219_218/	219_218.2	219_218.2.12	amicis	adjective: neuter ablative plural positive	ls.n2246:amicus1
https://lingualatina.github.io/texts/browsable/hyginus/219_218/	219_218.2	219_218.2.13	dissuasus		ls.null
https://lingualatina.github.io/texts/browsable/hyginus/219_218/	219_218.2	219_218.2.14	fidem	noun: feminine accusative singular	ls.n18127:fides1
https://lingualatina.github.io/texts/browsable/hyginus/219_218/	219_218.2	219_218.2.15	fraudauit	finite verb: third singular perfect indicative active	ls.n18726:fraudo
https://lingualatina.github.io/texts/browsable/hyginus/219_218/	219_218.2	219_218.2.17	per	uninflected preposition	ls.n34595:per1
https://lingualatina.github.io/texts/browsable/hyginus/219_218/	219_218.2	219_218.2.18	dolum	noun: masculine accusative singular	ls.n14674:dolus
https://lingualatina.github.io/texts/browsable/hyginus/219_218/	219_218.2	219_218.2.19	interficere	finite verb: second singular present indicative passive	ls.n24257:interficio
https://lingualatina.github.io/texts/browsable/hyginus/219_218/	219_218.2	219_218.2.19	interficere	infinitive: present active	ls.n24257:interficio
https://lingualatina.github.io/texts/browsable/hyginus/219_218/	219_218.2	219_218.2.20	uoluit	finite verb: third singular perfect indicative active	ls.n51298:volo1
https://lingualatina.github.io/texts/browsable/hyginus/219_218/	219_218.2	219_218.2.20_0	.		ls.null