url	passage	tokenid	token	form	lexeme
https://lingualatina.github.io/texts/browsable/hyginus/23pr/	23pr.2	23pr.2.0	qui	pronoun: masculine nominative plural	ls.n40242:quis1
https://lingualatina.github.io/texts/browsable/hyginus/23pr/	23pr.2	23pr.2.0	qui	pronoun: masculine nominative plural	ls.n40103:qui1
https://lingualatina.github.io/texts/browsable/hyginus/23pr/	23pr.2	23pr.2.0	qui	pronoun: masculine nominative singular	ls.n40103:qui1
https://lingualatina.github.io/texts/browsable/hyginus/23pr/	23pr.2	23pr.2.1	cum	uninflected preposition	ls.n11872:cum1
https://lingualatina.github.io/texts/browsable/hyginus/23pr/	23pr.2	23pr.2.2	tristior	adjective: masculine nominative singular comparative	ls.n49206:tristis
https://lingualatina.github.io/texts/browsable/hyginus/23pr/	23pr.2	23pr.2.2	tristior	adjective: masculine vocative singular comparative	ls.n49206:tristis
https://lingualatina.github.io/texts/browsable/hyginus/23pr/	23pr.2	23pr.2.2	tristior	adjective: feminine nominative singular comparative	ls.n49206:tristis
https://lingualatina.github.io/texts/browsable/hyginus/23pr/	23pr.2	23pr.2.2	tristior	adjective: feminine vocative singular comparative	ls.n49206:tristis
https://lingualatina.github.io/texts/browsable/hyginus/23pr/	23pr.2	23pr.2.3	esset	finite verb: third singular imperfect subjunctive active	ls.n46529:sum1
https://lingualatina.github.io/texts/browsable/hyginus/23pr/	23pr.2	23pr.2.4	et	uninflected conjunction	ls.n16278:et
https://lingualatina.github.io/texts/browsable/hyginus/23pr/	23pr.2	23pr.2.5	interrogatus	participle: perfect passive masculine nominative singular	ls.n24445:interrogo
https://lingualatina.github.io/texts/browsable/hyginus/23pr/	23pr.2	23pr.2.6	est	finite verb: third singular present indicative active	ls.n46529:sum1
https://lingualatina.github.io/texts/browsable/hyginus/23pr/	23pr.2	23pr.2.7	a	uninflected preposition	ls.n4:ab
https://lingualatina.github.io/texts/browsable/hyginus/23pr/	23pr.2	23pr.2.8	coniuge	noun: masculine ablative singular	ls.n10361:conjunx
https://lingualatina.github.io/texts/browsable/hyginus/23pr/	23pr.2	23pr.2.8	coniuge	noun: feminine ablative singular	ls.n10361:conjunx
https://lingualatina.github.io/texts/browsable/hyginus/23pr/	23pr.2	23pr.2.9	Arete		ls.null
https://lingualatina.github.io/texts/browsable/hyginus/23pr/	23pr.2	23pr.2.10	quae	pronoun: feminine nominative plural	ls.n40242:quis1
https://lingualatina.github.io/texts/browsable/hyginus/23pr/	23pr.2	23pr.2.10	quae	pronoun: neuter accusative plural	ls.n40242:quis1
https://lingualatina.github.io/texts/browsable/hyginus/23pr/	23pr.2	23pr.2.10	quae	pronoun: neuter nominative plural	ls.n40242:quis1
https://lingualatina.github.io/texts/browsable/hyginus/23pr/	23pr.2	23pr.2.10	quae	pronoun: neuter accusative plural	ls.n40103:qui1
https://lingualatina.github.io/texts/browsable/hyginus/23pr/	23pr.2	23pr.2.10	quae	pronoun: neuter nominative plural	ls.n40103:qui1
https://lingualatina.github.io/texts/browsable/hyginus/23pr/	23pr.2	23pr.2.10	quae	pronoun: feminine nominative plural	ls.n40103:qui1
https://lingualatina.github.io/texts/browsable/hyginus/23pr/	23pr.2	23pr.2.10	quae	pronoun: feminine nominative singular	ls.n40103:qui1
https://lingualatina.github.io/texts/browsable/hyginus/23pr/	23pr.2	23pr.2.11	causa	noun: feminine nominative singular	ls.n7197:causa
https://lingualatina.github.io/texts/browsable/hyginus/23pr/	23pr.2	23pr.2.11	causa	noun: feminine ablative singular	ls.n7197:causa
https://lingualatina.github.io/texts/browsable/hyginus/23pr/	23pr.2	23pr.2.11	causa	noun: feminine vocative singular	ls.n7197:causa
https://lingualatina.github.io/texts/browsable/hyginus/23pr/	23pr.2	23pr.2.12	esset	finite verb: third singular imperfect subjunctive active	ls.n46529:sum1
https://lingualatina.github.io/texts/browsable/hyginus/23pr/	23pr.2	23pr.2.13	tristitiae		ls.null
https://lingualatina.github.io/texts/browsable/hyginus/23pr/	23pr.2	23pr.2.13_0	,		ls.null
https://lingualatina.github.io/texts/browsable/hyginus/23pr/	23pr.2	23pr.2.14	dixit	finite verb: third singular perfect indicative active	ls.n13804:dico2
https://lingualatina.github.io/texts/browsable/hyginus/23pr/	23pr.2	23pr.2.15	se	participle: perfect passive masculine vocative singular	ls.do
https://lingualatina.github.io/texts/browsable/hyginus/23pr/	23pr.2	23pr.2.15	se	pronoun: masculine accusative singular	ls.n46498:sui
https://lingualatina.github.io/texts/browsable/hyginus/23pr/	23pr.2	23pr.2.15	se	pronoun: masculine ablative singular	ls.n46498:sui
https://lingualatina.github.io/texts/browsable/hyginus/23pr/	23pr.2	23pr.2.15	se	pronoun: feminine ablative singular	ls.n46498:sui
https://lingualatina.github.io/texts/browsable/hyginus/23pr/	23pr.2	23pr.2.15	se	pronoun: neuter ablative singular	ls.n46498:sui
https://lingualatina.github.io/texts/browsable/hyginus/23pr/	23pr.2	23pr.2.15	se	pronoun: feminine ablative plural	ls.n46498:sui
https://lingualatina.github.io/texts/browsable/hyginus/23pr/	23pr.2	23pr.2.15	se	pronoun: neuter accusative plural	ls.n46498:sui
https://lingualatina.github.io/texts/browsable/hyginus/23pr/	23pr.2	23pr.2.15	se	pronoun: feminine accusative plural	ls.n46498:sui
https://lingualatina.github.io/texts/browsable/hyginus/23pr/	23pr.2	23pr.2.15	se	pronoun: neuter ablative plural	ls.n46498:sui
https://lingualatina.github.io/texts/browsable/hyginus/23pr/	23pr.2	23pr.2.15	se	pronoun: feminine accusative singular	ls.n46498:sui
https://lingualatina.github.io/texts/browsable/hyginus/23pr/	23pr.2	23pr.2.15	se	pronoun: neuter accusative singular	ls.n46498:sui
https://lingualatina.github.io/texts/browsable/hyginus/23pr/	23pr.2	23pr.2.15	se	pronoun: masculine accusative plural	ls.n46498:sui
https://lingualatina.github.io/texts/browsable/hyginus/23pr/	23pr.2	23pr.2.15	se	pronoun: masculine ablative plural	ls.n46498:sui
https://lingualatina.github.io/texts/browsable/hyginus/23pr/	23pr.2	23pr.2.16	iudicem	noun: masculine accusative singular	ls.n25280:judex
https://lingualatina.github.io/texts/browsable/hyginus/23pr/	23pr.2	23pr.2.16	iudicem	finite verb: first singular present subjunctive active	ls.n25294:judico
https://lingualatina.github.io/texts/browsable/hyginus/23pr/	23pr.2	23pr.2.17	sumptum	participle: perfect passive masculine accusative singular	ls.n46587:sumo
https://lingualatina.github.io/texts/browsable/hyginus/23pr/	23pr.2	23pr.2.17	sumptum	participle: perfect passive neuter nominative singular	ls.n46587:sumo
https://lingualatina.github.io/texts/browsable/hyginus/23pr/	23pr.2	23pr.2.17	sumptum	participle: perfect passive neuter vocative singular	ls.n46587:sumo
https://lingualatina.github.io/texts/browsable/hyginus/23pr/	23pr.2	23pr.2.18	a	uninflected preposition	ls.n4:ab
https://lingualatina.github.io/texts/browsable/hyginus/23pr/	23pr.2	23pr.2.19	duabus	adjective: feminine ablative plural positive	ls.n14914:duo
https://lingualatina.github.io/texts/browsable/hyginus/23pr/	23pr.2	23pr.2.19	duabus	adjective: feminine dative plural positive	ls.n14914:duo
https://lingualatina.github.io/texts/browsable/hyginus/23pr/	23pr.2	23pr.2.20	diuersis		ls.null
https://lingualatina.github.io/texts/browsable/hyginus/23pr/	23pr.2	23pr.2.21	ciuitatibus	noun: feminine dative plural	ls.n8465:civitas
https://lingualatina.github.io/texts/browsable/hyginus/23pr/	23pr.2	23pr.2.21	ciuitatibus	noun: feminine ablative plural	ls.n8465:civitas
https://lingualatina.github.io/texts/browsable/hyginus/23pr/	23pr.2	23pr.2.21_0	,		ls.null
https://lingualatina.github.io/texts/browsable/hyginus/23pr/	23pr.2	23pr.2.22	inter	uninflected preposition	ls.n24154:inter1
https://lingualatina.github.io/texts/browsable/hyginus/23pr/	23pr.2	23pr.2.23	Colchos		ls.null
https://lingualatina.github.io/texts/browsable/hyginus/23pr/	23pr.2	23pr.2.24	et	uninflected conjunction	ls.n16278:et
https://lingualatina.github.io/texts/browsable/hyginus/23pr/	23pr.2	23pr.2.25	Argiuos		ls.null
https://lingualatina.github.io/texts/browsable/hyginus/23pr/	23pr.2	23pr.2.25_0	.		ls.null
https://lingualatina.github.io/texts/browsable/hyginus/23pr/	23pr.2	23pr.2.26	quem	pronoun: masculine accusative singular	ls.n40242:quis1
https://lingualatina.github.io/texts/browsable/hyginus/23pr/	23pr.2	23pr.2.26	quem	pronoun: feminine accusative singular	ls.n40242:quis1
https://lingualatina.github.io/texts/browsable/hyginus/23pr/	23pr.2	23pr.2.26	quem	pronoun: masculine accusative singular	ls.n40103:qui1
https://lingualatina.github.io/texts/browsable/hyginus/23pr/	23pr.2	23pr.2.27	cum	uninflected preposition	ls.n11872:cum1
https://lingualatina.github.io/texts/browsable/hyginus/23pr/	23pr.2	23pr.2.28	interrogaret	finite verb: third singular imperfect subjunctive active	ls.n24445:interrogo
https://lingualatina.github.io/texts/browsable/hyginus/23pr/	23pr.2	23pr.2.29	Arete		ls.null
https://lingualatina.github.io/texts/browsable/hyginus/23pr/	23pr.2	23pr.2.30	quidnam		ls.null
https://lingualatina.github.io/texts/browsable/hyginus/23pr/	23pr.2	23pr.2.31	esset	finite verb: third singular imperfect subjunctive active	ls.n46529:sum1
https://lingualatina.github.io/texts/browsable/hyginus/23pr/	23pr.2	23pr.2.32	iudicaturus	participle: future active masculine nominative singular	ls.n25294:judico
https://lingualatina.github.io/texts/browsable/hyginus/23pr/	23pr.2	23pr.2.32_0	,		ls.null
https://lingualatina.github.io/texts/browsable/hyginus/23pr/	23pr.2	23pr.2.33	respondit	finite verb: third singular perfect indicative active	ls.n41387:respondeo
https://lingualatina.github.io/texts/browsable/hyginus/23pr/	23pr.2	23pr.2.34	Alcinous		ls.null
https://lingualatina.github.io/texts/browsable/hyginus/23pr/	23pr.2	23pr.2.34_0	,		ls.null
https://lingualatina.github.io/texts/browsable/hyginus/23pr/	23pr.2	23pr.2.35	si	participle: perfect passive masculine nominative plural	ls.do
https://lingualatina.github.io/texts/browsable/hyginus/23pr/	23pr.2	23pr.2.35	si	participle: perfect passive masculine genitive singular	ls.do
https://lingualatina.github.io/texts/browsable/hyginus/23pr/	23pr.2	23pr.2.35	si	participle: perfect passive masculine vocative plural	ls.do
https://lingualatina.github.io/texts/browsable/hyginus/23pr/	23pr.2	23pr.2.35	si	participle: perfect passive neuter genitive singular	ls.do
https://lingualatina.github.io/texts/browsable/hyginus/23pr/	23pr.2	23pr.2.35	si	uninflected conjunction	ls.n44096:si
https://lingualatina.github.io/texts/browsable/hyginus/23pr/	23pr.2	23pr.2.36	uirgo	noun: feminine nominative singular	ls.n51069:virgo
https://lingualatina.github.io/texts/browsable/hyginus/23pr/	23pr.2	23pr.2.36	uirgo	noun: feminine vocative singular	ls.n51069:virgo
https://lingualatina.github.io/texts/browsable/hyginus/23pr/	23pr.2	23pr.2.37	fuerit	finite verb: third singular perfect subjunctive active	ls.n46529:sum1
https://lingualatina.github.io/texts/browsable/hyginus/23pr/	23pr.2	23pr.2.37	fuerit	finite verb: third singular future perfect indicative active	ls.n46529:sum1
https://lingualatina.github.io/texts/browsable/hyginus/23pr/	23pr.2	23pr.2.38	Medea		ls.null
https://lingualatina.github.io/texts/browsable/hyginus/23pr/	23pr.2	23pr.2.38_0	,		ls.null
https://lingualatina.github.io/texts/browsable/hyginus/23pr/	23pr.2	23pr.2.39	parenti	noun: masculine dative singular	ls.n33843:parens2
https://lingualatina.github.io/texts/browsable/hyginus/23pr/	23pr.2	23pr.2.39	parenti	noun: feminine dative singular	ls.n33843:parens2
https://lingualatina.github.io/texts/browsable/hyginus/23pr/	23pr.2	23pr.2.39	parenti	participle: present active masculine dative singular	ls.n33851:pareo
https://lingualatina.github.io/texts/browsable/hyginus/23pr/	23pr.2	23pr.2.39	parenti	participle: present active masculine ablative singular	ls.n33851:pareo
https://lingualatina.github.io/texts/browsable/hyginus/23pr/	23pr.2	23pr.2.39	parenti	participle: present active feminine dative singular	ls.n33851:pareo
https://lingualatina.github.io/texts/browsable/hyginus/23pr/	23pr.2	23pr.2.39	parenti	participle: present active feminine ablative singular	ls.n33851:pareo
https://lingualatina.github.io/texts/browsable/hyginus/23pr/	23pr.2	23pr.2.39	parenti	participle: present active neuter dative singular	ls.n33851:pareo
https://lingualatina.github.io/texts/browsable/hyginus/23pr/	23pr.2	23pr.2.39	parenti	participle: present active neuter ablative singular	ls.n33851:pareo
https://lingualatina.github.io/texts/browsable/hyginus/23pr/	23pr.2	23pr.2.40	redditurum	participle: future active masculine accusative singular	ls.n40711:reddo
https://lingualatina.github.io/texts/browsable/hyginus/23pr/	23pr.2	23pr.2.40	redditurum	participle: future active neuter nominative singular	ls.n40711:reddo
https://lingualatina.github.io/texts/browsable/hyginus/23pr/	23pr.2	23pr.2.40	redditurum	participle: future active neuter vocative singular	ls.n40711:reddo
https://lingualatina.github.io/texts/browsable/hyginus/23pr/	23pr.2	23pr.2.40_0	,		ls.null
https://lingualatina.github.io/texts/browsable/hyginus/23pr/	23pr.2	23pr.2.41	sin		ls.null
https://lingualatina.github.io/texts/browsable/hyginus/23pr/	23pr.2	23pr.2.42	autem	uninflected conjunction	ls.n4633:autem
https://lingualatina.github.io/texts/browsable/hyginus/23pr/	23pr.2	23pr.2.43	mulier	noun: feminine nominative singular	ls.n29835:mulier
https://lingualatina.github.io/texts/browsable/hyginus/23pr/	23pr.2	23pr.2.43	mulier	noun: feminine vocative singular	ls.n29835:mulier
https://lingualatina.github.io/texts/browsable/hyginus/23pr/	23pr.2	23pr.2.43_0	,		ls.null
https://lingualatina.github.io/texts/browsable/hyginus/23pr/	23pr.2	23pr.2.44	coniugi	noun: masculine dative singular	ls.n10361:conjunx
https://lingualatina.github.io/texts/browsable/hyginus/23pr/	23pr.2	23pr.2.44	coniugi	noun: masculine ablative singular	ls.n10361:conjunx
https://lingualatina.github.io/texts/browsable/hyginus/23pr/	23pr.2	23pr.2.44	coniugi	noun: feminine dative singular	ls.n10361:conjunx
https://lingualatina.github.io/texts/browsable/hyginus/23pr/	23pr.2	23pr.2.44	coniugi	noun: feminine ablative singular	ls.n10361:conjunx
https://lingualatina.github.io/texts/browsable/hyginus/23pr/	23pr.2	23pr.2.44_0	.		ls.null