url	passage	tokenid	token	form	lexeme
https://lingualatina.github.io/texts/browsable/hyginus/243_237/	243_237.title	243_237.title.0	QUAE	pronoun: feminine nominative plural	ls.n40242:quis1
https://lingualatina.github.io/texts/browsable/hyginus/243_237/	243_237.title	243_237.title.0	QUAE	pronoun: neuter accusative plural	ls.n40242:quis1
https://lingualatina.github.io/texts/browsable/hyginus/243_237/	243_237.title	243_237.title.0	QUAE	pronoun: neuter nominative plural	ls.n40242:quis1
https://lingualatina.github.io/texts/browsable/hyginus/243_237/	243_237.title	243_237.title.0	QUAE	pronoun: neuter accusative plural	ls.n40103:qui1
https://lingualatina.github.io/texts/browsable/hyginus/243_237/	243_237.title	243_237.title.0	QUAE	pronoun: neuter nominative plural	ls.n40103:qui1
https://lingualatina.github.io/texts/browsable/hyginus/243_237/	243_237.title	243_237.title.0	QUAE	pronoun: feminine nominative plural	ls.n40103:qui1
https://lingualatina.github.io/texts/browsable/hyginus/243_237/	243_237.title	243_237.title.0	QUAE	pronoun: feminine nominative singular	ls.n40103:qui1
https://lingualatina.github.io/texts/browsable/hyginus/243_237/	243_237.title	243_237.title.1	SE	participle: perfect passive masculine vocative singular	ls.do
https://lingualatina.github.io/texts/browsable/hyginus/243_237/	243_237.title	243_237.title.1	SE	pronoun: masculine accusative singular	ls.n46498:sui
https://lingualatina.github.io/texts/browsable/hyginus/243_237/	243_237.title	243_237.title.1	SE	pronoun: masculine ablative singular	ls.n46498:sui
https://lingualatina.github.io/texts/browsable/hyginus/243_237/	243_237.title	243_237.title.1	SE	pronoun: feminine ablative singular	ls.n46498:sui
https://lingualatina.github.io/texts/browsable/hyginus/243_237/	243_237.title	243_237.title.1	SE	pronoun: neuter ablative singular	ls.n46498:sui
https://lingualatina.github.io/texts/browsable/hyginus/243_237/	243_237.title	243_237.title.1	SE	pronoun: feminine ablative plural	ls.n46498:sui
https://lingualatina.github.io/texts/browsable/hyginus/243_237/	243_237.title	243_237.title.1	SE	pronoun: neuter accusative plural	ls.n46498:sui
https://lingualatina.github.io/texts/browsable/hyginus/243_237/	243_237.title	243_237.title.1	SE	pronoun: feminine accusative plural	ls.n46498:sui
https://lingualatina.github.io/texts/browsable/hyginus/243_237/	243_237.title	243_237.title.1	SE	pronoun: neuter ablative plural	ls.n46498:sui
https://lingualatina.github.io/texts/browsable/hyginus/243_237/	243_237.title	243_237.title.1	SE	pronoun: feminine accusative singular	ls.n46498:sui
https://lingualatina.github.io/texts/browsable/hyginus/243_237/	243_237.title	243_237.title.1	SE	pronoun: neuter accusative singular	ls.n46498:sui
https://lingualatina.github.io/texts/browsable/hyginus/243_237/	243_237.title	243_237.title.1	SE	pronoun: masculine accusative plural	ls.n46498:sui
https://lingualatina.github.io/texts/browsable/hyginus/243_237/	243_237.title	243_237.title.1	SE	pronoun: masculine ablative plural	ls.n46498:sui
https://lingualatina.github.io/texts/browsable/hyginus/243_237/	243_237.title	243_237.title.2	IPSAE	pronoun: feminine nominative plural	ls.n24872:ipse
https://lingualatina.github.io/texts/browsable/hyginus/243_237/	243_237.title	243_237.title.3	INTERFECERUNT	finite verb: third plural perfect indicative active	ls.n24257:interficio
https://lingualatina.github.io/texts/browsable/hyginus/243_237/	243_237.title	243_237.title.3_0	.		ls.null