url	passage	tokenid	token	form	lexeme
https://lingualatina.github.io/texts/browsable/hyginus/24pr/	24pr.3	24pr.3.0	Medea		ls.null
https://lingualatina.github.io/texts/browsable/hyginus/24pr/	24pr.3	24pr.3.1	quo	pronoun: masculine ablative singular	ls.n40242:quis1
https://lingualatina.github.io/texts/browsable/hyginus/24pr/	24pr.3	24pr.3.1	quo	pronoun: feminine ablative singular	ls.n40242:quis1
https://lingualatina.github.io/texts/browsable/hyginus/24pr/	24pr.3	24pr.3.1	quo	pronoun: neuter ablative singular	ls.n40242:quis1
https://lingualatina.github.io/texts/browsable/hyginus/24pr/	24pr.3	24pr.3.1	quo	pronoun: masculine ablative singular	ls.n40103:qui1
https://lingualatina.github.io/texts/browsable/hyginus/24pr/	24pr.3	24pr.3.1	quo	pronoun: neuter ablative singular	ls.n40103:qui1
https://lingualatina.github.io/texts/browsable/hyginus/24pr/	24pr.3	24pr.3.2	facilius	adjective: neuter nominative singular comparative	ls.n17511:facilis
https://lingualatina.github.io/texts/browsable/hyginus/24pr/	24pr.3	24pr.3.2	facilius	adjective: neuter accusative singular comparative	ls.n17511:facilis
https://lingualatina.github.io/texts/browsable/hyginus/24pr/	24pr.3	24pr.3.2	facilius	adjective: neuter vocative singular comparative	ls.n17511:facilis
https://lingualatina.github.io/texts/browsable/hyginus/24pr/	24pr.3	24pr.3.3	eam	pronoun: feminine accusative singular	ls.n25029:is
https://lingualatina.github.io/texts/browsable/hyginus/24pr/	24pr.3	24pr.3.3	eam	finite verb: first singular present subjunctive active	ls.n15868:eo1
https://lingualatina.github.io/texts/browsable/hyginus/24pr/	24pr.3	24pr.3.4	perduceret	finite verb: third singular imperfect subjunctive active	ls.n34815:perduco
https://lingualatina.github.io/texts/browsable/hyginus/24pr/	24pr.3	24pr.3.5	ad	uninflected preposition	ls.n665:ad
https://lingualatina.github.io/texts/browsable/hyginus/24pr/	24pr.3	24pr.3.6	suam	adjective: feminine accusative singular positive	ls.n47174:suus
https://lingualatina.github.io/texts/browsable/hyginus/24pr/	24pr.3	24pr.3.7	uoluntatem	noun: feminine accusative singular	ls.n51337:voluntas
https://lingualatina.github.io/texts/browsable/hyginus/24pr/	24pr.3	24pr.3.7_0	,		ls.null
https://lingualatina.github.io/texts/browsable/hyginus/24pr/	24pr.3	24pr.3.8	caliginem	noun: feminine accusative singular	ls.n6259:caligo1
https://lingualatina.github.io/texts/browsable/hyginus/24pr/	24pr.3	24pr.3.9	eis	pronoun: masculine ablative plural	ls.n25029:is
https://lingualatina.github.io/texts/browsable/hyginus/24pr/	24pr.3	24pr.3.9	eis	pronoun: feminine ablative plural	ls.n25029:is
https://lingualatina.github.io/texts/browsable/hyginus/24pr/	24pr.3	24pr.3.9	eis	pronoun: neuter ablative plural	ls.n25029:is
https://lingualatina.github.io/texts/browsable/hyginus/24pr/	24pr.3	24pr.3.9	eis	pronoun: neuter dative plural	ls.n25029:is
https://lingualatina.github.io/texts/browsable/hyginus/24pr/	24pr.3	24pr.3.9	eis	pronoun: masculine dative plural	ls.n25029:is
https://lingualatina.github.io/texts/browsable/hyginus/24pr/	24pr.3	24pr.3.9	eis	pronoun: feminine dative plural	ls.n25029:is
https://lingualatina.github.io/texts/browsable/hyginus/24pr/	24pr.3	24pr.3.10	obiecit	finite verb: third singular perfect indicative active	ls.n31628:obicio
https://lingualatina.github.io/texts/browsable/hyginus/24pr/	24pr.3	24pr.3.11	et	uninflected conjunction	ls.n16278:et
https://lingualatina.github.io/texts/browsable/hyginus/24pr/	24pr.3	24pr.3.12	ex	uninflected conjunction	ls.n16519:ex
https://lingualatina.github.io/texts/browsable/hyginus/24pr/	24pr.3	24pr.3.13	uenenis	noun: neuter dative plural	ls.n50421:venenum
https://lingualatina.github.io/texts/browsable/hyginus/24pr/	24pr.3	24pr.3.13	uenenis	noun: neuter ablative plural	ls.n50421:venenum
https://lingualatina.github.io/texts/browsable/hyginus/24pr/	24pr.3	24pr.3.14	multa	adjective: feminine nominative singular positive	ls.n29945:multus
https://lingualatina.github.io/texts/browsable/hyginus/24pr/	24pr.3	24pr.3.14	multa	adjective: feminine ablative singular positive	ls.n29945:multus
https://lingualatina.github.io/texts/browsable/hyginus/24pr/	24pr.3	24pr.3.14	multa	adjective: neuter nominative plural positive	ls.n29945:multus
https://lingualatina.github.io/texts/browsable/hyginus/24pr/	24pr.3	24pr.3.14	multa	adjective: neuter accusative plural positive	ls.n29945:multus
https://lingualatina.github.io/texts/browsable/hyginus/24pr/	24pr.3	24pr.3.14	multa	adjective: neuter vocative plural positive	ls.n29945:multus
https://lingualatina.github.io/texts/browsable/hyginus/24pr/	24pr.3	24pr.3.14	multa	adjective: feminine vocative singular positive	ls.n29945:multus
https://lingualatina.github.io/texts/browsable/hyginus/24pr/	24pr.3	24pr.3.15	miracula	noun: neuter nominative plural	ls.n29219:miraculum
https://lingualatina.github.io/texts/browsable/hyginus/24pr/	24pr.3	24pr.3.15	miracula	noun: neuter accusative plural	ls.n29219:miraculum
https://lingualatina.github.io/texts/browsable/hyginus/24pr/	24pr.3	24pr.3.15	miracula	noun: neuter vocative plural	ls.n29219:miraculum
https://lingualatina.github.io/texts/browsable/hyginus/24pr/	24pr.3	24pr.3.16	fecit	finite verb: third singular perfect indicative active	ls.ficio
https://lingualatina.github.io/texts/browsable/hyginus/24pr/	24pr.3	24pr.3.16	fecit	finite verb: third singular perfect indicative active	ls.n17516:facio
https://lingualatina.github.io/texts/browsable/hyginus/24pr/	24pr.3	24pr.3.17	quae	pronoun: feminine nominative plural	ls.n40242:quis1
https://lingualatina.github.io/texts/browsable/hyginus/24pr/	24pr.3	24pr.3.17	quae	pronoun: neuter accusative plural	ls.n40242:quis1
https://lingualatina.github.io/texts/browsable/hyginus/24pr/	24pr.3	24pr.3.17	quae	pronoun: neuter nominative plural	ls.n40242:quis1
https://lingualatina.github.io/texts/browsable/hyginus/24pr/	24pr.3	24pr.3.17	quae	pronoun: neuter accusative plural	ls.n40103:qui1
https://lingualatina.github.io/texts/browsable/hyginus/24pr/	24pr.3	24pr.3.17	quae	pronoun: neuter nominative plural	ls.n40103:qui1
https://lingualatina.github.io/texts/browsable/hyginus/24pr/	24pr.3	24pr.3.17	quae	pronoun: feminine nominative plural	ls.n40103:qui1
https://lingualatina.github.io/texts/browsable/hyginus/24pr/	24pr.3	24pr.3.17	quae	pronoun: feminine nominative singular	ls.n40103:qui1
https://lingualatina.github.io/texts/browsable/hyginus/24pr/	24pr.3	24pr.3.18	ueri	adjective: masculine nominative plural positive	ls.n50667:verus
https://lingualatina.github.io/texts/browsable/hyginus/24pr/	24pr.3	24pr.3.18	ueri	adjective: masculine genitive singular positive	ls.n50667:verus
https://lingualatina.github.io/texts/browsable/hyginus/24pr/	24pr.3	24pr.3.18	ueri	adjective: masculine vocative plural positive	ls.n50667:verus
https://lingualatina.github.io/texts/browsable/hyginus/24pr/	24pr.3	24pr.3.18	ueri	adjective: neuter genitive singular positive	ls.n50667:verus
https://lingualatina.github.io/texts/browsable/hyginus/24pr/	24pr.3	24pr.3.19	similia	adjective: neuter nominative plural positive	ls.n44303:similis
https://lingualatina.github.io/texts/browsable/hyginus/24pr/	24pr.3	24pr.3.19	similia	adjective: neuter accusative plural positive	ls.n44303:similis
https://lingualatina.github.io/texts/browsable/hyginus/24pr/	24pr.3	24pr.3.19	similia	adjective: neuter vocative plural positive	ls.n44303:similis
https://lingualatina.github.io/texts/browsable/hyginus/24pr/	24pr.3	24pr.3.20	esse	infinitive: present active	ls.n46529:sum1
https://lingualatina.github.io/texts/browsable/hyginus/24pr/	24pr.3	24pr.3.21	uiderentur	finite verb: third plural imperfect subjunctive passive	ls.n50883:video
https://lingualatina.github.io/texts/browsable/hyginus/24pr/	24pr.3	24pr.3.21	uiderentur	finite verb: third plural imperfect subjunctive passive	ls.n50883:video
https://lingualatina.github.io/texts/browsable/hyginus/24pr/	24pr.3	24pr.3.21_0	,		ls.null
https://lingualatina.github.io/texts/browsable/hyginus/24pr/	24pr.3	24pr.3.23	uetulum		ls.null
https://lingualatina.github.io/texts/browsable/hyginus/24pr/	24pr.3	24pr.3.24	in	uninflected preposition	ls.n22111:in1
https://lingualatina.github.io/texts/browsable/hyginus/24pr/	24pr.3	24pr.3.26	coniecit	finite verb: third singular perfect indicative active	ls.n10309:conicio
https://lingualatina.github.io/texts/browsable/hyginus/24pr/	24pr.3	24pr.3.26_0	,		ls.null
https://lingualatina.github.io/texts/browsable/hyginus/24pr/	24pr.3	24pr.3.27	unde	adverb: positive degree	ls.n49762:unde
https://lingualatina.github.io/texts/browsable/hyginus/24pr/	24pr.3	24pr.3.28	agnus		ls.null
https://lingualatina.github.io/texts/browsable/hyginus/24pr/	24pr.3	24pr.3.29	pulcherrimus	adjective: masculine nominative singular superlative	ls.n39482:pulcher1
https://lingualatina.github.io/texts/browsable/hyginus/24pr/	24pr.3	24pr.3.30	prosiluisse		ls.null
https://lingualatina.github.io/texts/browsable/hyginus/24pr/	24pr.3	24pr.3.31	uisus	participle: perfect passive masculine nominative singular	ls.n50883:video
https://lingualatina.github.io/texts/browsable/hyginus/24pr/	24pr.3	24pr.3.31	uisus	participle: perfect passive masculine nominative singular	ls.n50883:video
https://lingualatina.github.io/texts/browsable/hyginus/24pr/	24pr.3	24pr.3.32	est	finite verb: third singular present indicative active	ls.n46529:sum1
https://lingualatina.github.io/texts/browsable/hyginus/24pr/	24pr.3	24pr.3.32_0	.		ls.null