url	passage	tokenid	token	form	lexeme
https://lingualatina.github.io/texts/browsable/hyginus/255_237/	255_237.2	255_237.2.0	Danaides		ls.null
https://lingualatina.github.io/texts/browsable/hyginus/255_237/	255_237.2	255_237.2.1	coniuges	noun: masculine nominative plural	ls.n10361:conjunx
https://lingualatina.github.io/texts/browsable/hyginus/255_237/	255_237.2	255_237.2.1	coniuges	noun: masculine accusative plural	ls.n10361:conjunx
https://lingualatina.github.io/texts/browsable/hyginus/255_237/	255_237.2	255_237.2.1	coniuges	noun: masculine vocative plural	ls.n10361:conjunx
https://lingualatina.github.io/texts/browsable/hyginus/255_237/	255_237.2	255_237.2.1	coniuges	noun: feminine nominative plural	ls.n10361:conjunx
https://lingualatina.github.io/texts/browsable/hyginus/255_237/	255_237.2	255_237.2.1	coniuges	noun: feminine accusative plural	ls.n10361:conjunx
https://lingualatina.github.io/texts/browsable/hyginus/255_237/	255_237.2	255_237.2.1	coniuges	noun: feminine vocative plural	ls.n10361:conjunx
https://lingualatina.github.io/texts/browsable/hyginus/255_237/	255_237.2	255_237.2.2	suos	adjective: masculine accusative plural positive	ls.n47174:suus
https://lingualatina.github.io/texts/browsable/hyginus/255_237/	255_237.2	255_237.2.3	patrueles		ls.null
https://lingualatina.github.io/texts/browsable/hyginus/255_237/	255_237.2	255_237.2.4	occiderunt	finite verb: third plural perfect indicative active	ls.n32088:occido1
https://lingualatina.github.io/texts/browsable/hyginus/255_237/	255_237.2	255_237.2.4_0	.		ls.null
https://lingualatina.github.io/texts/browsable/hyginus/255_237/	255_237.2	255_237.2.5	Lemniades		ls.null
https://lingualatina.github.io/texts/browsable/hyginus/255_237/	255_237.2	255_237.2.6	in	uninflected preposition	ls.n22111:in1
https://lingualatina.github.io/texts/browsable/hyginus/255_237/	255_237.2	255_237.2.7	Lemno		ls.null
https://lingualatina.github.io/texts/browsable/hyginus/255_237/	255_237.2	255_237.2.8	insula	noun: feminine nominative singular	ls.n24040:insula1
https://lingualatina.github.io/texts/browsable/hyginus/255_237/	255_237.2	255_237.2.8	insula	noun: feminine ablative singular	ls.n24040:insula1
https://lingualatina.github.io/texts/browsable/hyginus/255_237/	255_237.2	255_237.2.8	insula	noun: feminine vocative singular	ls.n24040:insula1
https://lingualatina.github.io/texts/browsable/hyginus/255_237/	255_237.2	255_237.2.9	patres	noun: masculine nominative plural	ls.n34096:pater
https://lingualatina.github.io/texts/browsable/hyginus/255_237/	255_237.2	255_237.2.9	patres	noun: masculine accusative plural	ls.n34096:pater
https://lingualatina.github.io/texts/browsable/hyginus/255_237/	255_237.2	255_237.2.9	patres	noun: masculine vocative plural	ls.n34096:pater
https://lingualatina.github.io/texts/browsable/hyginus/255_237/	255_237.2	255_237.2.10	et	uninflected conjunction	ls.n16278:et
https://lingualatina.github.io/texts/browsable/hyginus/255_237/	255_237.2	255_237.2.11	filios	noun: masculine accusative plural	ls.n18185:filius
https://lingualatina.github.io/texts/browsable/hyginus/255_237/	255_237.2	255_237.2.12	occiderunt	finite verb: third plural perfect indicative active	ls.n32088:occido1
https://lingualatina.github.io/texts/browsable/hyginus/255_237/	255_237.2	255_237.2.12_0	.		ls.null
https://lingualatina.github.io/texts/browsable/hyginus/255_237/	255_237.2	255_237.2.13	Harpalyce		ls.null
https://lingualatina.github.io/texts/browsable/hyginus/255_237/	255_237.2	255_237.2.14	Clymeni		ls.null
https://lingualatina.github.io/texts/browsable/hyginus/255_237/	255_237.2	255_237.2.15	filia	noun: feminine nominative singular	ls.n18173:filia
https://lingualatina.github.io/texts/browsable/hyginus/255_237/	255_237.2	255_237.2.15	filia	noun: feminine ablative singular	ls.n18173:filia
https://lingualatina.github.io/texts/browsable/hyginus/255_237/	255_237.2	255_237.2.15	filia	noun: feminine vocative singular	ls.n18173:filia
https://lingualatina.github.io/texts/browsable/hyginus/255_237/	255_237.2	255_237.2.16	filium	noun: masculine accusative singular	ls.n18185:filius
https://lingualatina.github.io/texts/browsable/hyginus/255_237/	255_237.2	255_237.2.17	quem	pronoun: masculine accusative singular	ls.n40242:quis1
https://lingualatina.github.io/texts/browsable/hyginus/255_237/	255_237.2	255_237.2.17	quem	pronoun: feminine accusative singular	ls.n40242:quis1
https://lingualatina.github.io/texts/browsable/hyginus/255_237/	255_237.2	255_237.2.17	quem	pronoun: masculine accusative singular	ls.n40103:qui1
https://lingualatina.github.io/texts/browsable/hyginus/255_237/	255_237.2	255_237.2.18	ex	uninflected conjunction	ls.n16519:ex
https://lingualatina.github.io/texts/browsable/hyginus/255_237/	255_237.2	255_237.2.19	patris	noun: masculine genitive singular	ls.n34096:pater
https://lingualatina.github.io/texts/browsable/hyginus/255_237/	255_237.2	255_237.2.20	concubitu		ls.null
https://lingualatina.github.io/texts/browsable/hyginus/255_237/	255_237.2	255_237.2.21	pepererat	finite verb: third singular pluperfect indicative active	ls.n33879:pario2
https://lingualatina.github.io/texts/browsable/hyginus/255_237/	255_237.2	255_237.2.22	occidit	finite verb: third singular perfect indicative active	ls.n32088:occido1
https://lingualatina.github.io/texts/browsable/hyginus/255_237/	255_237.2	255_237.2.22	occidit	finite verb: third singular present indicative active	ls.n32088:occido1
https://lingualatina.github.io/texts/browsable/hyginus/255_237/	255_237.2	255_237.2.22_0	.		ls.null
https://lingualatina.github.io/texts/browsable/hyginus/255_237/	255_237.2	255_237.2.23	Tullia	adjective: feminine nominative singular positive	ls.n49387:Tullius
https://lingualatina.github.io/texts/browsable/hyginus/255_237/	255_237.2	255_237.2.23	Tullia	adjective: feminine ablative singular positive	ls.n49387:Tullius
https://lingualatina.github.io/texts/browsable/hyginus/255_237/	255_237.2	255_237.2.23	Tullia	adjective: feminine vocative singular positive	ls.n49387:Tullius
https://lingualatina.github.io/texts/browsable/hyginus/255_237/	255_237.2	255_237.2.23	Tullia	adjective: neuter nominative plural positive	ls.n49387:Tullius
https://lingualatina.github.io/texts/browsable/hyginus/255_237/	255_237.2	255_237.2.23	Tullia	adjective: neuter accusative plural positive	ls.n49387:Tullius
https://lingualatina.github.io/texts/browsable/hyginus/255_237/	255_237.2	255_237.2.23	Tullia	adjective: neuter vocative plural positive	ls.n49387:Tullius
https://lingualatina.github.io/texts/browsable/hyginus/255_237/	255_237.2	255_237.2.24	Romanorum		ls.null
https://lingualatina.github.io/texts/browsable/hyginus/255_237/	255_237.2	255_237.2.25	super	uninflected preposition	ls.n46609:super2
https://lingualatina.github.io/texts/browsable/hyginus/255_237/	255_237.2	255_237.2.25	super	adverb: positive degree	ls.n46609:super2
https://lingualatina.github.io/texts/browsable/hyginus/255_237/	255_237.2	255_237.2.26	parentis	noun: masculine accusative plural	ls.n33843:parens2
https://lingualatina.github.io/texts/browsable/hyginus/255_237/	255_237.2	255_237.2.26	parentis	noun: masculine genitive singular	ls.n33843:parens2
https://lingualatina.github.io/texts/browsable/hyginus/255_237/	255_237.2	255_237.2.26	parentis	noun: feminine accusative plural	ls.n33843:parens2
https://lingualatina.github.io/texts/browsable/hyginus/255_237/	255_237.2	255_237.2.26	parentis	noun: feminine genitive singular	ls.n33843:parens2
https://lingualatina.github.io/texts/browsable/hyginus/255_237/	255_237.2	255_237.2.26	parentis	participle: present active masculine accusative plural	ls.n33851:pareo
https://lingualatina.github.io/texts/browsable/hyginus/255_237/	255_237.2	255_237.2.26	parentis	participle: present active masculine genitive singular	ls.n33851:pareo
https://lingualatina.github.io/texts/browsable/hyginus/255_237/	255_237.2	255_237.2.26	parentis	participle: present active feminine accusative plural	ls.n33851:pareo
https://lingualatina.github.io/texts/browsable/hyginus/255_237/	255_237.2	255_237.2.26	parentis	participle: present active feminine genitive singular	ls.n33851:pareo
https://lingualatina.github.io/texts/browsable/hyginus/255_237/	255_237.2	255_237.2.26	parentis	participle: present active neuter genitive singular	ls.n33851:pareo
https://lingualatina.github.io/texts/browsable/hyginus/255_237/	255_237.2	255_237.2.27	corpus	noun: neuter nominative singular	ls.n11268:corpus
https://lingualatina.github.io/texts/browsable/hyginus/255_237/	255_237.2	255_237.2.27	corpus	noun: neuter accusative singular	ls.n11268:corpus
https://lingualatina.github.io/texts/browsable/hyginus/255_237/	255_237.2	255_237.2.27	corpus	noun: neuter vocative singular	ls.n11268:corpus
https://lingualatina.github.io/texts/browsable/hyginus/255_237/	255_237.2	255_237.2.28	currum	noun: masculine accusative singular	ls.n12032:currus
https://lingualatina.github.io/texts/browsable/hyginus/255_237/	255_237.2	255_237.2.29	duxit	finite verb: third singular perfect indicative active	ls.n14847:duco
https://lingualatina.github.io/texts/browsable/hyginus/255_237/	255_237.2	255_237.2.29_0	,		ls.null
https://lingualatina.github.io/texts/browsable/hyginus/255_237/	255_237.2	255_237.2.30	unde	adverb: positive degree	ls.n49762:unde
https://lingualatina.github.io/texts/browsable/hyginus/255_237/	255_237.2	255_237.2.32	Sceleratus	participle: perfect passive masculine nominative singular	ls.n42910:scelero
https://lingualatina.github.io/texts/browsable/hyginus/255_237/	255_237.2	255_237.2.33	est	finite verb: third singular present indicative active	ls.n46529:sum1
https://lingualatina.github.io/texts/browsable/hyginus/255_237/	255_237.2	255_237.2.34	dictus	participle: perfect passive masculine nominative singular	ls.n13804:dico2
https://lingualatina.github.io/texts/browsable/hyginus/255_237/	255_237.2	255_237.2.34	dictus	participle: perfect passive masculine nominative singular	ls.n13804:dico2
https://lingualatina.github.io/texts/browsable/hyginus/255_237/	255_237.2	255_237.2.34_0	.		ls.null