url	passage	tokenid	token	form	lexeme
https://lingualatina.github.io/texts/browsable/hyginus/270_268/	270_268.title	270_268.title.0	QUI	pronoun: masculine nominative plural	urn:cite2:tabulae:ls.v1:n40242
https://lingualatina.github.io/texts/browsable/hyginus/270_268/	270_268.title	270_268.title.0	QUI	pronoun: masculine nominative plural	urn:cite2:tabulae:ls.v1:n40103
https://lingualatina.github.io/texts/browsable/hyginus/270_268/	270_268.title	270_268.title.0	QUI	pronoun: masculine nominative singular	urn:cite2:tabulae:ls.v1:n40103
https://lingualatina.github.io/texts/browsable/hyginus/270_268/	270_268.title	270_268.title.1	FORMOSISSIMI	adjective: masculine nominative plural superlative	urn:cite2:tabulae:ls.v1:n18600
https://lingualatina.github.io/texts/browsable/hyginus/270_268/	270_268.title	270_268.title.1	FORMOSISSIMI	adjective: masculine genitive singular superlative	urn:cite2:tabulae:ls.v1:n18600
https://lingualatina.github.io/texts/browsable/hyginus/270_268/	270_268.title	270_268.title.1	FORMOSISSIMI	adjective: masculine vocative plural superlative	urn:cite2:tabulae:ls.v1:n18600
https://lingualatina.github.io/texts/browsable/hyginus/270_268/	270_268.title	270_268.title.1	FORMOSISSIMI	adjective: neuter genitive singular superlative	urn:cite2:tabulae:ls.v1:n18600
https://lingualatina.github.io/texts/browsable/hyginus/270_268/	270_268.title	270_268.title.2	FUERUNT	finite verb: third plural perfect indicative active	urn:cite2:tabulae:ls.v1:n46529
https://lingualatina.github.io/texts/browsable/hyginus/270_268/	270_268.title	270_268.title.2_0	.		urn:cite2:tabulae:ls.v1:null