url	passage	tokenid	token	form	lexeme
https://lingualatina.github.io/texts/browsable/hyginus/31pr/	31pr.3	31pr.3.0	Cygnum	noun: masculine accusative singular	urn:cite2:tabulae:ls.v1:n12114
https://lingualatina.github.io/texts/browsable/hyginus/31pr/	31pr.3	31pr.3.1	Martis	noun: masculine accusative plural	urn:cite2:tabulae:ls.v1:n28088
https://lingualatina.github.io/texts/browsable/hyginus/31pr/	31pr.3	31pr.3.1	Martis	noun: masculine genitive singular	urn:cite2:tabulae:ls.v1:n28088
https://lingualatina.github.io/texts/browsable/hyginus/31pr/	31pr.3	31pr.3.2	filium	noun: masculine accusative singular	urn:cite2:tabulae:ls.v1:n18185
https://lingualatina.github.io/texts/browsable/hyginus/31pr/	31pr.3	31pr.3.3	armis	noun: neuter dative plural	urn:cite2:tabulae:ls.v1:n3665
https://lingualatina.github.io/texts/browsable/hyginus/31pr/	31pr.3	31pr.3.3	armis	noun: neuter ablative plural	urn:cite2:tabulae:ls.v1:n3665
https://lingualatina.github.io/texts/browsable/hyginus/31pr/	31pr.3	31pr.3.4	superatum	supine: accusative	urn:cite2:tabulae:ls.v1:n46824
https://lingualatina.github.io/texts/browsable/hyginus/31pr/	31pr.3	31pr.3.4	superatum	participle: perfect passive masculine accusative singular	urn:cite2:tabulae:ls.v1:n46824
https://lingualatina.github.io/texts/browsable/hyginus/31pr/	31pr.3	31pr.3.4	superatum	participle: perfect passive neuter nominative singular	urn:cite2:tabulae:ls.v1:n46824
https://lingualatina.github.io/texts/browsable/hyginus/31pr/	31pr.3	31pr.3.4	superatum	participle: perfect passive neuter accusative singular	urn:cite2:tabulae:ls.v1:n46824
https://lingualatina.github.io/texts/browsable/hyginus/31pr/	31pr.3	31pr.3.4	superatum	participle: perfect passive neuter vocative singular	urn:cite2:tabulae:ls.v1:n46824
https://lingualatina.github.io/texts/browsable/hyginus/31pr/	31pr.3	31pr.3.5	occidit	finite verb: third singular perfect indicative active	urn:cite2:tabulae:ls.v1:n32088
https://lingualatina.github.io/texts/browsable/hyginus/31pr/	31pr.3	31pr.3.5	occidit	finite verb: third singular present indicative active	urn:cite2:tabulae:ls.v1:n32088
https://lingualatina.github.io/texts/browsable/hyginus/31pr/	31pr.3	31pr.3.5_0	.		urn:cite2:tabulae:ls.v1:null
https://lingualatina.github.io/texts/browsable/hyginus/31pr/	31pr.3	31pr.3.6	quo	pronoun: masculine ablative singular	urn:cite2:tabulae:ls.v1:n40242
https://lingualatina.github.io/texts/browsable/hyginus/31pr/	31pr.3	31pr.3.6	quo	pronoun: feminine ablative singular	urn:cite2:tabulae:ls.v1:n40242
https://lingualatina.github.io/texts/browsable/hyginus/31pr/	31pr.3	31pr.3.6	quo	pronoun: neuter ablative singular	urn:cite2:tabulae:ls.v1:n40242
https://lingualatina.github.io/texts/browsable/hyginus/31pr/	31pr.3	31pr.3.6	quo	pronoun: masculine ablative singular	urn:cite2:tabulae:ls.v1:n40103
https://lingualatina.github.io/texts/browsable/hyginus/31pr/	31pr.3	31pr.3.6	quo	pronoun: neuter ablative singular	urn:cite2:tabulae:ls.v1:n40103
https://lingualatina.github.io/texts/browsable/hyginus/31pr/	31pr.3	31pr.3.7	cum	uninflected preposition	urn:cite2:tabulae:ls.v1:n11872
https://lingualatina.github.io/texts/browsable/hyginus/31pr/	31pr.3	31pr.3.8	Mars	noun: masculine nominative singular	urn:cite2:tabulae:ls.v1:n28088
https://lingualatina.github.io/texts/browsable/hyginus/31pr/	31pr.3	31pr.3.8	Mars	noun: masculine vocative singular	urn:cite2:tabulae:ls.v1:n28088
https://lingualatina.github.io/texts/browsable/hyginus/31pr/	31pr.3	31pr.3.9	uenisset	finite verb: third singular pluperfect subjunctive active	urn:cite2:tabulae:ls.v1:n50442
https://lingualatina.github.io/texts/browsable/hyginus/31pr/	31pr.3	31pr.3.10	et	uninflected conjunction	urn:cite2:tabulae:ls.v1:n16278
https://lingualatina.github.io/texts/browsable/hyginus/31pr/	31pr.3	31pr.3.11	armis	noun: neuter dative plural	urn:cite2:tabulae:ls.v1:n3665
https://lingualatina.github.io/texts/browsable/hyginus/31pr/	31pr.3	31pr.3.11	armis	noun: neuter ablative plural	urn:cite2:tabulae:ls.v1:n3665
https://lingualatina.github.io/texts/browsable/hyginus/31pr/	31pr.3	31pr.3.12	propter	uninflected preposition	urn:cite2:tabulae:ls.v1:n38952
https://lingualatina.github.io/texts/browsable/hyginus/31pr/	31pr.3	31pr.3.12	propter	adverb: positive degree	urn:cite2:tabulae:ls.v1:n38952
https://lingualatina.github.io/texts/browsable/hyginus/31pr/	31pr.3	31pr.3.13	filium	noun: masculine accusative singular	urn:cite2:tabulae:ls.v1:n18185
https://lingualatina.github.io/texts/browsable/hyginus/31pr/	31pr.3	31pr.3.14	contendere	finite verb: third plural perfect indicative active	urn:cite2:tabulae:ls.v1:n10770
https://lingualatina.github.io/texts/browsable/hyginus/31pr/	31pr.3	31pr.3.14	contendere	finite verb: second singular present indicative passive	urn:cite2:tabulae:ls.v1:n10770
https://lingualatina.github.io/texts/browsable/hyginus/31pr/	31pr.3	31pr.3.14	contendere	finite verb: second singular future indicative passive	urn:cite2:tabulae:ls.v1:n10770
https://lingualatina.github.io/texts/browsable/hyginus/31pr/	31pr.3	31pr.3.14	contendere	finite verb: third plural perfect indicative active	urn:cite2:tabulae:ls.v1:n10770
https://lingualatina.github.io/texts/browsable/hyginus/31pr/	31pr.3	31pr.3.14	contendere	infinitive: present active	urn:cite2:tabulae:ls.v1:n10770
https://lingualatina.github.io/texts/browsable/hyginus/31pr/	31pr.3	31pr.3.15	uellet	finite verb: third singular imperfect subjunctive active	urn:cite2:tabulae:ls.v1:n51298
https://lingualatina.github.io/texts/browsable/hyginus/31pr/	31pr.3	31pr.3.16	cum	uninflected preposition	urn:cite2:tabulae:ls.v1:n11872
https://lingualatina.github.io/texts/browsable/hyginus/31pr/	31pr.3	31pr.3.17	eo	pronoun: masculine ablative singular	urn:cite2:tabulae:ls.v1:n25029
https://lingualatina.github.io/texts/browsable/hyginus/31pr/	31pr.3	31pr.3.17	eo	pronoun: neuter ablative singular	urn:cite2:tabulae:ls.v1:n25029
https://lingualatina.github.io/texts/browsable/hyginus/31pr/	31pr.3	31pr.3.17	eo	finite verb: first singular present indicative active	urn:cite2:tabulae:ls.v1:n15868
https://lingualatina.github.io/texts/browsable/hyginus/31pr/	31pr.3	31pr.3.17_0	,		urn:cite2:tabulae:ls.v1:null
https://lingualatina.github.io/texts/browsable/hyginus/31pr/	31pr.3	31pr.3.18	Iouis		urn:cite2:tabulae:ls.v1:null
https://lingualatina.github.io/texts/browsable/hyginus/31pr/	31pr.3	31pr.3.19	inter	uninflected preposition	urn:cite2:tabulae:ls.v1:n24154
https://lingualatina.github.io/texts/browsable/hyginus/31pr/	31pr.3	31pr.3.20	eos	pronoun: masculine accusative plural	urn:cite2:tabulae:ls.v1:n25029
https://lingualatina.github.io/texts/browsable/hyginus/31pr/	31pr.3	31pr.3.21	fulmen	noun: neuter nominative singular	urn:cite2:tabulae:ls.v1:n18993
https://lingualatina.github.io/texts/browsable/hyginus/31pr/	31pr.3	31pr.3.21	fulmen	noun: neuter accusative singular	urn:cite2:tabulae:ls.v1:n18993
https://lingualatina.github.io/texts/browsable/hyginus/31pr/	31pr.3	31pr.3.21	fulmen	noun: neuter vocative singular	urn:cite2:tabulae:ls.v1:n18993
https://lingualatina.github.io/texts/browsable/hyginus/31pr/	31pr.3	31pr.3.22	misit	finite verb: third singular perfect indicative active	urn:cite2:tabulae:ls.v1:n29328
https://lingualatina.github.io/texts/browsable/hyginus/31pr/	31pr.3	31pr.3.22_0	.		urn:cite2:tabulae:ls.v1:null