url	passage	tokenid	token	form	lexeme
https://lingualatina.github.io/texts/browsable/hyginus/38pr/	38pr.5	38pr.5.0	Cercyonem		ls.null
https://lingualatina.github.io/texts/browsable/hyginus/38pr/	38pr.5	38pr.5.2	filium	noun: masculine accusative singular	ls.n18185:filius
https://lingualatina.github.io/texts/browsable/hyginus/38pr/	38pr.5	38pr.5.3	armis	noun: neuter dative plural	ls.n3665:arma
https://lingualatina.github.io/texts/browsable/hyginus/38pr/	38pr.5	38pr.5.3	armis	noun: neuter ablative plural	ls.n3665:arma
https://lingualatina.github.io/texts/browsable/hyginus/38pr/	38pr.5	38pr.5.4	occidit	finite verb: third singular perfect indicative active	ls.n32088:occido1
https://lingualatina.github.io/texts/browsable/hyginus/38pr/	38pr.5	38pr.5.4	occidit	finite verb: third singular present indicative active	ls.n32088:occido1
https://lingualatina.github.io/texts/browsable/hyginus/38pr/	38pr.5	38pr.5.4_0	.		ls.null