url	passage	tokenid	token	form	lexeme
https://lingualatina.github.io/texts/browsable/hyginus/41pr/	41pr.3	41pr.3.0	quem	pronoun: masculine accusative singular	ls.n40242:quis1
https://lingualatina.github.io/texts/browsable/hyginus/41pr/	41pr.3	41pr.3.0	quem	pronoun: feminine accusative singular	ls.n40242:quis1
https://lingualatina.github.io/texts/browsable/hyginus/41pr/	41pr.3	41pr.3.0	quem	pronoun: masculine accusative singular	ls.n40103:qui1
https://lingualatina.github.io/texts/browsable/hyginus/41pr/	41pr.3	41pr.3.1	pater	noun: masculine nominative singular	ls.n34096:pater
https://lingualatina.github.io/texts/browsable/hyginus/41pr/	41pr.3	41pr.3.1	pater	noun: masculine vocative singular	ls.n34096:pater
https://lingualatina.github.io/texts/browsable/hyginus/41pr/	41pr.3	41pr.3.2	cum	uninflected preposition	ls.n11872:cum1
https://lingualatina.github.io/texts/browsable/hyginus/41pr/	41pr.3	41pr.3.3	mitteret	finite verb: third singular imperfect subjunctive active	ls.n29328:mitto
https://lingualatina.github.io/texts/browsable/hyginus/41pr/	41pr.3	41pr.3.3_0	,		ls.null
https://lingualatina.github.io/texts/browsable/hyginus/41pr/	41pr.3	41pr.3.4	praedixit	finite verb: third singular perfect indicative active	ls.n37518:praedico2
https://lingualatina.github.io/texts/browsable/hyginus/41pr/	41pr.3	41pr.3.5	ei	pronoun: masculine dative singular	ls.n25029:is
https://lingualatina.github.io/texts/browsable/hyginus/41pr/	41pr.3	41pr.3.5	ei	pronoun: feminine dative singular	ls.n25029:is
https://lingualatina.github.io/texts/browsable/hyginus/41pr/	41pr.3	41pr.3.5	ei	pronoun: neuter dative singular	ls.n25029:is
https://lingualatina.github.io/texts/browsable/hyginus/41pr/	41pr.3	41pr.3.5	ei	pronoun: masculine nominative plural	ls.n25029:is
https://lingualatina.github.io/texts/browsable/hyginus/41pr/	41pr.3	41pr.3.6	ut	uninflected conjunction	ls.n49975:ut
https://lingualatina.github.io/texts/browsable/hyginus/41pr/	41pr.3	41pr.3.7	si	participle: perfect passive masculine nominative plural	ls.do
https://lingualatina.github.io/texts/browsable/hyginus/41pr/	41pr.3	41pr.3.7	si	participle: perfect passive masculine genitive singular	ls.do
https://lingualatina.github.io/texts/browsable/hyginus/41pr/	41pr.3	41pr.3.7	si	participle: perfect passive masculine vocative plural	ls.do
https://lingualatina.github.io/texts/browsable/hyginus/41pr/	41pr.3	41pr.3.7	si	participle: perfect passive neuter genitive singular	ls.do
https://lingualatina.github.io/texts/browsable/hyginus/41pr/	41pr.3	41pr.3.7	si	uninflected conjunction	ls.n44096:si
https://lingualatina.github.io/texts/browsable/hyginus/41pr/	41pr.3	41pr.3.8	uictor	noun: masculine nominative singular	ls.n50865:victor1
https://lingualatina.github.io/texts/browsable/hyginus/41pr/	41pr.3	41pr.3.8	uictor	noun: masculine vocative singular	ls.n50865:victor1
https://lingualatina.github.io/texts/browsable/hyginus/41pr/	41pr.3	41pr.3.9	reuerteretur	finite verb: third singular imperfect subjunctive passive	ls.n41583:reverto
https://lingualatina.github.io/texts/browsable/hyginus/41pr/	41pr.3	41pr.3.10	uela	noun: neuter nominative plural	ls.n50376:velum
https://lingualatina.github.io/texts/browsable/hyginus/41pr/	41pr.3	41pr.3.10	uela	noun: neuter accusative plural	ls.n50376:velum
https://lingualatina.github.io/texts/browsable/hyginus/41pr/	41pr.3	41pr.3.10	uela	noun: neuter vocative plural	ls.n50376:velum
https://lingualatina.github.io/texts/browsable/hyginus/41pr/	41pr.3	41pr.3.11	candida	adjective: feminine nominative singular positive	ls.n6480:candidus
https://lingualatina.github.io/texts/browsable/hyginus/41pr/	41pr.3	41pr.3.11	candida	adjective: feminine ablative singular positive	ls.n6480:candidus
https://lingualatina.github.io/texts/browsable/hyginus/41pr/	41pr.3	41pr.3.11	candida	adjective: feminine vocative singular positive	ls.n6480:candidus
https://lingualatina.github.io/texts/browsable/hyginus/41pr/	41pr.3	41pr.3.11	candida	adjective: neuter nominative plural positive	ls.n6480:candidus
https://lingualatina.github.io/texts/browsable/hyginus/41pr/	41pr.3	41pr.3.11	candida	adjective: neuter accusative plural positive	ls.n6480:candidus
https://lingualatina.github.io/texts/browsable/hyginus/41pr/	41pr.3	41pr.3.11	candida	adjective: neuter vocative plural positive	ls.n6480:candidus
https://lingualatina.github.io/texts/browsable/hyginus/41pr/	41pr.3	41pr.3.12	in	uninflected preposition	ls.n22111:in1
https://lingualatina.github.io/texts/browsable/hyginus/41pr/	41pr.3	41pr.3.13	nauem	noun: feminine accusative singular	ls.n30568:navis
https://lingualatina.github.io/texts/browsable/hyginus/41pr/	41pr.3	41pr.3.14	haberet	finite verb: third singular imperfect subjunctive active	ls.n20077:habeo
https://lingualatina.github.io/texts/browsable/hyginus/41pr/	41pr.3	41pr.3.14_0	;		ls.null
https://lingualatina.github.io/texts/browsable/hyginus/41pr/	41pr.3	41pr.3.15	qui	pronoun: masculine nominative plural	ls.n40242:quis1
https://lingualatina.github.io/texts/browsable/hyginus/41pr/	41pr.3	41pr.3.15	qui	pronoun: masculine nominative plural	ls.n40103:qui1
https://lingualatina.github.io/texts/browsable/hyginus/41pr/	41pr.3	41pr.3.15	qui	pronoun: masculine nominative singular	ls.n40103:qui1
https://lingualatina.github.io/texts/browsable/hyginus/41pr/	41pr.3	41pr.3.16	autem	uninflected conjunction	ls.n4633:autem
https://lingualatina.github.io/texts/browsable/hyginus/41pr/	41pr.3	41pr.3.17	ad	uninflected preposition	ls.n665:ad
https://lingualatina.github.io/texts/browsable/hyginus/41pr/	41pr.3	41pr.3.18	Minotaurum		ls.null
https://lingualatina.github.io/texts/browsable/hyginus/41pr/	41pr.3	41pr.3.19	mittebantur	finite verb: third plural imperfect indicative passive	ls.n29328:mitto
https://lingualatina.github.io/texts/browsable/hyginus/41pr/	41pr.3	41pr.3.20	uelis	noun: neuter dative plural	ls.n50376:velum
https://lingualatina.github.io/texts/browsable/hyginus/41pr/	41pr.3	41pr.3.20	uelis	noun: neuter ablative plural	ls.n50376:velum
https://lingualatina.github.io/texts/browsable/hyginus/41pr/	41pr.3	41pr.3.20	uelis	finite verb: second singular present subjunctive active	ls.n51298:volo1
https://lingualatina.github.io/texts/browsable/hyginus/41pr/	41pr.3	41pr.3.21	atris		ls.null
https://lingualatina.github.io/texts/browsable/hyginus/41pr/	41pr.3	41pr.3.22	nauigabant		ls.null
https://lingualatina.github.io/texts/browsable/hyginus/41pr/	41pr.3	41pr.3.22_0	.		ls.null