url	passage	tokenid	token	form	lexeme
https://lingualatina.github.io/texts/browsable/hyginus/60pr/	60pr.2	60pr.2.0	quod	uninflected conjunction	ls.n40262:quod1
https://lingualatina.github.io/texts/browsable/hyginus/60pr/	60pr.2	60pr.2.0	quod	pronoun: neuter accusative singular	ls.n40103:qui1
https://lingualatina.github.io/texts/browsable/hyginus/60pr/	60pr.2	60pr.2.0	quod	pronoun: neuter nominative singular	ls.n40103:qui1
https://lingualatina.github.io/texts/browsable/hyginus/60pr/	60pr.2	60pr.2.1	cum	uninflected preposition	ls.n11872:cum1
https://lingualatina.github.io/texts/browsable/hyginus/60pr/	60pr.2	60pr.2.2	Sisyphus		ls.null
https://lingualatina.github.io/texts/browsable/hyginus/60pr/	60pr.2	60pr.2.3	fecisset	finite verb: third singular pluperfect subjunctive active	ls.ficio
https://lingualatina.github.io/texts/browsable/hyginus/60pr/	60pr.2	60pr.2.3	fecisset	finite verb: third singular pluperfect subjunctive active	ls.n17516:facio
https://lingualatina.github.io/texts/browsable/hyginus/60pr/	60pr.2	60pr.2.3_0	,		ls.null
https://lingualatina.github.io/texts/browsable/hyginus/60pr/	60pr.2	60pr.2.4	duo	adjective: masculine vocative plural positive	ls.n14914:duo
https://lingualatina.github.io/texts/browsable/hyginus/60pr/	60pr.2	60pr.2.4	duo	adjective: neuter nominative plural positive	ls.n14914:duo
https://lingualatina.github.io/texts/browsable/hyginus/60pr/	60pr.2	60pr.2.4	duo	adjective: neuter accusative plural positive	ls.n14914:duo
https://lingualatina.github.io/texts/browsable/hyginus/60pr/	60pr.2	60pr.2.4	duo	adjective: neuter vocative plural positive	ls.n14914:duo
https://lingualatina.github.io/texts/browsable/hyginus/60pr/	60pr.2	60pr.2.4	duo	adjective: masculine nominative plural positive	ls.n14914:duo
https://lingualatina.github.io/texts/browsable/hyginus/60pr/	60pr.2	60pr.2.5	sunt	finite verb: third plural present indicative active	ls.n46529:sum1
https://lingualatina.github.io/texts/browsable/hyginus/60pr/	60pr.2	60pr.2.6	filii	noun: masculine nominative plural	ls.n18185:filius
https://lingualatina.github.io/texts/browsable/hyginus/60pr/	60pr.2	60pr.2.6	filii	noun: masculine genitive singular	ls.n18185:filius
https://lingualatina.github.io/texts/browsable/hyginus/60pr/	60pr.2	60pr.2.6	filii	noun: masculine vocative plural	ls.n18185:filius
https://lingualatina.github.io/texts/browsable/hyginus/60pr/	60pr.2	60pr.2.7	nati	participle: perfect passive masculine nominative plural	ls.n30423:nascor
https://lingualatina.github.io/texts/browsable/hyginus/60pr/	60pr.2	60pr.2.7	nati	participle: perfect passive masculine genitive singular	ls.n30423:nascor
https://lingualatina.github.io/texts/browsable/hyginus/60pr/	60pr.2	60pr.2.7	nati	participle: perfect passive masculine vocative plural	ls.n30423:nascor
https://lingualatina.github.io/texts/browsable/hyginus/60pr/	60pr.2	60pr.2.7	nati	participle: perfect passive neuter genitive singular	ls.n30423:nascor
https://lingualatina.github.io/texts/browsable/hyginus/60pr/	60pr.2	60pr.2.7_0	,		ls.null
https://lingualatina.github.io/texts/browsable/hyginus/60pr/	60pr.2	60pr.2.8	quos	pronoun: masculine accusative plural	ls.n40242:quis1
https://lingualatina.github.io/texts/browsable/hyginus/60pr/	60pr.2	60pr.2.8	quos	pronoun: masculine accusative plural	ls.n40103:qui1
https://lingualatina.github.io/texts/browsable/hyginus/60pr/	60pr.2	60pr.2.9	Tyro		ls.null
https://lingualatina.github.io/texts/browsable/hyginus/60pr/	60pr.2	60pr.2.10	mater	noun: feminine nominative singular	ls.n28181:mater
https://lingualatina.github.io/texts/browsable/hyginus/60pr/	60pr.2	60pr.2.10	mater	noun: feminine vocative singular	ls.n28181:mater
https://lingualatina.github.io/texts/browsable/hyginus/60pr/	60pr.2	60pr.2.11	eorum	pronoun: masculine genitive plural	ls.n25029:is
https://lingualatina.github.io/texts/browsable/hyginus/60pr/	60pr.2	60pr.2.11	eorum	pronoun: neuter genitive plural	ls.n25029:is
https://lingualatina.github.io/texts/browsable/hyginus/60pr/	60pr.2	60pr.2.12	sorte	noun: feminine ablative singular	ls.n44805:sors
https://lingualatina.github.io/texts/browsable/hyginus/60pr/	60pr.2	60pr.2.13	audita	participle: perfect passive feminine nominative singular	ls.n4453:audio
https://lingualatina.github.io/texts/browsable/hyginus/60pr/	60pr.2	60pr.2.13	audita	participle: perfect passive feminine ablative singular	ls.n4453:audio
https://lingualatina.github.io/texts/browsable/hyginus/60pr/	60pr.2	60pr.2.13	audita	participle: perfect passive feminine vocative singular	ls.n4453:audio
https://lingualatina.github.io/texts/browsable/hyginus/60pr/	60pr.2	60pr.2.13	audita	participle: perfect passive neuter nominative plural	ls.n4453:audio
https://lingualatina.github.io/texts/browsable/hyginus/60pr/	60pr.2	60pr.2.13	audita	participle: perfect passive neuter accusative plural	ls.n4453:audio
https://lingualatina.github.io/texts/browsable/hyginus/60pr/	60pr.2	60pr.2.13	audita	participle: perfect passive neuter vocative plural	ls.n4453:audio
https://lingualatina.github.io/texts/browsable/hyginus/60pr/	60pr.2	60pr.2.14	necauit	finite verb: third singular perfect indicative active	ls.n30624:neco
https://lingualatina.github.io/texts/browsable/hyginus/60pr/	60pr.2	60pr.2.14_0	.		ls.null
https://lingualatina.github.io/texts/browsable/hyginus/60pr/	60pr.2	60pr.2.15	at	uninflected conjunction	ls.n4220:at
https://lingualatina.github.io/texts/browsable/hyginus/60pr/	60pr.2	60pr.2.16	Sisyphus		ls.null
https://lingualatina.github.io/texts/browsable/hyginus/60pr/	60pr.2	60pr.2.17	ut	uninflected conjunction	ls.n49975:ut
https://lingualatina.github.io/texts/browsable/hyginus/60pr/	60pr.2	60pr.2.18	resciit	finite verb: third singular perfect indicative active	ls.n41305:rescisco