url	passage	tokenid	token	form	lexeme
https://lingualatina.github.io/texts/browsable/hyginus/64pr/	64pr.4	64pr.4.0	Polydectes		urn:cite2:tabulae:ls.v1:null
https://lingualatina.github.io/texts/browsable/hyginus/64pr/	64pr.4	64pr.4.1	siue	uninflected conjunction	urn:cite2:tabulae:ls.v1:n44517
https://lingualatina.github.io/texts/browsable/hyginus/64pr/	64pr.4	64pr.4.2	Proetus		urn:cite2:tabulae:ls.v1:null
https://lingualatina.github.io/texts/browsable/hyginus/64pr/	64pr.4	64pr.4.3	ut	uninflected conjunction	urn:cite2:tabulae:ls.v1:n49975
https://lingualatina.github.io/texts/browsable/hyginus/64pr/	64pr.4	64pr.4.4	uidit	finite verb: third singular perfect indicative active	urn:cite2:tabulae:ls.v1:n50883
https://lingualatina.github.io/texts/browsable/hyginus/64pr/	64pr.4	64pr.4.4	uidit	finite verb: third singular perfect indicative active	urn:cite2:tabulae:ls.v1:n50883
https://lingualatina.github.io/texts/browsable/hyginus/64pr/	64pr.4	64pr.4.5	Perseum		urn:cite2:tabulae:ls.v1:null
https://lingualatina.github.io/texts/browsable/hyginus/64pr/	64pr.4	64pr.4.6	tantam	adjective: feminine accusative singular positive	urn:cite2:tabulae:ls.v1:n47473
https://lingualatina.github.io/texts/browsable/hyginus/64pr/	64pr.4	64pr.4.7	uirtutem		urn:cite2:tabulae:ls.v1:null
https://lingualatina.github.io/texts/browsable/hyginus/64pr/	64pr.4	64pr.4.8	habere	finite verb: second singular present indicative passive	urn:cite2:tabulae:ls.v1:n20077
https://lingualatina.github.io/texts/browsable/hyginus/64pr/	64pr.4	64pr.4.8	habere	finite verb: second singular present imperative passive	urn:cite2:tabulae:ls.v1:n20077
https://lingualatina.github.io/texts/browsable/hyginus/64pr/	64pr.4	64pr.4.8	habere	infinitive: present active	urn:cite2:tabulae:ls.v1:n20077
https://lingualatina.github.io/texts/browsable/hyginus/64pr/	64pr.4	64pr.4.8_0	,		urn:cite2:tabulae:ls.v1:null
https://lingualatina.github.io/texts/browsable/hyginus/64pr/	64pr.4	64pr.4.9	pertimuit		urn:cite2:tabulae:ls.v1:null
https://lingualatina.github.io/texts/browsable/hyginus/64pr/	64pr.4	64pr.4.11	per	uninflected preposition	urn:cite2:tabulae:ls.v1:n34595
https://lingualatina.github.io/texts/browsable/hyginus/64pr/	64pr.4	64pr.4.12	dolum	noun: masculine accusative singular	urn:cite2:tabulae:ls.v1:n14674
https://lingualatina.github.io/texts/browsable/hyginus/64pr/	64pr.4	64pr.4.13	interficere	finite verb: second singular present indicative passive	urn:cite2:tabulae:ls.v1:n24257
https://lingualatina.github.io/texts/browsable/hyginus/64pr/	64pr.4	64pr.4.13	interficere	infinitive: present active	urn:cite2:tabulae:ls.v1:n24257
https://lingualatina.github.io/texts/browsable/hyginus/64pr/	64pr.4	64pr.4.14	uoluit	finite verb: third singular perfect indicative active	urn:cite2:tabulae:ls.v1:n51298
https://lingualatina.github.io/texts/browsable/hyginus/64pr/	64pr.4	64pr.4.14_0	;		urn:cite2:tabulae:ls.v1:null
https://lingualatina.github.io/texts/browsable/hyginus/64pr/	64pr.4	64pr.4.15	qua	pronoun: feminine ablative singular	urn:cite2:tabulae:ls.v1:n40103
https://lingualatina.github.io/texts/browsable/hyginus/64pr/	64pr.4	64pr.4.16	re	noun: feminine genitive singular	urn:cite2:tabulae:ls.v1:n41293
https://lingualatina.github.io/texts/browsable/hyginus/64pr/	64pr.4	64pr.4.16	re	noun: feminine dative singular	urn:cite2:tabulae:ls.v1:n41293
https://lingualatina.github.io/texts/browsable/hyginus/64pr/	64pr.4	64pr.4.16	re	noun: feminine ablative singular	urn:cite2:tabulae:ls.v1:n41293
https://lingualatina.github.io/texts/browsable/hyginus/64pr/	64pr.4	64pr.4.17	cognita	participle: perfect passive feminine nominative singular	urn:cite2:tabulae:ls.v1:n8938
https://lingualatina.github.io/texts/browsable/hyginus/64pr/	64pr.4	64pr.4.17	cognita	participle: perfect passive feminine ablative singular	urn:cite2:tabulae:ls.v1:n8938
https://lingualatina.github.io/texts/browsable/hyginus/64pr/	64pr.4	64pr.4.17	cognita	participle: perfect passive feminine vocative singular	urn:cite2:tabulae:ls.v1:n8938
https://lingualatina.github.io/texts/browsable/hyginus/64pr/	64pr.4	64pr.4.17	cognita	participle: perfect passive neuter nominative plural	urn:cite2:tabulae:ls.v1:n8938
https://lingualatina.github.io/texts/browsable/hyginus/64pr/	64pr.4	64pr.4.17	cognita	participle: perfect passive neuter accusative plural	urn:cite2:tabulae:ls.v1:n8938
https://lingualatina.github.io/texts/browsable/hyginus/64pr/	64pr.4	64pr.4.17	cognita	participle: perfect passive neuter vocative plural	urn:cite2:tabulae:ls.v1:n8938
https://lingualatina.github.io/texts/browsable/hyginus/64pr/	64pr.4	64pr.4.18	Perseus		urn:cite2:tabulae:ls.v1:null
https://lingualatina.github.io/texts/browsable/hyginus/64pr/	64pr.4	64pr.4.19	caput	noun: neuter nominative singular	urn:cite2:tabulae:ls.v1:n6724
https://lingualatina.github.io/texts/browsable/hyginus/64pr/	64pr.4	64pr.4.19	caput	noun: neuter accusative singular	urn:cite2:tabulae:ls.v1:n6724
https://lingualatina.github.io/texts/browsable/hyginus/64pr/	64pr.4	64pr.4.19	caput	noun: neuter vocative singular	urn:cite2:tabulae:ls.v1:n6724
https://lingualatina.github.io/texts/browsable/hyginus/64pr/	64pr.4	64pr.4.20	Gorgonis		urn:cite2:tabulae:ls.v1:null
https://lingualatina.github.io/texts/browsable/hyginus/64pr/	64pr.4	64pr.4.21	ei	pronoun: masculine dative singular	urn:cite2:tabulae:ls.v1:n25029
https://lingualatina.github.io/texts/browsable/hyginus/64pr/	64pr.4	64pr.4.21	ei	pronoun: feminine dative singular	urn:cite2:tabulae:ls.v1:n25029
https://lingualatina.github.io/texts/browsable/hyginus/64pr/	64pr.4	64pr.4.21	ei	pronoun: neuter dative singular	urn:cite2:tabulae:ls.v1:n25029
https://lingualatina.github.io/texts/browsable/hyginus/64pr/	64pr.4	64pr.4.21	ei	pronoun: masculine nominative plural	urn:cite2:tabulae:ls.v1:n25029
https://lingualatina.github.io/texts/browsable/hyginus/64pr/	64pr.4	64pr.4.22	ostendit	finite verb: third singular perfect indicative active	urn:cite2:tabulae:ls.v1:n33147
https://lingualatina.github.io/texts/browsable/hyginus/64pr/	64pr.4	64pr.4.22	ostendit	finite verb: third singular present indicative active	urn:cite2:tabulae:ls.v1:n33147
https://lingualatina.github.io/texts/browsable/hyginus/64pr/	64pr.4	64pr.4.23	et	uninflected conjunction	urn:cite2:tabulae:ls.v1:n16278
https://lingualatina.github.io/texts/browsable/hyginus/64pr/	64pr.4	64pr.4.24	is	pronoun: masculine dative plural	urn:cite2:tabulae:ls.v1:n25029
https://lingualatina.github.io/texts/browsable/hyginus/64pr/	64pr.4	64pr.4.24	is	pronoun: feminine dative plural	urn:cite2:tabulae:ls.v1:n25029
https://lingualatina.github.io/texts/browsable/hyginus/64pr/	64pr.4	64pr.4.24	is	pronoun: feminine ablative plural	urn:cite2:tabulae:ls.v1:n25029
https://lingualatina.github.io/texts/browsable/hyginus/64pr/	64pr.4	64pr.4.24	is	pronoun: neuter dative plural	urn:cite2:tabulae:ls.v1:n25029
https://lingualatina.github.io/texts/browsable/hyginus/64pr/	64pr.4	64pr.4.24	is	pronoun: neuter ablative plural	urn:cite2:tabulae:ls.v1:n25029
https://lingualatina.github.io/texts/browsable/hyginus/64pr/	64pr.4	64pr.4.24	is	pronoun: masculine nominative singular	urn:cite2:tabulae:ls.v1:n25029
https://lingualatina.github.io/texts/browsable/hyginus/64pr/	64pr.4	64pr.4.24	is	pronoun: masculine ablative plural	urn:cite2:tabulae:ls.v1:n25029
https://lingualatina.github.io/texts/browsable/hyginus/64pr/	64pr.4	64pr.4.24	is	finite verb: second singular present indicative active	urn:cite2:tabulae:ls.v1:n15868
https://lingualatina.github.io/texts/browsable/hyginus/64pr/	64pr.4	64pr.4.25	ab	uninflected preposition	urn:cite2:tabulae:ls.v1:n4
https://lingualatina.github.io/texts/browsable/hyginus/64pr/	64pr.4	64pr.4.26	humana	adjective: feminine nominative singular positive	urn:cite2:tabulae:ls.v1:n21043
https://lingualatina.github.io/texts/browsable/hyginus/64pr/	64pr.4	64pr.4.26	humana	adjective: feminine ablative singular positive	urn:cite2:tabulae:ls.v1:n21043
https://lingualatina.github.io/texts/browsable/hyginus/64pr/	64pr.4	64pr.4.26	humana	adjective: feminine vocative singular positive	urn:cite2:tabulae:ls.v1:n21043
https://lingualatina.github.io/texts/browsable/hyginus/64pr/	64pr.4	64pr.4.26	humana	adjective: neuter nominative plural positive	urn:cite2:tabulae:ls.v1:n21043
https://lingualatina.github.io/texts/browsable/hyginus/64pr/	64pr.4	64pr.4.26	humana	adjective: neuter accusative plural positive	urn:cite2:tabulae:ls.v1:n21043
https://lingualatina.github.io/texts/browsable/hyginus/64pr/	64pr.4	64pr.4.26	humana	adjective: neuter vocative plural positive	urn:cite2:tabulae:ls.v1:n21043
https://lingualatina.github.io/texts/browsable/hyginus/64pr/	64pr.4	64pr.4.27	specie	noun: feminine genitive singular	urn:cite2:tabulae:ls.v1:n44913
https://lingualatina.github.io/texts/browsable/hyginus/64pr/	64pr.4	64pr.4.27	specie	noun: feminine dative singular	urn:cite2:tabulae:ls.v1:n44913
https://lingualatina.github.io/texts/browsable/hyginus/64pr/	64pr.4	64pr.4.27	specie	noun: feminine ablative singular	urn:cite2:tabulae:ls.v1:n44913
https://lingualatina.github.io/texts/browsable/hyginus/64pr/	64pr.4	64pr.4.28	est	finite verb: third singular present indicative active	urn:cite2:tabulae:ls.v1:n46529
https://lingualatina.github.io/texts/browsable/hyginus/64pr/	64pr.4	64pr.4.29	immutatus		urn:cite2:tabulae:ls.v1:null
https://lingualatina.github.io/texts/browsable/hyginus/64pr/	64pr.4	64pr.4.30	in	uninflected preposition	urn:cite2:tabulae:ls.v1:n22111
https://lingualatina.github.io/texts/browsable/hyginus/64pr/	64pr.4	64pr.4.31	lapidem	noun: feminine accusative singular	urn:cite2:tabulae:ls.v1:n25849
https://lingualatina.github.io/texts/browsable/hyginus/64pr/	64pr.4	64pr.4.31_0	.		urn:cite2:tabulae:ls.v1:null