url	passage	tokenid	token	form	lexeme
https://lingualatina.github.io/texts/browsable/hyginus/70a/	70a.2	70a.2.0	hi	pronoun: masculine nominative plural	ls.n20640:hic
https://lingualatina.github.io/texts/browsable/hyginus/70a/	70a.2	70a.2.1	omnes	adjective: masculine nominative plural positive	ls.n32583:omnis
https://lingualatina.github.io/texts/browsable/hyginus/70a/	70a.2	70a.2.1	omnes	adjective: masculine accusative plural positive	ls.n32583:omnis
https://lingualatina.github.io/texts/browsable/hyginus/70a/	70a.2	70a.2.1	omnes	adjective: masculine vocative plural positive	ls.n32583:omnis
https://lingualatina.github.io/texts/browsable/hyginus/70a/	70a.2	70a.2.1	omnes	adjective: feminine nominative plural positive	ls.n32583:omnis
https://lingualatina.github.io/texts/browsable/hyginus/70a/	70a.2	70a.2.1	omnes	adjective: feminine accusative plural positive	ls.n32583:omnis
https://lingualatina.github.io/texts/browsable/hyginus/70a/	70a.2	70a.2.1	omnes	adjective: feminine vocative plural positive	ls.n32583:omnis
https://lingualatina.github.io/texts/browsable/hyginus/70a/	70a.2	70a.2.2	duces	noun: masculine nominative plural	ls.n15002:dux
https://lingualatina.github.io/texts/browsable/hyginus/70a/	70a.2	70a.2.2	duces	noun: masculine accusative plural	ls.n15002:dux
https://lingualatina.github.io/texts/browsable/hyginus/70a/	70a.2	70a.2.2	duces	noun: masculine vocative plural	ls.n15002:dux
https://lingualatina.github.io/texts/browsable/hyginus/70a/	70a.2	70a.2.2	duces	finite verb: second singular future indicative active	ls.n14847:duco
https://lingualatina.github.io/texts/browsable/hyginus/70a/	70a.2	70a.2.3	apud	uninflected preposition	ls.n3250:apud
https://lingualatina.github.io/texts/browsable/hyginus/70a/	70a.2	70a.2.4	Thebas		ls.null
https://lingualatina.github.io/texts/browsable/hyginus/70a/	70a.2	70a.2.5	perierunt	finite verb: third plural perfect indicative active	ls.n34869:pereo
https://lingualatina.github.io/texts/browsable/hyginus/70a/	70a.2	70a.2.6	praeter	uninflected preposition	ls.n38069:praeter
https://lingualatina.github.io/texts/browsable/hyginus/70a/	70a.2	70a.2.6	praeter	adverb: positive degree	ls.n38069:praeter
https://lingualatina.github.io/texts/browsable/hyginus/70a/	70a.2	70a.2.7	Adrastum		ls.null
https://lingualatina.github.io/texts/browsable/hyginus/70a/	70a.2	70a.2.8	Talai		ls.null
https://lingualatina.github.io/texts/browsable/hyginus/70a/	70a.2	70a.2.9	filium	noun: masculine accusative singular	ls.n18185:filius
https://lingualatina.github.io/texts/browsable/hyginus/70a/	70a.2	70a.2.9_0	,		ls.null
https://lingualatina.github.io/texts/browsable/hyginus/70a/	70a.2	70a.2.10	is	pronoun: masculine dative plural	ls.n25029:is
https://lingualatina.github.io/texts/browsable/hyginus/70a/	70a.2	70a.2.10	is	pronoun: feminine dative plural	ls.n25029:is
https://lingualatina.github.io/texts/browsable/hyginus/70a/	70a.2	70a.2.10	is	pronoun: feminine ablative plural	ls.n25029:is
https://lingualatina.github.io/texts/browsable/hyginus/70a/	70a.2	70a.2.10	is	pronoun: neuter dative plural	ls.n25029:is
https://lingualatina.github.io/texts/browsable/hyginus/70a/	70a.2	70a.2.10	is	pronoun: neuter ablative plural	ls.n25029:is
https://lingualatina.github.io/texts/browsable/hyginus/70a/	70a.2	70a.2.10	is	pronoun: masculine nominative singular	ls.n25029:is
https://lingualatina.github.io/texts/browsable/hyginus/70a/	70a.2	70a.2.10	is	pronoun: masculine ablative plural	ls.n25029:is
https://lingualatina.github.io/texts/browsable/hyginus/70a/	70a.2	70a.2.10	is	finite verb: second singular present indicative active	ls.n15868:eo1
https://lingualatina.github.io/texts/browsable/hyginus/70a/	70a.2	70a.2.11	enim	uninflected conjunction	ls.n15790:enim
https://lingualatina.github.io/texts/browsable/hyginus/70a/	70a.2	70a.2.12	equi	noun: masculine nominative plural	ls.n16074:equus
https://lingualatina.github.io/texts/browsable/hyginus/70a/	70a.2	70a.2.12	equi	noun: masculine genitive singular	ls.n16074:equus
https://lingualatina.github.io/texts/browsable/hyginus/70a/	70a.2	70a.2.12	equi	noun: masculine vocative plural	ls.n16074:equus
https://lingualatina.github.io/texts/browsable/hyginus/70a/	70a.2	70a.2.13	beneficio	noun: neuter dative singular	ls.n5180:beneficium
https://lingualatina.github.io/texts/browsable/hyginus/70a/	70a.2	70a.2.13	beneficio	noun: neuter ablative singular	ls.n5180:beneficium
https://lingualatina.github.io/texts/browsable/hyginus/70a/	70a.2	70a.2.14	ereptus	participle: perfect passive masculine nominative singular	ls.n16146:eripio
https://lingualatina.github.io/texts/browsable/hyginus/70a/	70a.2	70a.2.15	est	finite verb: third singular present indicative active	ls.n46529:sum1
https://lingualatina.github.io/texts/browsable/hyginus/70a/	70a.2	70a.2.15_0	;		ls.null
https://lingualatina.github.io/texts/browsable/hyginus/70a/	70a.2	70a.2.16	qui	pronoun: masculine nominative plural	ls.n40242:quis1
https://lingualatina.github.io/texts/browsable/hyginus/70a/	70a.2	70a.2.16	qui	pronoun: masculine nominative plural	ls.n40103:qui1
https://lingualatina.github.io/texts/browsable/hyginus/70a/	70a.2	70a.2.16	qui	pronoun: masculine nominative singular	ls.n40103:qui1
https://lingualatina.github.io/texts/browsable/hyginus/70a/	70a.2	70a.2.17	postea	adverb: positive degree	ls.n37196:postea
https://lingualatina.github.io/texts/browsable/hyginus/70a/	70a.2	70a.2.18	filios	noun: masculine accusative plural	ls.n18185:filius
https://lingualatina.github.io/texts/browsable/hyginus/70a/	70a.2	70a.2.19	eorum	pronoun: masculine genitive plural	ls.n25029:is
https://lingualatina.github.io/texts/browsable/hyginus/70a/	70a.2	70a.2.19	eorum	pronoun: neuter genitive plural	ls.n25029:is
https://lingualatina.github.io/texts/browsable/hyginus/70a/	70a.2	70a.2.20	armatos	participle: perfect passive masculine accusative plural	ls.n3697:armo
https://lingualatina.github.io/texts/browsable/hyginus/70a/	70a.2	70a.2.21	ad	uninflected preposition	ls.n665:ad
https://lingualatina.github.io/texts/browsable/hyginus/70a/	70a.2	70a.2.22	Thebas		ls.null
https://lingualatina.github.io/texts/browsable/hyginus/70a/	70a.2	70a.2.23	expugnandas	gerundive: feminine accusative plural	ls.n17132:expugno
https://lingualatina.github.io/texts/browsable/hyginus/70a/	70a.2	70a.2.24	misit	finite verb: third singular perfect indicative active	ls.n29328:mitto
https://lingualatina.github.io/texts/browsable/hyginus/70a/	70a.2	70a.2.25	ut	uninflected conjunction	ls.n49975:ut
https://lingualatina.github.io/texts/browsable/hyginus/70a/	70a.2	70a.2.26	iniurias	noun: feminine accusative plural	ls.n23517:injuria
https://lingualatina.github.io/texts/browsable/hyginus/70a/	70a.2	70a.2.27	paternas	adjective: feminine accusative plural positive	ls.n34101:paternus
https://lingualatina.github.io/texts/browsable/hyginus/70a/	70a.2	70a.2.28	uindicarent	finite verb: third plural imperfect subjunctive active	ls.n50990:vindico
https://lingualatina.github.io/texts/browsable/hyginus/70a/	70a.2	70a.2.28_0	,		ls.null
https://lingualatina.github.io/texts/browsable/hyginus/70a/	70a.2	70a.2.29	eo	pronoun: masculine ablative singular	ls.n25029:is
https://lingualatina.github.io/texts/browsable/hyginus/70a/	70a.2	70a.2.29	eo	pronoun: neuter ablative singular	ls.n25029:is
https://lingualatina.github.io/texts/browsable/hyginus/70a/	70a.2	70a.2.29	eo	finite verb: first singular present indicative active	ls.n15868:eo1
https://lingualatina.github.io/texts/browsable/hyginus/70a/	70a.2	70a.2.30	quod	uninflected conjunction	ls.n40262:quod1
https://lingualatina.github.io/texts/browsable/hyginus/70a/	70a.2	70a.2.30	quod	pronoun: neuter accusative singular	ls.n40103:qui1
https://lingualatina.github.io/texts/browsable/hyginus/70a/	70a.2	70a.2.30	quod	pronoun: neuter nominative singular	ls.n40103:qui1
https://lingualatina.github.io/texts/browsable/hyginus/70a/	70a.2	70a.2.31	insepulti		ls.null
https://lingualatina.github.io/texts/browsable/hyginus/70a/	70a.2	70a.2.32	iacuerant		ls.null
https://lingualatina.github.io/texts/browsable/hyginus/70a/	70a.2	70a.2.33	Creontis		ls.null
https://lingualatina.github.io/texts/browsable/hyginus/70a/	70a.2	70a.2.34	iussu	noun: masculine dative singular	ls.n25409:jussus2
https://lingualatina.github.io/texts/browsable/hyginus/70a/	70a.2	70a.2.34	iussu	noun: masculine ablative singular	ls.n25409:jussus2
https://lingualatina.github.io/texts/browsable/hyginus/70a/	70a.2	70a.2.34_0	,		ls.null
https://lingualatina.github.io/texts/browsable/hyginus/70a/	70a.2	70a.2.35	qui	pronoun: masculine nominative plural	ls.n40242:quis1
https://lingualatina.github.io/texts/browsable/hyginus/70a/	70a.2	70a.2.35	qui	pronoun: masculine nominative plural	ls.n40103:qui1
https://lingualatina.github.io/texts/browsable/hyginus/70a/	70a.2	70a.2.35	qui	pronoun: masculine nominative singular	ls.n40103:qui1
https://lingualatina.github.io/texts/browsable/hyginus/70a/	70a.2	70a.2.36	Thebas		ls.null
https://lingualatina.github.io/texts/browsable/hyginus/70a/	70a.2	70a.2.37	occuparat		ls.null
https://lingualatina.github.io/texts/browsable/hyginus/70a/	70a.2	70a.2.37_0	,		ls.null
https://lingualatina.github.io/texts/browsable/hyginus/70a/	70a.2	70a.2.38	fratris	noun: masculine genitive singular	ls.n18705:frater
https://lingualatina.github.io/texts/browsable/hyginus/70a/	70a.2	70a.2.39	Iocastes		ls.null
https://lingualatina.github.io/texts/browsable/hyginus/70a/	70a.2	70a.2.39_0	.		ls.null