url	passage	tokenid	token	form	lexeme
https://lingualatina.github.io/texts/browsable/hyginus/84a/	84a.4	84a.4.0	itaque	uninflected conjunction	ls.n25104:itaque
https://lingualatina.github.io/texts/browsable/hyginus/84a/	84a.4	84a.4.1	Myrtilo		ls.null
https://lingualatina.github.io/texts/browsable/hyginus/84a/	84a.4	84a.4.2	aurigae	noun: feminine nominative plural	ls.n4560:auriga
https://lingualatina.github.io/texts/browsable/hyginus/84a/	84a.4	84a.4.2	aurigae	noun: feminine genitive singular	ls.n4560:auriga
https://lingualatina.github.io/texts/browsable/hyginus/84a/	84a.4	84a.4.2	aurigae	noun: feminine dative singular	ls.n4560:auriga
https://lingualatina.github.io/texts/browsable/hyginus/84a/	84a.4	84a.4.2	aurigae	noun: feminine vocative plural	ls.n4560:auriga
https://lingualatina.github.io/texts/browsable/hyginus/84a/	84a.4	84a.4.3	eius	pronoun: feminine genitive singular	ls.n25029:is
https://lingualatina.github.io/texts/browsable/hyginus/84a/	84a.4	84a.4.3	eius	pronoun: neuter genitive singular	ls.n25029:is
https://lingualatina.github.io/texts/browsable/hyginus/84a/	84a.4	84a.4.3	eius	pronoun: masculine genitive singular	ls.n25029:is
https://lingualatina.github.io/texts/browsable/hyginus/84a/	84a.4	84a.4.4	persuasit		ls.null
https://lingualatina.github.io/texts/browsable/hyginus/84a/	84a.4	84a.4.6	ei	pronoun: masculine dative singular	ls.n25029:is
https://lingualatina.github.io/texts/browsable/hyginus/84a/	84a.4	84a.4.6	ei	pronoun: feminine dative singular	ls.n25029:is
https://lingualatina.github.io/texts/browsable/hyginus/84a/	84a.4	84a.4.6	ei	pronoun: neuter dative singular	ls.n25029:is
https://lingualatina.github.io/texts/browsable/hyginus/84a/	84a.4	84a.4.6	ei	pronoun: masculine nominative plural	ls.n25029:is
https://lingualatina.github.io/texts/browsable/hyginus/84a/	84a.4	84a.4.7	dimidium		ls.null
https://lingualatina.github.io/texts/browsable/hyginus/84a/	84a.4	84a.4.8	pollicetur	finite verb: third singular present indicative passive	ls.n36862:polliceor
https://lingualatina.github.io/texts/browsable/hyginus/84a/	84a.4	84a.4.9	si	participle: perfect passive masculine nominative plural	ls.do
https://lingualatina.github.io/texts/browsable/hyginus/84a/	84a.4	84a.4.9	si	participle: perfect passive masculine genitive singular	ls.do
https://lingualatina.github.io/texts/browsable/hyginus/84a/	84a.4	84a.4.9	si	participle: perfect passive masculine vocative plural	ls.do
https://lingualatina.github.io/texts/browsable/hyginus/84a/	84a.4	84a.4.9	si	participle: perfect passive neuter genitive singular	ls.do
https://lingualatina.github.io/texts/browsable/hyginus/84a/	84a.4	84a.4.9	si	uninflected conjunction	ls.n44096:si
https://lingualatina.github.io/texts/browsable/hyginus/84a/	84a.4	84a.4.10	se	participle: perfect passive masculine vocative singular	ls.do
https://lingualatina.github.io/texts/browsable/hyginus/84a/	84a.4	84a.4.10	se	pronoun: masculine accusative singular	ls.n46498:sui
https://lingualatina.github.io/texts/browsable/hyginus/84a/	84a.4	84a.4.10	se	pronoun: masculine ablative singular	ls.n46498:sui
https://lingualatina.github.io/texts/browsable/hyginus/84a/	84a.4	84a.4.10	se	pronoun: feminine ablative singular	ls.n46498:sui
https://lingualatina.github.io/texts/browsable/hyginus/84a/	84a.4	84a.4.10	se	pronoun: neuter ablative singular	ls.n46498:sui
https://lingualatina.github.io/texts/browsable/hyginus/84a/	84a.4	84a.4.10	se	pronoun: feminine ablative plural	ls.n46498:sui
https://lingualatina.github.io/texts/browsable/hyginus/84a/	84a.4	84a.4.10	se	pronoun: neuter accusative plural	ls.n46498:sui
https://lingualatina.github.io/texts/browsable/hyginus/84a/	84a.4	84a.4.10	se	pronoun: feminine accusative plural	ls.n46498:sui
https://lingualatina.github.io/texts/browsable/hyginus/84a/	84a.4	84a.4.10	se	pronoun: neuter ablative plural	ls.n46498:sui
https://lingualatina.github.io/texts/browsable/hyginus/84a/	84a.4	84a.4.10	se	pronoun: feminine accusative singular	ls.n46498:sui
https://lingualatina.github.io/texts/browsable/hyginus/84a/	84a.4	84a.4.10	se	pronoun: neuter accusative singular	ls.n46498:sui
https://lingualatina.github.io/texts/browsable/hyginus/84a/	84a.4	84a.4.10	se	pronoun: masculine accusative plural	ls.n46498:sui
https://lingualatina.github.io/texts/browsable/hyginus/84a/	84a.4	84a.4.10	se	pronoun: masculine ablative plural	ls.n46498:sui
https://lingualatina.github.io/texts/browsable/hyginus/84a/	84a.4	84a.4.11	adiuuaret	finite verb: third singular imperfect subjunctive active	ls.n862:adjuvo
https://lingualatina.github.io/texts/browsable/hyginus/84a/	84a.4	84a.4.11_0	.		ls.null
https://lingualatina.github.io/texts/browsable/hyginus/84a/	84a.4	84a.4.12	fide	noun: feminine genitive singular	ls.n18127:fides1
https://lingualatina.github.io/texts/browsable/hyginus/84a/	84a.4	84a.4.12	fide	noun: feminine dative singular	ls.n18127:fides1
https://lingualatina.github.io/texts/browsable/hyginus/84a/	84a.4	84a.4.12	fide	noun: feminine ablative singular	ls.n18127:fides1
https://lingualatina.github.io/texts/browsable/hyginus/84a/	84a.4	84a.4.13	data	participle: perfect passive feminine nominative singular	ls.n14599:do1
https://lingualatina.github.io/texts/browsable/hyginus/84a/	84a.4	84a.4.13	data	participle: perfect passive feminine ablative singular	ls.n14599:do1
https://lingualatina.github.io/texts/browsable/hyginus/84a/	84a.4	84a.4.13	data	participle: perfect passive feminine vocative singular	ls.n14599:do1
https://lingualatina.github.io/texts/browsable/hyginus/84a/	84a.4	84a.4.13	data	participle: perfect passive neuter nominative plural	ls.n14599:do1
https://lingualatina.github.io/texts/browsable/hyginus/84a/	84a.4	84a.4.13	data	participle: perfect passive neuter accusative plural	ls.n14599:do1
https://lingualatina.github.io/texts/browsable/hyginus/84a/	84a.4	84a.4.13	data	participle: perfect passive neuter vocative plural	ls.n14599:do1
https://lingualatina.github.io/texts/browsable/hyginus/84a/	84a.4	84a.4.14	Myrtilus		ls.null
https://lingualatina.github.io/texts/browsable/hyginus/84a/	84a.4	84a.4.15	currum	noun: masculine accusative singular	ls.n12032:currus
https://lingualatina.github.io/texts/browsable/hyginus/84a/	84a.4	84a.4.16	iunxit	finite verb: third singular perfect indicative active	ls.n25350:jungo
https://lingualatina.github.io/texts/browsable/hyginus/84a/	84a.4	84a.4.17	et	uninflected conjunction	ls.n16278:et
https://lingualatina.github.io/texts/browsable/hyginus/84a/	84a.4	84a.4.18	clauos		ls.null
https://lingualatina.github.io/texts/browsable/hyginus/84a/	84a.4	84a.4.19	in	uninflected preposition	ls.n22111:in1
https://lingualatina.github.io/texts/browsable/hyginus/84a/	84a.4	84a.4.20	rotas		ls.null
https://lingualatina.github.io/texts/browsable/hyginus/84a/	84a.4	84a.4.21	non	adverb: positive degree	ls.n31151:non
https://lingualatina.github.io/texts/browsable/hyginus/84a/	84a.4	84a.4.22	coniecit	finite verb: third singular perfect indicative active	ls.n10309:conicio
https://lingualatina.github.io/texts/browsable/hyginus/84a/	84a.4	84a.4.22_0	;		ls.null
https://lingualatina.github.io/texts/browsable/hyginus/84a/	84a.4	84a.4.23	itaque	uninflected conjunction	ls.n25104:itaque
https://lingualatina.github.io/texts/browsable/hyginus/84a/	84a.4	84a.4.24	equis	noun: masculine dative plural	ls.n16074:equus
https://lingualatina.github.io/texts/browsable/hyginus/84a/	84a.4	84a.4.24	equis	noun: masculine ablative plural	ls.n16074:equus
https://lingualatina.github.io/texts/browsable/hyginus/84a/	84a.4	84a.4.24	equis	noun: feminine dative plural	ls.n16049:equa
https://lingualatina.github.io/texts/browsable/hyginus/84a/	84a.4	84a.4.24	equis	noun: feminine ablative plural	ls.n16049:equa
https://lingualatina.github.io/texts/browsable/hyginus/84a/	84a.4	84a.4.25	incitatis	finite verb: second plural present indicative active	ls.n22372:incito
https://lingualatina.github.io/texts/browsable/hyginus/84a/	84a.4	84a.4.25	incitatis	participle: perfect passive masculine dative plural	ls.n22372:incito
https://lingualatina.github.io/texts/browsable/hyginus/84a/	84a.4	84a.4.25	incitatis	participle: perfect passive masculine ablative plural	ls.n22372:incito
https://lingualatina.github.io/texts/browsable/hyginus/84a/	84a.4	84a.4.25	incitatis	participle: perfect passive feminine dative plural	ls.n22372:incito
https://lingualatina.github.io/texts/browsable/hyginus/84a/	84a.4	84a.4.25	incitatis	participle: perfect passive feminine ablative plural	ls.n22372:incito
https://lingualatina.github.io/texts/browsable/hyginus/84a/	84a.4	84a.4.25	incitatis	participle: perfect passive neuter dative plural	ls.n22372:incito
https://lingualatina.github.io/texts/browsable/hyginus/84a/	84a.4	84a.4.25	incitatis	participle: perfect passive neuter ablative plural	ls.n22372:incito
https://lingualatina.github.io/texts/browsable/hyginus/84a/	84a.4	84a.4.26	currum	noun: masculine accusative singular	ls.n12032:currus
https://lingualatina.github.io/texts/browsable/hyginus/84a/	84a.4	84a.4.27	defectum	participle: perfect passive masculine accusative singular	ls.n12687:deficio
https://lingualatina.github.io/texts/browsable/hyginus/84a/	84a.4	84a.4.27	defectum	participle: perfect passive neuter nominative singular	ls.n12687:deficio
https://lingualatina.github.io/texts/browsable/hyginus/84a/	84a.4	84a.4.27	defectum	participle: perfect passive neuter vocative singular	ls.n12687:deficio
https://lingualatina.github.io/texts/browsable/hyginus/84a/	84a.4	84a.4.28	Oenomai		ls.null
https://lingualatina.github.io/texts/browsable/hyginus/84a/	84a.4	84a.4.29	equi	noun: masculine nominative plural	ls.n16074:equus
https://lingualatina.github.io/texts/browsable/hyginus/84a/	84a.4	84a.4.29	equi	noun: masculine genitive singular	ls.n16074:equus
https://lingualatina.github.io/texts/browsable/hyginus/84a/	84a.4	84a.4.29	equi	noun: masculine vocative plural	ls.n16074:equus
https://lingualatina.github.io/texts/browsable/hyginus/84a/	84a.4	84a.4.30	distraxerunt	finite verb: third plural perfect indicative active	ls.n14485:distraho
https://lingualatina.github.io/texts/browsable/hyginus/84a/	84a.4	84a.4.30_0	.		ls.null