url	passage	tokenid	token	form	lexeme
https://lingualatina.github.io/texts/browsable/hyginus/88a/	88a.3	88a.3.0	Thyestes		ls.null
https://lingualatina.github.io/texts/browsable/hyginus/88a/	88a.3	88a.3.1	scelere	noun: neuter ablative singular	ls.n42918:scelus
https://lingualatina.github.io/texts/browsable/hyginus/88a/	88a.3	88a.3.2	nefario		ls.null
https://lingualatina.github.io/texts/browsable/hyginus/88a/	88a.3	88a.3.3	cognito	participle: perfect passive masculine dative singular	ls.n8938:cognosco
https://lingualatina.github.io/texts/browsable/hyginus/88a/	88a.3	88a.3.3	cognito	participle: perfect passive masculine ablative singular	ls.n8938:cognosco
https://lingualatina.github.io/texts/browsable/hyginus/88a/	88a.3	88a.3.3	cognito	participle: perfect passive neuter ablative singular	ls.n8938:cognosco
https://lingualatina.github.io/texts/browsable/hyginus/88a/	88a.3	88a.3.4	profugit	finite verb: third singular present indicative active	ls.n38642:profugio
https://lingualatina.github.io/texts/browsable/hyginus/88a/	88a.3	88a.3.4	profugit	finite verb: third singular perfect indicative active	ls.n38642:profugio
https://lingualatina.github.io/texts/browsable/hyginus/88a/	88a.3	88a.3.5	ad	uninflected preposition	ls.n665:ad
https://lingualatina.github.io/texts/browsable/hyginus/88a/	88a.3	88a.3.6	regem	noun: masculine accusative singular	ls.n41625:rex1
https://lingualatina.github.io/texts/browsable/hyginus/88a/	88a.3	88a.3.7	Thesprotum		ls.null
https://lingualatina.github.io/texts/browsable/hyginus/88a/	88a.3	88a.3.7_0	,		ls.null
https://lingualatina.github.io/texts/browsable/hyginus/88a/	88a.3	88a.3.8	ubi	uninflected conjunction	ls.n49615:ubi
https://lingualatina.github.io/texts/browsable/hyginus/88a/	88a.3	88a.3.9	lacus	noun: masculine nominative singular	ls.n25611:lacus
https://lingualatina.github.io/texts/browsable/hyginus/88a/	88a.3	88a.3.9	lacus	noun: masculine nominative plural	ls.n25611:lacus
https://lingualatina.github.io/texts/browsable/hyginus/88a/	88a.3	88a.3.9	lacus	noun: masculine accusative plural	ls.n25611:lacus
https://lingualatina.github.io/texts/browsable/hyginus/88a/	88a.3	88a.3.9	lacus	noun: masculine genitive singular	ls.n25611:lacus
https://lingualatina.github.io/texts/browsable/hyginus/88a/	88a.3	88a.3.9	lacus	noun: masculine vocative singular	ls.n25611:lacus
https://lingualatina.github.io/texts/browsable/hyginus/88a/	88a.3	88a.3.9	lacus	noun: masculine vocative plural	ls.n25611:lacus
https://lingualatina.github.io/texts/browsable/hyginus/88a/	88a.3	88a.3.10	Auernus		ls.null
https://lingualatina.github.io/texts/browsable/hyginus/88a/	88a.3	88a.3.11	dicitur	finite verb: third singular present indicative passive	ls.n13804:dico2
https://lingualatina.github.io/texts/browsable/hyginus/88a/	88a.3	88a.3.12	esse	infinitive: present active	ls.n46529:sum1
https://lingualatina.github.io/texts/browsable/hyginus/88a/	88a.3	88a.3.12_0	;		ls.null
https://lingualatina.github.io/texts/browsable/hyginus/88a/	88a.3	88a.3.13	inde	adverb: positive degree	ls.n22699:inde
https://lingualatina.github.io/texts/browsable/hyginus/88a/	88a.3	88a.3.14	Sicyonem		ls.null
https://lingualatina.github.io/texts/browsable/hyginus/88a/	88a.3	88a.3.15	peruenit	finite verb: third singular present indicative active	ls.n35702:pervenio
https://lingualatina.github.io/texts/browsable/hyginus/88a/	88a.3	88a.3.15	peruenit	finite verb: third singular perfect indicative active	ls.n35702:pervenio
https://lingualatina.github.io/texts/browsable/hyginus/88a/	88a.3	88a.3.15_0	,		ls.null
https://lingualatina.github.io/texts/browsable/hyginus/88a/	88a.3	88a.3.16	ubi	uninflected conjunction	ls.n49615:ubi
https://lingualatina.github.io/texts/browsable/hyginus/88a/	88a.3	88a.3.17	erat	finite verb: third singular imperfect indicative active	ls.n46529:sum1
https://lingualatina.github.io/texts/browsable/hyginus/88a/	88a.3	88a.3.18	Pelopia		ls.null
https://lingualatina.github.io/texts/browsable/hyginus/88a/	88a.3	88a.3.19	filia	noun: feminine nominative singular	ls.n18173:filia
https://lingualatina.github.io/texts/browsable/hyginus/88a/	88a.3	88a.3.19	filia	noun: feminine ablative singular	ls.n18173:filia
https://lingualatina.github.io/texts/browsable/hyginus/88a/	88a.3	88a.3.19	filia	noun: feminine vocative singular	ls.n18173:filia
https://lingualatina.github.io/texts/browsable/hyginus/88a/	88a.3	88a.3.20	Thyestis		ls.null
https://lingualatina.github.io/texts/browsable/hyginus/88a/	88a.3	88a.3.21	deposita	participle: perfect passive feminine nominative singular	ls.n13201:depono
https://lingualatina.github.io/texts/browsable/hyginus/88a/	88a.3	88a.3.21	deposita	participle: perfect passive feminine ablative singular	ls.n13201:depono
https://lingualatina.github.io/texts/browsable/hyginus/88a/	88a.3	88a.3.21	deposita	participle: perfect passive feminine vocative singular	ls.n13201:depono
https://lingualatina.github.io/texts/browsable/hyginus/88a/	88a.3	88a.3.21	deposita	participle: perfect passive neuter nominative plural	ls.n13201:depono
https://lingualatina.github.io/texts/browsable/hyginus/88a/	88a.3	88a.3.21	deposita	participle: perfect passive neuter accusative plural	ls.n13201:depono
https://lingualatina.github.io/texts/browsable/hyginus/88a/	88a.3	88a.3.21	deposita	participle: perfect passive neuter vocative plural	ls.n13201:depono
https://lingualatina.github.io/texts/browsable/hyginus/88a/	88a.3	88a.3.21_0	;		ls.null
https://lingualatina.github.io/texts/browsable/hyginus/88a/	88a.3	88a.3.22	ibi	adverb: positive degree	ls.n21296:ibi
https://lingualatina.github.io/texts/browsable/hyginus/88a/	88a.3	88a.3.23	casu	noun: masculine dative singular	ls.n7021:casus1
https://lingualatina.github.io/texts/browsable/hyginus/88a/	88a.3	88a.3.23	casu	noun: masculine ablative singular	ls.n7021:casus1
https://lingualatina.github.io/texts/browsable/hyginus/88a/	88a.3	88a.3.24	nocte	noun: feminine ablative singular	ls.n31309:nox
https://lingualatina.github.io/texts/browsable/hyginus/88a/	88a.3	88a.3.25	cum	uninflected preposition	ls.n11872:cum1
https://lingualatina.github.io/texts/browsable/hyginus/88a/	88a.3	88a.3.26	Mineruae		ls.null
https://lingualatina.github.io/texts/browsable/hyginus/88a/	88a.3	88a.3.27	sacrificarent	finite verb: third plural imperfect subjunctive active	ls.n42192:sacrifico
https://lingualatina.github.io/texts/browsable/hyginus/88a/	88a.3	88a.3.28	interuenit	finite verb: third singular present indicative active	ls.n39941:quaero
https://lingualatina.github.io/texts/browsable/hyginus/88a/	88a.3	88a.3.28	interuenit	finite verb: third singular perfect indicative active	ls.n39941:quaero
https://lingualatina.github.io/texts/browsable/hyginus/88a/	88a.3	88a.3.28_0	,		ls.null
https://lingualatina.github.io/texts/browsable/hyginus/88a/	88a.3	88a.3.29	qui	pronoun: masculine nominative plural	ls.n40242:quis1
https://lingualatina.github.io/texts/browsable/hyginus/88a/	88a.3	88a.3.29	qui	pronoun: masculine nominative plural	ls.n40103:qui1
https://lingualatina.github.io/texts/browsable/hyginus/88a/	88a.3	88a.3.29	qui	pronoun: masculine nominative singular	ls.n40103:qui1
https://lingualatina.github.io/texts/browsable/hyginus/88a/	88a.3	88a.3.30	timens	participle: present active masculine nominative singular	ls.n48358:timeo
https://lingualatina.github.io/texts/browsable/hyginus/88a/	88a.3	88a.3.30	timens	participle: present active masculine vocative singular	ls.n48358:timeo
https://lingualatina.github.io/texts/browsable/hyginus/88a/	88a.3	88a.3.30	timens	participle: present active feminine nominative singular	ls.n48358:timeo
https://lingualatina.github.io/texts/browsable/hyginus/88a/	88a.3	88a.3.30	timens	participle: present active feminine vocative singular	ls.n48358:timeo
https://lingualatina.github.io/texts/browsable/hyginus/88a/	88a.3	88a.3.30	timens	participle: present active neuter nominative singular	ls.n48358:timeo
https://lingualatina.github.io/texts/browsable/hyginus/88a/	88a.3	88a.3.30	timens	participle: present active neuter nominative singular	ls.n48358:timeo
https://lingualatina.github.io/texts/browsable/hyginus/88a/	88a.3	88a.3.30	timens	participle: present active neuter accusative singular	ls.n48358:timeo
https://lingualatina.github.io/texts/browsable/hyginus/88a/	88a.3	88a.3.31	ne	uninflected conjunction	ls.n30583:ne1
https://lingualatina.github.io/texts/browsable/hyginus/88a/	88a.3	88a.3.32	sacra	adjective: feminine nominative singular positive	ls.n42157:sacer
https://lingualatina.github.io/texts/browsable/hyginus/88a/	88a.3	88a.3.32	sacra	adjective: feminine ablative singular positive	ls.n42157:sacer
https://lingualatina.github.io/texts/browsable/hyginus/88a/	88a.3	88a.3.32	sacra	adjective: feminine vocative singular positive	ls.n42157:sacer
https://lingualatina.github.io/texts/browsable/hyginus/88a/	88a.3	88a.3.32	sacra	adjective: neuter nominative plural positive	ls.n42157:sacer
https://lingualatina.github.io/texts/browsable/hyginus/88a/	88a.3	88a.3.32	sacra	adjective: neuter accusative plural positive	ls.n42157:sacer
https://lingualatina.github.io/texts/browsable/hyginus/88a/	88a.3	88a.3.32	sacra	adjective: neuter vocative plural positive	ls.n42157:sacer
https://lingualatina.github.io/texts/browsable/hyginus/88a/	88a.3	88a.3.32	sacra	finite verb: second singular present imperative active	ls.n42201:sacro
https://lingualatina.github.io/texts/browsable/hyginus/88a/	88a.3	88a.3.33	contaminaret	finite verb: third singular imperfect subjunctive active	ls.n10732:contamino
https://lingualatina.github.io/texts/browsable/hyginus/88a/	88a.3	88a.3.34	in	uninflected preposition	ls.n22111:in1
https://lingualatina.github.io/texts/browsable/hyginus/88a/	88a.3	88a.3.35	luco	noun: masculine dative singular	ls.n27140:lucus1
https://lingualatina.github.io/texts/browsable/hyginus/88a/	88a.3	88a.3.35	luco	noun: masculine ablative singular	ls.n27140:lucus1
https://lingualatina.github.io/texts/browsable/hyginus/88a/	88a.3	88a.3.36	delituit		ls.null
https://lingualatina.github.io/texts/browsable/hyginus/88a/	88a.3	88a.3.36_0	.		ls.null