url	passage	tokenid	token	form	lexeme
https://lingualatina.github.io/texts/browsable/hyginus/91a/	91a.3	91a.3.0	postquam	uninflected conjunction	ls.n37241:postquam
https://lingualatina.github.io/texts/browsable/hyginus/91a/	91a.3	91a.3.1	Hecuba		ls.null
https://lingualatina.github.io/texts/browsable/hyginus/91a/	91a.3	91a.3.2	peperit	finite verb: third singular perfect indicative active	ls.n33879:pario2
https://lingualatina.github.io/texts/browsable/hyginus/91a/	91a.3	91a.3.3	Alexandrum		ls.null
https://lingualatina.github.io/texts/browsable/hyginus/91a/	91a.3	91a.3.3_0	,		ls.null
https://lingualatina.github.io/texts/browsable/hyginus/91a/	91a.3	91a.3.4	datur	finite verb: third singular present subjunctive passive	ls.do
https://lingualatina.github.io/texts/browsable/hyginus/91a/	91a.3	91a.3.4	datur	finite verb: third singular present indicative passive	ls.n14599:do1
https://lingualatina.github.io/texts/browsable/hyginus/91a/	91a.3	91a.3.5	interficiendus	gerundive: masculine nominative singular	ls.n24257:interficio
https://lingualatina.github.io/texts/browsable/hyginus/91a/	91a.3	91a.3.5_0	,		ls.null
https://lingualatina.github.io/texts/browsable/hyginus/91a/	91a.3	91a.3.6	quem	pronoun: masculine accusative singular	ls.n40242:quis1
https://lingualatina.github.io/texts/browsable/hyginus/91a/	91a.3	91a.3.6	quem	pronoun: feminine accusative singular	ls.n40242:quis1
https://lingualatina.github.io/texts/browsable/hyginus/91a/	91a.3	91a.3.6	quem	pronoun: masculine accusative singular	ls.n40103:qui1
https://lingualatina.github.io/texts/browsable/hyginus/91a/	91a.3	91a.3.7	satellites	noun: masculine nominative plural	ls.n42691:satelles
https://lingualatina.github.io/texts/browsable/hyginus/91a/	91a.3	91a.3.7	satellites	noun: masculine accusative plural	ls.n42691:satelles
https://lingualatina.github.io/texts/browsable/hyginus/91a/	91a.3	91a.3.7	satellites	noun: masculine vocative plural	ls.n42691:satelles
https://lingualatina.github.io/texts/browsable/hyginus/91a/	91a.3	91a.3.8	misericordia	noun: feminine nominative singular	ls.n29266:misericordia
https://lingualatina.github.io/texts/browsable/hyginus/91a/	91a.3	91a.3.8	misericordia	noun: feminine ablative singular	ls.n29266:misericordia
https://lingualatina.github.io/texts/browsable/hyginus/91a/	91a.3	91a.3.8	misericordia	noun: feminine vocative singular	ls.n29266:misericordia
https://lingualatina.github.io/texts/browsable/hyginus/91a/	91a.3	91a.3.9	exposuerunt	finite verb: third plural perfect indicative active	ls.n17092:expono
https://lingualatina.github.io/texts/browsable/hyginus/91a/	91a.3	91a.3.9_0	;		ls.null
https://lingualatina.github.io/texts/browsable/hyginus/91a/	91a.3	91a.3.10	eum	pronoun: masculine accusative singular	ls.n25029:is
https://lingualatina.github.io/texts/browsable/hyginus/91a/	91a.3	91a.3.11	pastores	noun: masculine nominative plural	ls.n34067:pastor
https://lingualatina.github.io/texts/browsable/hyginus/91a/	91a.3	91a.3.11	pastores	noun: masculine accusative plural	ls.n34067:pastor
https://lingualatina.github.io/texts/browsable/hyginus/91a/	91a.3	91a.3.11	pastores	noun: masculine vocative plural	ls.n34067:pastor
https://lingualatina.github.io/texts/browsable/hyginus/91a/	91a.3	91a.3.12	pro	uninflected preposition	ls.n38383:pro1
https://lingualatina.github.io/texts/browsable/hyginus/91a/	91a.3	91a.3.13	suo	adjective: masculine dative singular positive	ls.n47174:suus
https://lingualatina.github.io/texts/browsable/hyginus/91a/	91a.3	91a.3.13	suo	adjective: masculine ablative singular positive	ls.n47174:suus
https://lingualatina.github.io/texts/browsable/hyginus/91a/	91a.3	91a.3.13	suo	adjective: neuter dative singular positive	ls.n47174:suus
https://lingualatina.github.io/texts/browsable/hyginus/91a/	91a.3	91a.3.13	suo	adjective: neuter ablative singular positive	ls.n47174:suus
https://lingualatina.github.io/texts/browsable/hyginus/91a/	91a.3	91a.3.14	filio	noun: masculine dative singular	ls.n18185:filius
https://lingualatina.github.io/texts/browsable/hyginus/91a/	91a.3	91a.3.14	filio	noun: masculine ablative singular	ls.n18185:filius
https://lingualatina.github.io/texts/browsable/hyginus/91a/	91a.3	91a.3.15	repertum		ls.null
https://lingualatina.github.io/texts/browsable/hyginus/91a/	91a.3	91a.3.16	expositum	participle: perfect passive masculine accusative singular	ls.n17092:expono
https://lingualatina.github.io/texts/browsable/hyginus/91a/	91a.3	91a.3.16	expositum	participle: perfect passive neuter nominative singular	ls.n17092:expono
https://lingualatina.github.io/texts/browsable/hyginus/91a/	91a.3	91a.3.16	expositum	participle: perfect passive neuter vocative singular	ls.n17092:expono
https://lingualatina.github.io/texts/browsable/hyginus/91a/	91a.3	91a.3.17	educarunt		ls.null
https://lingualatina.github.io/texts/browsable/hyginus/91a/	91a.3	91a.3.19	Parim		ls.null
https://lingualatina.github.io/texts/browsable/hyginus/91a/	91a.3	91a.3.20	nominauerunt	finite verb: third plural perfect indicative active	ls.n31146:nomino
https://lingualatina.github.io/texts/browsable/hyginus/91a/	91a.3	91a.3.20_0	.		ls.null