url	passage	tokenid	token	form	lexeme
https://lingualatina.github.io/texts/browsable/hyginus/91a/	91a.5	91a.5.0	qui	pronoun: masculine nominative plural	urn:cite2:tabulae:ls.v1:n40242
https://lingualatina.github.io/texts/browsable/hyginus/91a/	91a.5	91a.5.0	qui	pronoun: masculine nominative plural	urn:cite2:tabulae:ls.v1:n40103
https://lingualatina.github.io/texts/browsable/hyginus/91a/	91a.5	91a.5.0	qui	pronoun: masculine nominative singular	urn:cite2:tabulae:ls.v1:n40103
https://lingualatina.github.io/texts/browsable/hyginus/91a/	91a.5	91a.5.1	persecutus	participle: perfect passive masculine nominative singular	urn:cite2:tabulae:ls.v1:n35491
https://lingualatina.github.io/texts/browsable/hyginus/91a/	91a.5	91a.5.2	est	finite verb: third singular present indicative active	urn:cite2:tabulae:ls.v1:n46529
https://lingualatina.github.io/texts/browsable/hyginus/91a/	91a.5	91a.5.3	eos	pronoun: masculine accusative plural	urn:cite2:tabulae:ls.v1:n25029
https://lingualatina.github.io/texts/browsable/hyginus/91a/	91a.5	91a.5.4	et	uninflected conjunction	urn:cite2:tabulae:ls.v1:n16278
https://lingualatina.github.io/texts/browsable/hyginus/91a/	91a.5	91a.5.5	inquisiuit		urn:cite2:tabulae:ls.v1:null
https://lingualatina.github.io/texts/browsable/hyginus/91a/	91a.5	91a.5.6	quo	pronoun: masculine ablative singular	urn:cite2:tabulae:ls.v1:n40242
https://lingualatina.github.io/texts/browsable/hyginus/91a/	91a.5	91a.5.6	quo	pronoun: feminine ablative singular	urn:cite2:tabulae:ls.v1:n40242
https://lingualatina.github.io/texts/browsable/hyginus/91a/	91a.5	91a.5.6	quo	pronoun: neuter ablative singular	urn:cite2:tabulae:ls.v1:n40242
https://lingualatina.github.io/texts/browsable/hyginus/91a/	91a.5	91a.5.6	quo	pronoun: masculine ablative singular	urn:cite2:tabulae:ls.v1:n40103
https://lingualatina.github.io/texts/browsable/hyginus/91a/	91a.5	91a.5.6	quo	pronoun: neuter ablative singular	urn:cite2:tabulae:ls.v1:n40103
https://lingualatina.github.io/texts/browsable/hyginus/91a/	91a.5	91a.5.7	eum	pronoun: masculine accusative singular	urn:cite2:tabulae:ls.v1:n25029
https://lingualatina.github.io/texts/browsable/hyginus/91a/	91a.5	91a.5.8	ducerent	finite verb: third plural imperfect subjunctive active	urn:cite2:tabulae:ls.v1:n14847
https://lingualatina.github.io/texts/browsable/hyginus/91a/	91a.5	91a.5.8_0	;		urn:cite2:tabulae:ls.v1:null
https://lingualatina.github.io/texts/browsable/hyginus/91a/	91a.5	91a.5.9	illi	pronoun: masculine dative singular	urn:cite2:tabulae:ls.v1:n21494
https://lingualatina.github.io/texts/browsable/hyginus/91a/	91a.5	91a.5.9	illi	pronoun: masculine nominative plural	urn:cite2:tabulae:ls.v1:n21494
https://lingualatina.github.io/texts/browsable/hyginus/91a/	91a.5	91a.5.9	illi	pronoun: feminine dative singular	urn:cite2:tabulae:ls.v1:n21494
https://lingualatina.github.io/texts/browsable/hyginus/91a/	91a.5	91a.5.9	illi	pronoun: neuter dative singular	urn:cite2:tabulae:ls.v1:n21494
https://lingualatina.github.io/texts/browsable/hyginus/91a/	91a.5	91a.5.10	indicant	finite verb: third plural present indicative active	urn:cite2:tabulae:ls.v1:n22781
https://lingualatina.github.io/texts/browsable/hyginus/91a/	91a.5	91a.5.11	se	participle: perfect passive masculine vocative singular	urn:cite2:l3:composites.v1:do
https://lingualatina.github.io/texts/browsable/hyginus/91a/	91a.5	91a.5.11	se	pronoun: masculine accusative singular	urn:cite2:tabulae:ls.v1:n46498
https://lingualatina.github.io/texts/browsable/hyginus/91a/	91a.5	91a.5.11	se	pronoun: masculine ablative singular	urn:cite2:tabulae:ls.v1:n46498
https://lingualatina.github.io/texts/browsable/hyginus/91a/	91a.5	91a.5.11	se	pronoun: feminine ablative singular	urn:cite2:tabulae:ls.v1:n46498
https://lingualatina.github.io/texts/browsable/hyginus/91a/	91a.5	91a.5.11	se	pronoun: neuter ablative singular	urn:cite2:tabulae:ls.v1:n46498
https://lingualatina.github.io/texts/browsable/hyginus/91a/	91a.5	91a.5.11	se	pronoun: feminine ablative plural	urn:cite2:tabulae:ls.v1:n46498
https://lingualatina.github.io/texts/browsable/hyginus/91a/	91a.5	91a.5.11	se	pronoun: neuter accusative plural	urn:cite2:tabulae:ls.v1:n46498
https://lingualatina.github.io/texts/browsable/hyginus/91a/	91a.5	91a.5.11	se	pronoun: feminine accusative plural	urn:cite2:tabulae:ls.v1:n46498
https://lingualatina.github.io/texts/browsable/hyginus/91a/	91a.5	91a.5.11	se	pronoun: neuter ablative plural	urn:cite2:tabulae:ls.v1:n46498
https://lingualatina.github.io/texts/browsable/hyginus/91a/	91a.5	91a.5.11	se	pronoun: feminine accusative singular	urn:cite2:tabulae:ls.v1:n46498
https://lingualatina.github.io/texts/browsable/hyginus/91a/	91a.5	91a.5.11	se	pronoun: neuter accusative singular	urn:cite2:tabulae:ls.v1:n46498
https://lingualatina.github.io/texts/browsable/hyginus/91a/	91a.5	91a.5.11	se	pronoun: masculine accusative plural	urn:cite2:tabulae:ls.v1:n46498
https://lingualatina.github.io/texts/browsable/hyginus/91a/	91a.5	91a.5.11	se	pronoun: masculine ablative plural	urn:cite2:tabulae:ls.v1:n46498
https://lingualatina.github.io/texts/browsable/hyginus/91a/	91a.5	91a.5.12	eum	pronoun: masculine accusative singular	urn:cite2:tabulae:ls.v1:n25029
https://lingualatina.github.io/texts/browsable/hyginus/91a/	91a.5	91a.5.13	ad	uninflected preposition	urn:cite2:tabulae:ls.v1:n665
https://lingualatina.github.io/texts/browsable/hyginus/91a/	91a.5	91a.5.14	Priamum		urn:cite2:tabulae:ls.v1:null
https://lingualatina.github.io/texts/browsable/hyginus/91a/	91a.5	91a.5.15	adducere	finite verb: second singular present indicative passive	urn:cite2:tabulae:ls.v1:n743
https://lingualatina.github.io/texts/browsable/hyginus/91a/	91a.5	91a.5.15	adducere	finite verb: second singular future indicative passive	urn:cite2:tabulae:ls.v1:n743
https://lingualatina.github.io/texts/browsable/hyginus/91a/	91a.5	91a.5.15	adducere	infinitive: present active	urn:cite2:tabulae:ls.v1:n743
https://lingualatina.github.io/texts/browsable/hyginus/91a/	91a.5	91a.5.20	qui	pronoun: masculine nominative plural	urn:cite2:tabulae:ls.v1:n40242
https://lingualatina.github.io/texts/browsable/hyginus/91a/	91a.5	91a.5.20	qui	pronoun: masculine nominative plural	urn:cite2:tabulae:ls.v1:n40103
https://lingualatina.github.io/texts/browsable/hyginus/91a/	91a.5	91a.5.20	qui	pronoun: masculine nominative singular	urn:cite2:tabulae:ls.v1:n40103
https://lingualatina.github.io/texts/browsable/hyginus/91a/	91a.5	91a.5.21	uicisset	finite verb: third singular pluperfect subjunctive active	urn:cite2:tabulae:ls.v1:n50968
https://lingualatina.github.io/texts/browsable/hyginus/91a/	91a.5	91a.5.22	ludis	noun: masculine dative plural	urn:cite2:tabulae:ls.v1:n27171
https://lingualatina.github.io/texts/browsable/hyginus/91a/	91a.5	91a.5.22	ludis	noun: masculine ablative plural	urn:cite2:tabulae:ls.v1:n27171
https://lingualatina.github.io/texts/browsable/hyginus/91a/	91a.5	91a.5.23	funebribus	adjective: masculine dative plural positive	urn:cite2:tabulae:ls.v1:n19053
https://lingualatina.github.io/texts/browsable/hyginus/91a/	91a.5	91a.5.23	funebribus	adjective: masculine ablative plural positive	urn:cite2:tabulae:ls.v1:n19053
https://lingualatina.github.io/texts/browsable/hyginus/91a/	91a.5	91a.5.23	funebribus	adjective: feminine dative plural positive	urn:cite2:tabulae:ls.v1:n19053
https://lingualatina.github.io/texts/browsable/hyginus/91a/	91a.5	91a.5.23	funebribus	adjective: neuter dative plural positive	urn:cite2:tabulae:ls.v1:n19053
https://lingualatina.github.io/texts/browsable/hyginus/91a/	91a.5	91a.5.23	funebribus	adjective: neuter ablative plural positive	urn:cite2:tabulae:ls.v1:n19053
https://lingualatina.github.io/texts/browsable/hyginus/91a/	91a.5	91a.5.24	Alexandri		urn:cite2:tabulae:ls.v1:null
https://lingualatina.github.io/texts/browsable/hyginus/91a/	91a.5	91a.5.24_0	.		urn:cite2:tabulae:ls.v1:null
https://lingualatina.github.io/texts/browsable/hyginus/91a/	91a.5	91a.5.25	ille	pronoun: masculine nominative singular	urn:cite2:tabulae:ls.v1:n21494
https://lingualatina.github.io/texts/browsable/hyginus/91a/	91a.5	91a.5.26	amore	noun: masculine ablative singular	urn:cite2:tabulae:ls.v1:n2294
https://lingualatina.github.io/texts/browsable/hyginus/91a/	91a.5	91a.5.27	incensus	participle: perfect passive masculine nominative singular	urn:cite2:tabulae:ls.v1:n22294
https://lingualatina.github.io/texts/browsable/hyginus/91a/	91a.5	91a.5.28	tauri	noun: masculine nominative plural	urn:cite2:tabulae:ls.v1:n47579
https://lingualatina.github.io/texts/browsable/hyginus/91a/	91a.5	91a.5.28	tauri	noun: masculine genitive singular	urn:cite2:tabulae:ls.v1:n47579
https://lingualatina.github.io/texts/browsable/hyginus/91a/	91a.5	91a.5.28	tauri	noun: masculine vocative plural	urn:cite2:tabulae:ls.v1:n47579
https://lingualatina.github.io/texts/browsable/hyginus/91a/	91a.5	91a.5.29	sui	adjective: masculine nominative plural positive	urn:cite2:tabulae:ls.v1:n47174
https://lingualatina.github.io/texts/browsable/hyginus/91a/	91a.5	91a.5.29	sui	adjective: masculine genitive singular positive	urn:cite2:tabulae:ls.v1:n47174
https://lingualatina.github.io/texts/browsable/hyginus/91a/	91a.5	91a.5.29	sui	adjective: masculine vocative plural positive	urn:cite2:tabulae:ls.v1:n47174
https://lingualatina.github.io/texts/browsable/hyginus/91a/	91a.5	91a.5.29	sui	adjective: neuter genitive singular positive	urn:cite2:tabulae:ls.v1:n47174
https://lingualatina.github.io/texts/browsable/hyginus/91a/	91a.5	91a.5.29	sui	pronoun: feminine genitive singular	urn:cite2:tabulae:ls.v1:n46498
https://lingualatina.github.io/texts/browsable/hyginus/91a/	91a.5	91a.5.29	sui	pronoun: neuter genitive singular	urn:cite2:tabulae:ls.v1:n46498
https://lingualatina.github.io/texts/browsable/hyginus/91a/	91a.5	91a.5.29	sui	pronoun: masculine genitive plural	urn:cite2:tabulae:ls.v1:n46498
https://lingualatina.github.io/texts/browsable/hyginus/91a/	91a.5	91a.5.29	sui	pronoun: neuter genitive plural	urn:cite2:tabulae:ls.v1:n46498
https://lingualatina.github.io/texts/browsable/hyginus/91a/	91a.5	91a.5.29	sui	pronoun: masculine genitive singular	urn:cite2:tabulae:ls.v1:n46498
https://lingualatina.github.io/texts/browsable/hyginus/91a/	91a.5	91a.5.29	sui	pronoun: feminine genitive plural	urn:cite2:tabulae:ls.v1:n46498
https://lingualatina.github.io/texts/browsable/hyginus/91a/	91a.5	91a.5.30	descendit	finite verb: third singular present indicative active	urn:cite2:tabulae:ls.v1:n13329
https://lingualatina.github.io/texts/browsable/hyginus/91a/	91a.5	91a.5.30	descendit	finite verb: third singular perfect indicative active	urn:cite2:tabulae:ls.v1:n13329
https://lingualatina.github.io/texts/browsable/hyginus/91a/	91a.5	91a.5.31	in	uninflected preposition	urn:cite2:tabulae:ls.v1:n22111
https://lingualatina.github.io/texts/browsable/hyginus/91a/	91a.5	91a.5.32	certamen	noun: neuter nominative singular	urn:cite2:tabulae:ls.v1:n7579
https://lingualatina.github.io/texts/browsable/hyginus/91a/	91a.5	91a.5.32	certamen	noun: neuter accusative singular	urn:cite2:tabulae:ls.v1:n7579
https://lingualatina.github.io/texts/browsable/hyginus/91a/	91a.5	91a.5.32	certamen	noun: neuter vocative singular	urn:cite2:tabulae:ls.v1:n7579
https://lingualatina.github.io/texts/browsable/hyginus/91a/	91a.5	91a.5.33	et	uninflected conjunction	urn:cite2:tabulae:ls.v1:n16278
https://lingualatina.github.io/texts/browsable/hyginus/91a/	91a.5	91a.5.34	omnia	adjective: neuter nominative plural positive	urn:cite2:tabulae:ls.v1:n32583
https://lingualatina.github.io/texts/browsable/hyginus/91a/	91a.5	91a.5.34	omnia	adjective: neuter accusative plural positive	urn:cite2:tabulae:ls.v1:n32583
https://lingualatina.github.io/texts/browsable/hyginus/91a/	91a.5	91a.5.34	omnia	adjective: neuter vocative plural positive	urn:cite2:tabulae:ls.v1:n32583
https://lingualatina.github.io/texts/browsable/hyginus/91a/	91a.5	91a.5.35	uicit	finite verb: third singular perfect indicative active	urn:cite2:tabulae:ls.v1:n50968
https://lingualatina.github.io/texts/browsable/hyginus/91a/	91a.5	91a.5.35_0	,		urn:cite2:tabulae:ls.v1:null
https://lingualatina.github.io/texts/browsable/hyginus/91a/	91a.5	91a.5.36	fratres	noun: masculine nominative plural	urn:cite2:tabulae:ls.v1:n18705
https://lingualatina.github.io/texts/browsable/hyginus/91a/	91a.5	91a.5.36	fratres	noun: masculine accusative plural	urn:cite2:tabulae:ls.v1:n18705
https://lingualatina.github.io/texts/browsable/hyginus/91a/	91a.5	91a.5.36	fratres	noun: masculine vocative plural	urn:cite2:tabulae:ls.v1:n18705
https://lingualatina.github.io/texts/browsable/hyginus/91a/	91a.5	91a.5.37	quoque	uninflected preposition	urn:cite2:tabulae:ls.v1:n40282
https://lingualatina.github.io/texts/browsable/hyginus/91a/	91a.5	91a.5.37	quoque	pronoun: masculine ablative singular	urn:cite2:tabulae:ls.v1:n40248
https://lingualatina.github.io/texts/browsable/hyginus/91a/	91a.5	91a.5.37	quoque	pronoun: feminine ablative singular	urn:cite2:tabulae:ls.v1:n40248
https://lingualatina.github.io/texts/browsable/hyginus/91a/	91a.5	91a.5.37	quoque	pronoun: neuter ablative singular	urn:cite2:tabulae:ls.v1:n40248
https://lingualatina.github.io/texts/browsable/hyginus/91a/	91a.5	91a.5.38	suos	adjective: masculine accusative plural positive	urn:cite2:tabulae:ls.v1:n47174
https://lingualatina.github.io/texts/browsable/hyginus/91a/	91a.5	91a.5.39	superauit	finite verb: third singular perfect indicative active	urn:cite2:tabulae:ls.v1:n46824
https://lingualatina.github.io/texts/browsable/hyginus/91a/	91a.5	91a.5.39_0	.		urn:cite2:tabulae:ls.v1:null