url	passage	tokenid	token	form	lexeme
https://lingualatina.github.io/texts/browsable/hyginus/95a/	95a.1	95a.1.0	Agamemnon		ls.null
https://lingualatina.github.io/texts/browsable/hyginus/95a/	95a.1	95a.1.1	et	uninflected conjunction	ls.n16278:et
https://lingualatina.github.io/texts/browsable/hyginus/95a/	95a.1	95a.1.2	Menelaus		ls.null
https://lingualatina.github.io/texts/browsable/hyginus/95a/	95a.1	95a.1.3	Atrei		ls.null
https://lingualatina.github.io/texts/browsable/hyginus/95a/	95a.1	95a.1.4	filii	noun: masculine nominative plural	ls.n18185:filius
https://lingualatina.github.io/texts/browsable/hyginus/95a/	95a.1	95a.1.4	filii	noun: masculine genitive singular	ls.n18185:filius
https://lingualatina.github.io/texts/browsable/hyginus/95a/	95a.1	95a.1.4	filii	noun: masculine vocative plural	ls.n18185:filius
https://lingualatina.github.io/texts/browsable/hyginus/95a/	95a.1	95a.1.5	cum	uninflected preposition	ls.n11872:cum1
https://lingualatina.github.io/texts/browsable/hyginus/95a/	95a.1	95a.1.6	ad	uninflected preposition	ls.n665:ad
https://lingualatina.github.io/texts/browsable/hyginus/95a/	95a.1	95a.1.7	Troiam	noun: feminine accusative singular	ls.n49272:Troia
https://lingualatina.github.io/texts/browsable/hyginus/95a/	95a.1	95a.1.8	oppugnandam	gerundive: feminine accusative singular	ls.n32829:oppugno1
https://lingualatina.github.io/texts/browsable/hyginus/95a/	95a.1	95a.1.9	coniuratos	participle: perfect passive masculine accusative plural	ls.n10364:conjuro
https://lingualatina.github.io/texts/browsable/hyginus/95a/	95a.1	95a.1.10	duces	noun: masculine nominative plural	ls.n15002:dux
https://lingualatina.github.io/texts/browsable/hyginus/95a/	95a.1	95a.1.10	duces	noun: masculine accusative plural	ls.n15002:dux
https://lingualatina.github.io/texts/browsable/hyginus/95a/	95a.1	95a.1.10	duces	noun: masculine vocative plural	ls.n15002:dux
https://lingualatina.github.io/texts/browsable/hyginus/95a/	95a.1	95a.1.10	duces	finite verb: second singular future indicative active	ls.n14847:duco
https://lingualatina.github.io/texts/browsable/hyginus/95a/	95a.1	95a.1.11	ducerent	finite verb: third plural imperfect subjunctive active	ls.n14847:duco
https://lingualatina.github.io/texts/browsable/hyginus/95a/	95a.1	95a.1.11_0	,		ls.null
https://lingualatina.github.io/texts/browsable/hyginus/95a/	95a.1	95a.1.12	in	uninflected preposition	ls.n22111:in1
https://lingualatina.github.io/texts/browsable/hyginus/95a/	95a.1	95a.1.13	insulam	noun: feminine accusative singular	ls.n24040:insula1
https://lingualatina.github.io/texts/browsable/hyginus/95a/	95a.1	95a.1.14	Ithacam		ls.null
https://lingualatina.github.io/texts/browsable/hyginus/95a/	95a.1	95a.1.15	ad	uninflected preposition	ls.n665:ad
https://lingualatina.github.io/texts/browsable/hyginus/95a/	95a.1	95a.1.16	Ulixem		ls.null
https://lingualatina.github.io/texts/browsable/hyginus/95a/	95a.1	95a.1.17	Laertis		ls.null
https://lingualatina.github.io/texts/browsable/hyginus/95a/	95a.1	95a.1.18	filium	noun: masculine accusative singular	ls.n18185:filius
https://lingualatina.github.io/texts/browsable/hyginus/95a/	95a.1	95a.1.19	uenerunt	finite verb: third plural perfect indicative active	ls.n50442:venio
https://lingualatina.github.io/texts/browsable/hyginus/95a/	95a.1	95a.1.19_0	,		ls.null
https://lingualatina.github.io/texts/browsable/hyginus/95a/	95a.1	95a.1.20	cui	pronoun: masculine dative singular	ls.n40242:quis1
https://lingualatina.github.io/texts/browsable/hyginus/95a/	95a.1	95a.1.20	cui	pronoun: neuter dative singular	ls.n40242:quis1
https://lingualatina.github.io/texts/browsable/hyginus/95a/	95a.1	95a.1.20	cui	pronoun: feminine dative singular	ls.n40242:quis1
https://lingualatina.github.io/texts/browsable/hyginus/95a/	95a.1	95a.1.20	cui	pronoun: masculine dative singular	ls.n40103:qui1
https://lingualatina.github.io/texts/browsable/hyginus/95a/	95a.1	95a.1.20	cui	pronoun: neuter dative singular	ls.n40103:qui1
https://lingualatina.github.io/texts/browsable/hyginus/95a/	95a.1	95a.1.20	cui	pronoun: feminine dative singular	ls.n40103:qui1
https://lingualatina.github.io/texts/browsable/hyginus/95a/	95a.1	95a.1.21	erat	finite verb: third singular imperfect indicative active	ls.n46529:sum1
https://lingualatina.github.io/texts/browsable/hyginus/95a/	95a.1	95a.1.22	responsum	participle: perfect passive masculine accusative singular	ls.n41387:respondeo
https://lingualatina.github.io/texts/browsable/hyginus/95a/	95a.1	95a.1.22	responsum	participle: perfect passive neuter nominative singular	ls.n41387:respondeo
https://lingualatina.github.io/texts/browsable/hyginus/95a/	95a.1	95a.1.22	responsum	participle: perfect passive neuter vocative singular	ls.n41387:respondeo
https://lingualatina.github.io/texts/browsable/hyginus/95a/	95a.1	95a.1.22_0	,		ls.null
https://lingualatina.github.io/texts/browsable/hyginus/95a/	95a.1	95a.1.23	si	participle: perfect passive masculine nominative plural	ls.do
https://lingualatina.github.io/texts/browsable/hyginus/95a/	95a.1	95a.1.23	si	participle: perfect passive masculine genitive singular	ls.do
https://lingualatina.github.io/texts/browsable/hyginus/95a/	95a.1	95a.1.23	si	participle: perfect passive masculine vocative plural	ls.do
https://lingualatina.github.io/texts/browsable/hyginus/95a/	95a.1	95a.1.23	si	participle: perfect passive neuter genitive singular	ls.do
https://lingualatina.github.io/texts/browsable/hyginus/95a/	95a.1	95a.1.23	si	uninflected conjunction	ls.n44096:si
https://lingualatina.github.io/texts/browsable/hyginus/95a/	95a.1	95a.1.24	ad	uninflected preposition	ls.n665:ad
https://lingualatina.github.io/texts/browsable/hyginus/95a/	95a.1	95a.1.25	Troiam	noun: feminine accusative singular	ls.n49272:Troia
https://lingualatina.github.io/texts/browsable/hyginus/95a/	95a.1	95a.1.26	isset	finite verb: third singular pluperfect subjunctive active	ls.n15868:eo1
https://lingualatina.github.io/texts/browsable/hyginus/95a/	95a.1	95a.1.26_0	,		ls.null
https://lingualatina.github.io/texts/browsable/hyginus/95a/	95a.1	95a.1.27	post	uninflected preposition	ls.n37194:post
https://lingualatina.github.io/texts/browsable/hyginus/95a/	95a.1	95a.1.28	uicesimum		ls.null
https://lingualatina.github.io/texts/browsable/hyginus/95a/	95a.1	95a.1.29	annum	noun: masculine accusative singular	ls.n2698:annus
https://lingualatina.github.io/texts/browsable/hyginus/95a/	95a.1	95a.1.30	solum	noun: masculine genitive plural	ls.n44583:sol
https://lingualatina.github.io/texts/browsable/hyginus/95a/	95a.1	95a.1.30	solum	adjective: masculine accusative singular positive	ls.n44608:soleo
https://lingualatina.github.io/texts/browsable/hyginus/95a/	95a.1	95a.1.30	solum	adjective: neuter nominative singular positive	ls.n44608:soleo
https://lingualatina.github.io/texts/browsable/hyginus/95a/	95a.1	95a.1.30	solum	adjective: neuter accusative singular positive	ls.n44608:soleo
https://lingualatina.github.io/texts/browsable/hyginus/95a/	95a.1	95a.1.30	solum	adjective: neuter vocative singular positive	ls.n44608:soleo
https://lingualatina.github.io/texts/browsable/hyginus/95a/	95a.1	95a.1.31	sociis	adjective: masculine dative plural positive	ls.n44562:socius
https://lingualatina.github.io/texts/browsable/hyginus/95a/	95a.1	95a.1.31	sociis	adjective: masculine ablative plural positive	ls.n44562:socius
https://lingualatina.github.io/texts/browsable/hyginus/95a/	95a.1	95a.1.31	sociis	adjective: feminine dative plural positive	ls.n44562:socius
https://lingualatina.github.io/texts/browsable/hyginus/95a/	95a.1	95a.1.31	sociis	adjective: feminine ablative plural positive	ls.n44562:socius
https://lingualatina.github.io/texts/browsable/hyginus/95a/	95a.1	95a.1.31	sociis	adjective: neuter dative plural positive	ls.n44562:socius
https://lingualatina.github.io/texts/browsable/hyginus/95a/	95a.1	95a.1.31	sociis	adjective: neuter ablative plural positive	ls.n44562:socius
https://lingualatina.github.io/texts/browsable/hyginus/95a/	95a.1	95a.1.32	perditis		ls.null
https://lingualatina.github.io/texts/browsable/hyginus/95a/	95a.1	95a.1.33	egentem	participle: present active masculine accusative singular	ls.n15308:egeo
https://lingualatina.github.io/texts/browsable/hyginus/95a/	95a.1	95a.1.33	egentem	participle: present active feminine accusative singular	ls.n15308:egeo
https://lingualatina.github.io/texts/browsable/hyginus/95a/	95a.1	95a.1.34	domum	noun: masculine accusative singular	ls.n14720:domus
https://lingualatina.github.io/texts/browsable/hyginus/95a/	95a.1	95a.1.34	domum	noun: feminine accusative singular	ls.n14720:domus
https://lingualatina.github.io/texts/browsable/hyginus/95a/	95a.1	95a.1.35	rediturum		ls.null
https://lingualatina.github.io/texts/browsable/hyginus/95a/	95a.1	95a.1.35_0	.		ls.null