url	passage	tokenid	token	form	lexeme
https://lingualatina.github.io/texts/browsable/hyginus/9pr/	9pr.3	9pr.3.0	ob	uninflected preposition	ls.n31564:ob
https://lingualatina.github.io/texts/browsable/hyginus/9pr/	9pr.3	9pr.3.1	id	pronoun: neuter nominative singular	ls.n25029:is
https://lingualatina.github.io/texts/browsable/hyginus/9pr/	9pr.3	9pr.3.1	id	pronoun: neuter accusative singular	ls.n25029:is
https://lingualatina.github.io/texts/browsable/hyginus/9pr/	9pr.3	9pr.3.2	Apollo	noun: masculine nominative singular	ls.n3063:Apollo
https://lingualatina.github.io/texts/browsable/hyginus/9pr/	9pr.3	9pr.3.2	Apollo	noun: masculine vocative singular	ls.n3063:Apollo
https://lingualatina.github.io/texts/browsable/hyginus/9pr/	9pr.3	9pr.3.3	filios	noun: masculine accusative plural	ls.n18185:filius
https://lingualatina.github.io/texts/browsable/hyginus/9pr/	9pr.3	9pr.3.4	eius	pronoun: feminine genitive singular	ls.n25029:is
https://lingualatina.github.io/texts/browsable/hyginus/9pr/	9pr.3	9pr.3.4	eius	pronoun: neuter genitive singular	ls.n25029:is
https://lingualatina.github.io/texts/browsable/hyginus/9pr/	9pr.3	9pr.3.4	eius	pronoun: masculine genitive singular	ls.n25029:is
https://lingualatina.github.io/texts/browsable/hyginus/9pr/	9pr.3	9pr.3.5	in	uninflected preposition	ls.n22111:in1
https://lingualatina.github.io/texts/browsable/hyginus/9pr/	9pr.3	9pr.3.6	silua	noun: feminine nominative singular	ls.n44280:silva
https://lingualatina.github.io/texts/browsable/hyginus/9pr/	9pr.3	9pr.3.6	silua	noun: feminine ablative singular	ls.n44280:silva
https://lingualatina.github.io/texts/browsable/hyginus/9pr/	9pr.3	9pr.3.6	silua	noun: feminine vocative singular	ls.n44280:silva
https://lingualatina.github.io/texts/browsable/hyginus/9pr/	9pr.3	9pr.3.7	uenantes	participle: present active masculine nominative plural	ls.n50445:venor
https://lingualatina.github.io/texts/browsable/hyginus/9pr/	9pr.3	9pr.3.7	uenantes	participle: present active masculine accusative plural	ls.n50445:venor
https://lingualatina.github.io/texts/browsable/hyginus/9pr/	9pr.3	9pr.3.7	uenantes	participle: present active masculine vocative plural	ls.n50445:venor
https://lingualatina.github.io/texts/browsable/hyginus/9pr/	9pr.3	9pr.3.7	uenantes	participle: present active feminine nominative plural	ls.n50445:venor
https://lingualatina.github.io/texts/browsable/hyginus/9pr/	9pr.3	9pr.3.7	uenantes	participle: present active feminine accusative plural	ls.n50445:venor
https://lingualatina.github.io/texts/browsable/hyginus/9pr/	9pr.3	9pr.3.7	uenantes	participle: present active feminine vocative plural	ls.n50445:venor
https://lingualatina.github.io/texts/browsable/hyginus/9pr/	9pr.3	9pr.3.8	sagittis	noun: feminine dative plural	ls.n42264:sagitta
https://lingualatina.github.io/texts/browsable/hyginus/9pr/	9pr.3	9pr.3.8	sagittis	noun: feminine ablative plural	ls.n42264:sagitta
https://lingualatina.github.io/texts/browsable/hyginus/9pr/	9pr.3	9pr.3.9	interfecit	finite verb: third singular perfect indicative active	ls.n24257:interficio
https://lingualatina.github.io/texts/browsable/hyginus/9pr/	9pr.3	9pr.3.10	in	uninflected preposition	ls.n22111:in1
https://lingualatina.github.io/texts/browsable/hyginus/9pr/	9pr.3	9pr.3.11	monte	noun: masculine ablative singular	ls.n29604:mons
https://lingualatina.github.io/texts/browsable/hyginus/9pr/	9pr.3	9pr.3.12	Sipylo		ls.null
https://lingualatina.github.io/texts/browsable/hyginus/9pr/	9pr.3	9pr.3.12_0	,		ls.null
https://lingualatina.github.io/texts/browsable/hyginus/9pr/	9pr.3	9pr.3.13	et	uninflected conjunction	ls.n16278:et
https://lingualatina.github.io/texts/browsable/hyginus/9pr/	9pr.3	9pr.3.14	Diana	noun: feminine nominative singular	ls.n13731:Diana
https://lingualatina.github.io/texts/browsable/hyginus/9pr/	9pr.3	9pr.3.14	Diana	noun: feminine ablative singular	ls.n13731:Diana
https://lingualatina.github.io/texts/browsable/hyginus/9pr/	9pr.3	9pr.3.14	Diana	noun: feminine vocative singular	ls.n13731:Diana
https://lingualatina.github.io/texts/browsable/hyginus/9pr/	9pr.3	9pr.3.15	filias	noun: feminine accusative plural	ls.n18173:filia
https://lingualatina.github.io/texts/browsable/hyginus/9pr/	9pr.3	9pr.3.16	in	uninflected preposition	ls.n22111:in1
https://lingualatina.github.io/texts/browsable/hyginus/9pr/	9pr.3	9pr.3.17	regia	adjective: feminine nominative singular positive	ls.n40905:regius
https://lingualatina.github.io/texts/browsable/hyginus/9pr/	9pr.3	9pr.3.17	regia	adjective: feminine ablative singular positive	ls.n40905:regius
https://lingualatina.github.io/texts/browsable/hyginus/9pr/	9pr.3	9pr.3.17	regia	adjective: feminine vocative singular positive	ls.n40905:regius
https://lingualatina.github.io/texts/browsable/hyginus/9pr/	9pr.3	9pr.3.17	regia	adjective: neuter nominative plural positive	ls.n40905:regius
https://lingualatina.github.io/texts/browsable/hyginus/9pr/	9pr.3	9pr.3.17	regia	adjective: neuter accusative plural positive	ls.n40905:regius
https://lingualatina.github.io/texts/browsable/hyginus/9pr/	9pr.3	9pr.3.17	regia	adjective: neuter vocative plural positive	ls.n40905:regius
https://lingualatina.github.io/texts/browsable/hyginus/9pr/	9pr.3	9pr.3.18	sagittis	noun: feminine dative plural	ls.n42264:sagitta
https://lingualatina.github.io/texts/browsable/hyginus/9pr/	9pr.3	9pr.3.18	sagittis	noun: feminine ablative plural	ls.n42264:sagitta
https://lingualatina.github.io/texts/browsable/hyginus/9pr/	9pr.3	9pr.3.19	interemit		ls.null
https://lingualatina.github.io/texts/browsable/hyginus/9pr/	9pr.3	9pr.3.20	praeter	uninflected preposition	ls.n38069:praeter
https://lingualatina.github.io/texts/browsable/hyginus/9pr/	9pr.3	9pr.3.20	praeter	adverb: positive degree	ls.n38069:praeter
https://lingualatina.github.io/texts/browsable/hyginus/9pr/	9pr.3	9pr.3.21	Chloridem		ls.null
https://lingualatina.github.io/texts/browsable/hyginus/9pr/	9pr.3	9pr.3.21_0	.		ls.null
https://lingualatina.github.io/texts/browsable/hyginus/9pr/	9pr.3	9pr.3.22	at	uninflected conjunction	ls.n4220:at
https://lingualatina.github.io/texts/browsable/hyginus/9pr/	9pr.3	9pr.3.23	genetrix		ls.null
https://lingualatina.github.io/texts/browsable/hyginus/9pr/	9pr.3	9pr.3.24	liberis	adjective: masculine dative plural positive	ls.n26465:liber1
https://lingualatina.github.io/texts/browsable/hyginus/9pr/	9pr.3	9pr.3.24	liberis	adjective: masculine ablative plural positive	ls.n26465:liber1
https://lingualatina.github.io/texts/browsable/hyginus/9pr/	9pr.3	9pr.3.24	liberis	adjective: feminine dative plural positive	ls.n26465:liber1
https://lingualatina.github.io/texts/browsable/hyginus/9pr/	9pr.3	9pr.3.24	liberis	adjective: feminine ablative plural positive	ls.n26465:liber1
https://lingualatina.github.io/texts/browsable/hyginus/9pr/	9pr.3	9pr.3.24	liberis	adjective: neuter dative plural positive	ls.n26465:liber1
https://lingualatina.github.io/texts/browsable/hyginus/9pr/	9pr.3	9pr.3.24	liberis	adjective: neuter ablative plural positive	ls.n26465:liber1
https://lingualatina.github.io/texts/browsable/hyginus/9pr/	9pr.3	9pr.3.24	liberis	finite verb: second singular present indicative passive	ls.n26488:libet
https://lingualatina.github.io/texts/browsable/hyginus/9pr/	9pr.3	9pr.3.25	orba		ls.null
https://lingualatina.github.io/texts/browsable/hyginus/9pr/	9pr.3	9pr.3.26	flendo	gerundive: masculine dative singular	ls.n18355:fleo
https://lingualatina.github.io/texts/browsable/hyginus/9pr/	9pr.3	9pr.3.26	flendo	gerundive: masculine ablative singular	ls.n18355:fleo
https://lingualatina.github.io/texts/browsable/hyginus/9pr/	9pr.3	9pr.3.26	flendo	gerundive: neuter dative singular	ls.n18355:fleo
https://lingualatina.github.io/texts/browsable/hyginus/9pr/	9pr.3	9pr.3.26	flendo	gerundive: neuter ablative singular	ls.n18355:fleo
https://lingualatina.github.io/texts/browsable/hyginus/9pr/	9pr.3	9pr.3.26	flendo	gerund: dative	ls.n18355:fleo
https://lingualatina.github.io/texts/browsable/hyginus/9pr/	9pr.3	9pr.3.26	flendo	gerund: ablative	ls.n18355:fleo
https://lingualatina.github.io/texts/browsable/hyginus/9pr/	9pr.3	9pr.3.27	lapidea		ls.null
https://lingualatina.github.io/texts/browsable/hyginus/9pr/	9pr.3	9pr.3.28	facta	participle: perfect passive feminine nominative singular	ls.n17516:facio
https://lingualatina.github.io/texts/browsable/hyginus/9pr/	9pr.3	9pr.3.28	facta	participle: perfect passive feminine ablative singular	ls.n17516:facio
https://lingualatina.github.io/texts/browsable/hyginus/9pr/	9pr.3	9pr.3.28	facta	participle: perfect passive feminine vocative singular	ls.n17516:facio
https://lingualatina.github.io/texts/browsable/hyginus/9pr/	9pr.3	9pr.3.28	facta	participle: perfect passive neuter nominative plural	ls.n17516:facio
https://lingualatina.github.io/texts/browsable/hyginus/9pr/	9pr.3	9pr.3.28	facta	participle: perfect passive neuter accusative plural	ls.n17516:facio
https://lingualatina.github.io/texts/browsable/hyginus/9pr/	9pr.3	9pr.3.28	facta	participle: perfect passive neuter vocative plural	ls.n17516:facio
https://lingualatina.github.io/texts/browsable/hyginus/9pr/	9pr.3	9pr.3.29	esse	infinitive: present active	ls.n46529:sum1
https://lingualatina.github.io/texts/browsable/hyginus/9pr/	9pr.3	9pr.3.30	dicitur	finite verb: third singular present indicative passive	ls.n13804:dico2
https://lingualatina.github.io/texts/browsable/hyginus/9pr/	9pr.3	9pr.3.31	in	uninflected preposition	ls.n22111:in1
https://lingualatina.github.io/texts/browsable/hyginus/9pr/	9pr.3	9pr.3.32	monte	noun: masculine ablative singular	ls.n29604:mons
https://lingualatina.github.io/texts/browsable/hyginus/9pr/	9pr.3	9pr.3.33	Sipylo		ls.null
https://lingualatina.github.io/texts/browsable/hyginus/9pr/	9pr.3	9pr.3.33_0	,		ls.null
https://lingualatina.github.io/texts/browsable/hyginus/9pr/	9pr.3	9pr.3.35	hodie	adverb: positive degree	ls.n20829:hodie
https://lingualatina.github.io/texts/browsable/hyginus/9pr/	9pr.3	9pr.3.36	lacrimae	noun: feminine nominative plural	ls.n25559:lacrima
https://lingualatina.github.io/texts/browsable/hyginus/9pr/	9pr.3	9pr.3.36	lacrimae	noun: feminine genitive singular	ls.n25559:lacrima
https://lingualatina.github.io/texts/browsable/hyginus/9pr/	9pr.3	9pr.3.36	lacrimae	noun: feminine dative singular	ls.n25559:lacrima
https://lingualatina.github.io/texts/browsable/hyginus/9pr/	9pr.3	9pr.3.36	lacrimae	noun: feminine vocative plural	ls.n25559:lacrima
https://lingualatina.github.io/texts/browsable/hyginus/9pr/	9pr.3	9pr.3.37	manare		ls.null
https://lingualatina.github.io/texts/browsable/hyginus/9pr/	9pr.3	9pr.3.38	dicuntur	finite verb: third plural present indicative passive	ls.n13804:dico2
https://lingualatina.github.io/texts/browsable/hyginus/9pr/	9pr.3	9pr.3.38_0	.		ls.null